,prices,address,links,bed,type,baths,sq_feet,Listing Agent Name,Listing Agent Contact,Listing Agent Company,Description,Key Word
0,"$282,900","4917 Whisper Ln, Sacramento, CA 95841",https://www.zillow.com/homedetails/4917-Whisper-Ln-Sacramento-CA-95841/26020770_zpid/,3, Condo,3,"1,434",Suneet Agarwal,,Big Block Realty North,"Welcome to this 2 story 3 bedroom, 2.5 bathroom condominium for sale in Sacramento. The main level includes a combined living and dining room that offers dark wood floors, access to the back patio, and a fireplace. The kitchen is updated with marble countertops, tile splash surround, and stainless steel appliances. The main level includes a private half bathroom as well. The bedrooms, full bathrooms, and laundry room are located on the second level. The primary bedroom offers carpet floors, private outdoor balcony, and en suite bathroom. The primary bathroom is attached to the second full bathroom. The primary bathroom offers updated sink, shower stall, but next to a bathtub with overhead shower in second bathroom.",stainless
1,"$599,900","471 Adams Ave, Escondido, CA 92026",https://www.zillow.com/homedetails/471-Adams-Ave-Escondido-CA-92026/16691455_zpid/,3, House,1,"1,234",Justin Tye,,Active Realty,"Lovely 3 bedroom, 1 bathroom, single story home on a large lot with RV parking in the community of North Escondido! Enjoy laminate wood flooring, ceiling fans, and an open kitchen. The kitchen features stainless steel appliances, elegant wood cabinetry, a breakfast nook, and views to the outdoors. The bedrooms offer ample closet space and a shower-in-tub in the bathroom. Additional property highlights include garage laundry hookups, a 1 car garage, and no HOA. Convenient to area schools, nearby parks, shopping plazas, and easy access to major freeways!",stainless
2,"$479,900","7241 Windjammer Way, Citrus Heights, CA 95621",https://www.zillow.com/homedetails/7241-Windjammer-Way-Citrus-Heights-CA-95621/25980597_zpid/,4, House,3,"1,522",Suneet Agarwal,,Big Block Realty North,"Welcome to this 2 story 4 bedroom, 2.5 bathroom for sale in Citrus Heights. The entrance of this home offers a family room with some natural lighting and a brick fireplace. The kitchen and dining room are combined but offer different flooring. The kitchen includes laminate floors, granite countertops, stainless steel appliances, and updated cabinets. The dining room offers carpet floors, access to the backyard, and located next to a private half bathroom. The second level includes the bedrooms and bathrooms. The primary bedroom is the largest bedroom and includes a private outdoor balcony and en suite bathroom. The primary bathroom offers laminate floors, double closets, and a shower stall.",stainless
3,"$506,000","191 Racquet Club Dr, Compton, CA 90220",https://www.zillow.com/homedetails/191-Racquet-Club-Dr-Compton-CA-90220/21005338_zpid/,3, Townhouse,3,"1,848",John Maseredjian,,Johnhart Corp.,"In the city center of Compton, minutes away from large shopping centers with stores and well-known schools such Compton High School, sits a 1,848 sqft, 3-bedroom, 2.5-bathroom home, ready for the next buyer to settle and make their mark. A paved walkway, surrounded by greenery and a lawn, leads to the front door and upon entering you are greeted with a spacious yet cozy home that has combination of tile and carpet flooring. An open floor layout in the living room, coupled with the fireplace and the easy flow to the kitchen, makes the whole space the perfect entertainer’s venue for hosting guests. Kitchen includes beautiful finishes such as taupe toned granite countertops that expand up to the backsplash, walnut toned cabinetry and stainless-steel appliances that are built in. A hallway, with access from the kitchen as well, leading to the second-floor bedrooms, three of which have laminate flooring and built-in closets, and one of which is the primary bedroom that has carpet flooring and an en suite bathroom. Access from the living room to the spacious backyard patio, with room to build a gazebo or a covered patio and to set up outdoor furniture. Finally, home includes direct access to an attached 2 car garage, and an individual closet with a washer/dryer hookup.",stainless
4,"$626,900","1225 Tiverton Ln, Lincoln, CA 95648",https://www.zillow.com/homedetails/1225-Tiverton-Ln-Lincoln-CA-95648/68560397_zpid/,4, House,3,"2,052",Suneet Agarwal,,Big Block Realty North,"Welcome to this 4 bedroom, 3 bathroom home for sale in Lincoln. The formal dining room offers updated laminate floors and a large window for natural lighting. The kitchen includes granite countertops, stainless steel appliances, and built-in desk. The family room is combined with the kitchen and offers a fireplace and access to the backyard. The primary bedroom is the largest bedroom and offers an ensuite bathroom with dual sinks, private toilet, bathtub, and shower stall.",stainless
5,"$365,900","4800 Westlake Pkwy UNIT 2702, Sacramento, CA 95835",https://www.zillow.com/homedetails/4800-Westlake-Pkwy-UNIT-2702-Sacramento-CA-95835/64708515_zpid/,2, Condo,2,"1,304",Suneet Agarwal,,Big Block Realty North,"Welcome to this multi-level 2 bedroom, 2 bathroom condominium for sale in Sacramento. The ground level offers access to the 1 care garage. The main level offers the combined kitchen and family room which includes access to the outdoor balcony. The kitchen offers stainless steel appliances, tile countertops, and a small dining bar. A bedroom, full bathroom, and laundry room is located on this level as well. The primary bedroom and bathroom are located on the upper level. The primary bedroom offers carpet floors and some natural lighting. The primary bathroom offers dual sinks, private toilet, bathtub with overhead shower, and tile floors.",stainless
6,"$1,298,000","13 Somerset, Trabuco Canyon, CA 92679",https://www.zillow.com/homedetails/13-Somerset-Trabuco-Canyon-CA-92679/25619107_zpid/,4, House,3,"2,592",Justin Tye,,Active Realty,"Gorgeous 4 bedroom, 3 bathroom, 2 story home with a sparkling swimming pool and spa in the guard gated community of Dove Ridgepointe in the Dove Canyon area of Rancho Santa Margarita! Enjoy a formal entry with cathedral ceilings, a cascading staircase to the second story, a formal dining room, a fireplace in the living room and family room, and a gourmet kitchen. The kitchen features a quaint center island, granite countertops, stainless steel appliances, and elegant white cabinetry. The primary bedroom offers a walk-in closet, dual vanities in the primary bathroom, a soaking tub, and a walk-in shower. Sliding doors lead to the covered outdoor patio, back yard, swimming pool, spa, and gazebo with plenty of room for entertaining. Additional property highlights include ceiling fans, a full-size laundry room, and a 2 car garage. Community amenities include a swimming pool, spa, playground, tennis courts, golf course, and more. Convenient to area schools, a short drive to shopping plazas, restaurants, markets, and easy access to The Toll Roads!",stainless
7,"$617,100","1291 Castledale St, Riverside, CA 92501",https://www.zillow.com/homedetails/1291-Castledale-St-Riverside-CA-92501/69281599_zpid/,5, House,3,"2,686",Justin Tye,,Active Realty,"Lovely 5 bedroom, 3 bathroom, 2 story home with a main floor bedroom and peek mountain views in the gated community of Canterbury Place in Riverside! Enjoy high ceilings, a see-through fireplace connecting to the living and family rooms, and an open, gourmet kitchen. The kitchen features a center island, granite countertops, stainless steel appliances, and a breakfast nook. The primary bedroom offers a walk-in closet, dual vanities in the primary bathroom, a soaking tub, and a walk-in shower. A panel door leads to the covered outdoor patio and back yard. Additional property highlights include a loft, a laundry room, and a 2 car garage. Convenient to area schools, nearby parks, and easy access to major freeways!",stainless
8,"$727,900","5 Attleboro St, Ladera Ranch, CA 92694",https://www.zillow.com/homedetails/5-Attleboro-St-Ladera-Ranch-CA-92694/63117595_zpid/,3, Condo,3,"1,560",Justin Tye,,Active Realty,"Beautiful 3 bedroom, 2.5 bathroom, 2 story condo in the community of Davenport in Ladera Ranch! Enjoy a charming front porch entry to a spacious floor plan with an inviting fireplace in the family room. The kitchen features a breakfast bar, stainless steel appliances, and white cabinetry. The primary bedroom offers carpet flooring and a panel door that leads to the neighborhood view balcony. The primary bathroom features a soaking tub and a walk-in shower. Additional property highlights include ceiling fans, an inside laundry room, and a 2 car garage. Community amenities include swimming pools, spa, playgrounds, an outdoor barbecue area, a fire pit, picnic areas, and more. The Ladera Ranch community is a Master Planned Development with waterslides, a dog park, a clubhouse, and more. Convenient to nearby schools, area parks, and a short drive to major freeways and The Toll Roads!",stainless
9,"$400,000","3000 Associated Rd UNIT 63, Fullerton, CA 92835",https://www.zillow.com/homedetails/3000-Associated-Rd-UNIT-63-Fullerton-CA-92835/25715464_zpid/,2, Condo,2,851,Alex Horowitz,,Coldwell Banker Diamond,"Well Sought After Park Ridge Condo in Fullerton! This 2 bedroom (Dual primary suites), 2 bathroom condo is approximately 851 square feet, located upstairs so nobody is above you, has an assigned parking space + 1 car garage and is centrally located within the gated community. The condo features wood flooring, recessed lighting and a large front patio. The main primary suite offers a spacious walk-in closet and a spacious bathroom with an over-sized walk-in glass shower. The secondary primary suite features dual closets and full bathroom with a walk-in shower. The kitchen is spacious and complimented with white wood cabinetry, stainless steel appliances, bar top seating as well as a dining area. The Park Ridge Community is gated for added privacy, features a pool and spa and is located across the street from Craig Park featuring a lake, walking trails, a sports complex and more! On the border of Fullerton and Brea, this condo has many dining, shopping and entertainment options to choose from! Want to see more? Schedule your private tour today!",stainless
10,"$644,900","1305 Barrington Ln, Lincoln, CA 95648",https://www.zillow.com/homedetails/1305-Barrington-Ln-Lincoln-CA-95648/63434613_zpid/,4, House,2,"1,982",Suneet Agarwal,,Big Block Realty North,"Welcome to this 4 bedroom, 2 bathroom home for sale in Lincoln. The combined dining and living room offer updated tile floors and some natural lighting. The kitchen and family room are combined but offer mixed flooring of hardwood and tile floors. The kitchen includes a dining bar, stainless steel appliances, and updated cabinets. The family room includes a fireplace and access to the backyard. The primary bedroom is the largest bedroom and offers wood floors, access to the backyard and an ensuite bathroom. The primary bathroom offers dual sinks, separate bathtub and showerstall, and private toilet.",stainless
11,"$875,900","1987 Bucknell St, Chula Vista, CA 91913",https://www.zillow.com/homedetails/1987-Bucknell-St-Chula-Vista-CA-91913/17142653_zpid/,4, House,3,"1,838",Justin Tye,,Active Realty,"Lovely 4 bedroom, 2.5 bathroom, 2 story home with a sparkling swimming pool and spa in the community of College Estates in Chula Vista! Enjoy high ceilings, a living room, dining room, and family room. The kitchen features granite countertops, stainless steel appliances, and views to the outdoors. The family room offers an inviting fireplace and sliding doors to the covered outdoor patio, pool, spa, and back yard. The primary bedroom features French doors to the upper level outdoor view patio and mirrored closet doors. Additional property highlights include garage laundry hookups, a 2 car garage, and no HOA. Convenient to area schools, nearby parks, and easy access to major freeways!",stainless
12,"$651,200","9410 Rifton Ct, Elk Grove, CA 95758",https://www.zillow.com/homedetails/9410-Rifton-Ct-Elk-Grove-CA-95758/25912424_zpid/,4, House,3,"1,946",Suneet Agarwal,,Big Block Realty North,"Welcome to this 2 story 4 bedroom, 2.5 bathroom home for sale in Elk Grove. The entrance of the home offers a combined living room and dining room that offers carpet floors, lots of windows and chandelier lights. The kitchen offers tile floors, tile countertops, stainless steel appliances, and a breakfast nook area. Next to the breakfast nook is the family room with dark tile floors, a fireplace, and access to the backyard which includes a built-in swimming pool. The main level also includes a private half bathroom. The second level includes the bedrooms and bathrooms. The primary bedroom is the largest bedroom and includes double doors and an en suite bathroom. The primary bathroom includes dual sinks, laminate floors, private toilet, and bathtub with overhead shower.",stainless
13,"$574,900","3677 Saintsbury Dr, Sacramento, CA 95834",https://www.zillow.com/homedetails/3677-Saintsbury-Dr-Sacramento-CA-95834/51598329_zpid/,4, House,2,"1,659",Suneet Agarwal,,Big Block Realty North,"Welcome to this 4 bedroom, 2 bathroom home for sale in Sacramento. The kitchen offers updated granite countertops, stainless steel appliances, and dining bar. The dining room and family room are combined and offer mixed floors and a fireplace. The primary bedroom is the largest bedroom and offers laminate floors, access to the backyard, and an en suite bathroom. The bathroom offers dual sinks, private toilet, and bathtub with overhead shower.",stainless
14,"$903,900","7224 Courtney Dr, San Diego, CA 92111",https://www.zillow.com/homedetails/7224-Courtney-Dr-San-Diego-CA-92111/16937967_zpid/,3, House,2,"1,075",Justin Tye,,Active Realty,"Beautiful 3 bedroom, 2 bathroom, single story home with a swimming pool and spa in the community of Mission Heights in the Linda Vista area of San Diego! Enjoy a spacious floor plan with laminate and carpet flooring. The family room features an inviting fireplace, sliding doors to the attached sun room, and flows to the kitchen. The kitchen offers light wood cabinetry, corian countertops, and stainless steel appliances. The bedrooms feature ample closet space and a shower-in-tub in the primary bathroom. A panel door leads to the covered outdoor patio, pool, spa, and back yard. Additional property highlights include paid solar panels, garage laundry hookups, a 2 car garage, and no HOA. Convenient to area shopping plazas, restaurants, Balboa Park, downtown San Diego, and easy access to major freeways!",stainless
15,"$979,900","5013 Conrad Ave, San Diego, CA 92117",https://www.zillow.com/homedetails/5013-Conrad-Ave-San-Diego-CA-92117/16853525_zpid/,5, House,2,"1,434",Justin Tye,,Active Realty,"Lovely 5 bedroom, 2 bathroom, single story home with a sparkling swimming pool in the community of Clairemont Mesa in San Diego! Enjoy laminate wood flooring, an inviting fireplace, and barn door accents. The kitchen features granite countertops, stainless steel appliances, and a breakfast nook. The bedrooms feature large closets with an elegant shower-in-tub in the primary bathroom. Sliding doors lead to the outdoor patio, swimming pool, and back yard with a covered loggia and a built-in barbecue. Additional property highlights include ceiling fans, garage laundry hookups, a 1 car garage, and no HOA. Convenient to nearby schools, shopping plazas, parks, and major freeways!",stainless
16,"$810,900","470 Avocado Ave, Pasadena, CA 91107",https://www.zillow.com/homedetails/470-Avocado-Ave-Pasadena-CA-91107/20878176_zpid/,2, House,1,782,John Maseredjian,,Johnhart Corp.,"In the heart of Pasadena, minutes away from Pasadena City College and other attractions such as LA Fitness, Dog Parks and Eaton Canyon Hiking trail sits a 782 sqft, 2-bedroom, 1-bathroom single family home, move in ready for any kind of buyer to make their mark. A large and paved driveway, surrounded by landscaping, leads to the front covered patio of the home and upon entering you are greeted with a combination of laminate and tile flooring throughout the cozy home. A large eat in kitchen immediately left of entry that’s very nicely finished and includes walnut tone cabinetry, granite countertop and built-in stainless-steel appliances. A hallway, following the living room, that leads to the sleeping area and to two bedrooms shared by a bathroom, both of which have built in closets. Access from the living room to the side patio that extends out to the backyard, with tons of room to build a pool, a covered patio, or a gazebo. Finally, home includes an attached 2 car tandem garage, with access from the side yard, and a laundry/dryer hookup.",stainless
17,"$439,900","857 Princeton Ct, Woodland, CA 95695",https://www.zillow.com/homedetails/857-Princeton-Ct-Woodland-CA-95695/16528585_zpid/,2, House,2,"1,310",Suneet Agarwal,,Big Block Realty North,"Welcome to this 2 bedroom, 2 bathroom home for sale in Woodland. This home has been updated to create an open-style concept. The family room, breakfast nook, and kitchen are all combined with laminate floors, access to the backyard, and a fireplace. The kitchen includes a stainless steel sink, natural lighting, and an island dining bar. Through the hallway are the bedrooms, bathrooms, and laundry area. The primary bedroom is the largest bedroom and includes an en suite bathroom. The bathroom offers tile floor, marble sink, and a shower stall.",stainless
18,"$556,000","3682 Nile St UNIT 7, San Diego, CA 92104",https://www.zillow.com/homedetails/3682-Nile-St-UNIT-7-San-Diego-CA-92104/16957682_zpid/,2, Townhouse,1,782,Justin Tye,,Active Realty,"Beautiful 2 bedroom, 1 bathroom, upper level, single story condo in the community of North Park in San Diego! Enjoy a light, bright floor plan with laminate wood flooring and recessed lighting. The kitchen features granite countertops, stainless steel appliances, and a small breakfast bar. The bedrooms offer ample closet space and a shower-in-tub in the   bathroom. Additional property highlights include a 1 car detached garage. Community amenities include a laundry room. Convenient to North Park area restaurants, shopping, markets, and easy access to major freeways!",stainless
19,"$850,000","25436 Plaza Escovar, Santa Clarita, CA 91355",https://www.zillow.com/homedetails/25436-Plaza-Escovar-Santa-Clarita-CA-91355/20222579_zpid/,4, House,3,"2,192",Cherrie Brown,,NextHome Real Estate Rockstars,"Remodeled 4+3 Valencia Old Orchard II Cul De Sac Home on a Large Lot with Low HOA and No Mello-Roos!!! The interior highlights plantation shutters, and newer dual pane windows. Enter through the double doors to find a spacious light and bright living and dining with high ceilings, and a custom fireplace. Eat-in cooks kitchen with stainless steel appliances, granite counters, lots of storage and opens to the family room. The family room highlights a stunning brick fireplace with mantel, built-in features, sliders leading to the yard, and there is a powder room for guests right off of the family room. Head up to the second level to find a good-sized primary suite with an adjacent retreat that was the 4th bedroom and can easily be converted back to the 4th, upgraded vanity and storage, and a glass-enclosed walk-in shower. Three spacious bedrooms, and a full-size bathroom to share. Step outside to the private lush entertainer’s yard with a huge covered patio, and large grassy area. HOA amenities include Clubhouse, Pool, Park and Tot Lot. Close to Award Winning Schools, Shopping, Restaurants, and Easy Freeway Access and much much more! Don’t miss the opportunity to make this your NEXT HOME!",stainless
20,"$449,950","4922 Moss Creek Cir, Stockton, CA 95219",https://www.zillow.com/homedetails/4922-Moss-Creek-Cir-Stockton-CA-95219/15315097_zpid/,3, House,2,"1,292",Pat Holkesvig,209-862-8049,Keller Williams Realty,"Single story 3 bedroom, 2 bath Brookside West home on corner lot. No HOA! Open floor plan. Lots of natural light. Vaulted ceiling, skylights, and fireplace in living room. Eat-in kitchen features stainless appliances, glass top stove, refrigerator, island with brunch bar, and double sink. Master bedroom with private bath and walk-in closet. Ceiling fans. Inside laundry. Freshly painted interior and new carpet. Neutral colors throughout. New garage door. Spacious backyard with large concrete patio and pergola is perfect for entertaining. Gate to backyard provides access for RV or boat parking!",stainless
21,"$616,000","3548 Delta Ave, Long Beach, CA 90810",https://www.zillow.com/homedetails/3548-Delta-Ave-Long-Beach-CA-90810/21245895_zpid/,3, House,2,"1,254",David Landeros,,West Associates,"Don't miss your opportunity on this single family home on the Upper Westside close to parks, schools and more!  This three bedroom, two bathroom home has open floor plan with the kitchen opening up to the living room and direct access to the backyard.  The sellers made some great upgrades (just under two years ago!) to include new: engineered hardwood throughout (with tile in the bathrooms), baseboards, interior and exterior paint, plumbing, stainless steel sink with faucet, stainless steel appliances, roof over the den/bonus room, window screens and custom heat/cold resistant blinds throughout, keyless driveway gate for privacy with matching garage door, Ring Doorbell and cameras, ductless heating/cooling systems, light fixtures, ceiling fans, the addition of a 3/4 bathroom converting the master to an en-suite, backyard firepit/grill area, addition to the rear of the garage for additional storage space and a reverse osmosis purified drinking water system in the kitchen.  The home itself sits on over 5000 sqft (ADU ready!).  Close to Silverado & Tanaka Park, shopping, entertainment, freeways, downtown Long Beach (even more shopping, dining and entertainment!), the harbor and the beautiful south facing beaches of Long Beach.  This one won't last!  Contact us today for a private showing.",stainless
22,"$974,990","32344 Alpine Ct, Temecula, CA 92592",https://www.zillow.com/homedetails/32344-Alpine-Ct-Temecula-CA-92592/79836749_zpid/,6, House,5,"3,733",Kimberly Meeker,,"eXp Realty of California, Inc.","Gorgeous executive cul de sac home located in the highly desirable Redwood Collection of Wolf Creek. Enter through the beautiful entry joined by your formal living & dining room complete with porcelain tile & plantation shutters. Hardwood floors lead guests to the gracious family room with gas fireplace & media niche. Experience the joy of cooking in this fully-equipped kitchen with stainless steel appliances, built in double ovens, gas 5 burner cooktop, granite counters, supersize island with gorgeous pendant lighting, and freshly restored white cabinets. The eat in breakfast nook features a homework & computer area, a place to enjoy family & company while you cook. Nostalgic butler's pantry conveniently stores cookware, dishes and staples. This spacious executive home offers 6 full size bedrooms & a super media loft, main floor nanny's suite or office w full bath & door that leads to your tranquil backyard. The media loft is perfect for watching movies, a spot for reading, writing, or just to catch up on correspondence & relax. Suite retreat! Situated for privacy this amazing master suite offers his & her closets, a gorgeous grand master bath with separate vanities, bath & separate shower. Secondary bedrooms have their own wing in the home with two baths & a second floor laundry room. Two bedrooms enjoy an airy view of the outside with their own doors leading to a balcony. Serenity is the mood of the spacious backyard. Enjoy relaxing in the backyard sipping on lemonade under the patio cover or around the built-in fire pit while visiting with family & friends. Come take a look! Stay tuned for more photos and video!",stainless
23,"$701,000","4320 Kerkyra Ct, Rancho Cordova, CA 95742",https://www.zillow.com/homedetails/4320-Kerkyra-Ct-Rancho-Cordova-CA-95742/67821892_zpid/,4, House,3,"2,811",Suneet Agarwal,,Big Block Realty North,"Welcome to this 2 story 4 bedroom, 3 bathroom home for sale in Sacramento. The main level includes a formal study room and full bathroom. The kitchen and family room are combined and offer natural lighting and access to the backyard. The kitchen includes stainless steel appliances, an island sink, and tile floors. The upper level includes the bedrooms and bathrooms. The primary bedroom is the largest bedroom and includes a very large walk-in closet and an ensuite bathroom. The primary bathroom offers dual sinks, separate bathtub and shower stall, and private toilet.",stainless
24,"$861,300","1302 P St, Sacramento, CA 95814",https://www.zillow.com/homedetails/1302-P-St-Sacramento-CA-95814/54909070_zpid/,2, Condo,3,"1,801",Suneet Agarwal,,Big Block Realty North,"Welcome to this multi-level 2 bedroom, 3 bathroom condominium for sale in Sacramento. The first floor offers a family room with carpet floors, full bathroom with a bathtub and overhead shower, and access to the 2 car garage. The second level offers a combined dining and family room with updated laminate floors, some natural lighting, and a fireplace. The kitchen is updated with stainless steel appliances, splash surround, cabinets, and a breakfast nook area that leads to a private outdoor balcony. This level also includes a bedroom and full bathroom. The upper level offers the primary bedroom and bathroom. The large bedroom offers laminate floors and natural lighting. The en suite bathroom includes dual sinks, a walk-in closet, and private toilet.",stainless
