,prices,address,links,bed,type,baths,sq_feet,Listing Agent Name,Listing Agent Contact,Listing Agent Company,Description,Key Word
84,"$689,900","2021 Mission Blvd, Santa Rosa, CA 95409",https://www.zillow.com/homedetails/2021-Mission-Blvd-Santa-Rosa-CA-95409/15870532_zpid/,3, House,2,"1,391",Karen Maxwell,707-536-1416,MaxPro Real Estate,"Charming Rincon Valley 3br/2ba home with convenient access to many desirable destinations.  Beautifully remodeled butcher block kitchen includes new stainless refrigerator with island and shelves.  Laminate and tile flooring throughout.  Bonus room in garage is ideal for guests, play area, gym, hobbies, or home office. Open concept living area includes living room, kitchen, and fireplace in family room with outdoor access to partially covered patio opening to generous back yard with storage shed. Plenty of space and sunshine for relaxing, socializing, and harvesting... a true gardener's delight. Welcome home to this east Santa Rosa gem!",stainless
85,"$585,000","4402 Mentone St UNIT 107, San Diego, CA 92107",https://www.zillow.com/homedetails/4402-Mentone-St-UNIT-107-San-Diego-CA-92107/16966262_zpid/,2, Condo,2,844,Kristin R. Fries,,Tidal Realty,"LOCATION LOCATION LOCATION!!! This beautiful 2 bedroom 2 bath Ocean Beach condo has a fantastic open concept floor plan & ample natural light. Split Bedrooms (bedrooms on opposite ends) makes this a perfect home for a roommate situation. Fully Upgraded: Laminate flooring throughout, quartz countertops, newer cabinets, stainless steel appliances, recessed lighting, surround sound speakers, A/C & in-unit laundry. 2 parking spaces in gated garage + shed and balcony storage. WALK EVERYWHERE... mins away from sandy beaches, great restaurants, breweries, bars, and dog park/beach.",stainless
86,"$699,900","8180 Braddock Pl, San Diego, CA 92114",https://www.zillow.com/homedetails/8180-Braddock-Pl-San-Diego-CA-92114/17113987_zpid/,4, House,2,"1,234",Judi Reimer,,First Team Real Estate,"Stunning 4 bedroom, 2 bath home.  Kitchen has been updated with recessed lighting, shaker style cabinets, quartz countertop, beautiful custom tile backsplash and stainless steel appliances. Bathroom upgrades include new tile flooring, vanities and fixtures, full tile surround in Master bath. Additional features include laminate flooring in living room, hallway, kitchen, and laundry room. New ceiling fans in bedrooms and living room and a freshly painted interior and exterior. Attached 2 car garage with a large private backyard and covered patio. Home has paid off solar.",stainless
87,"$599,000","1940 N Highland Ave APT 46, Los Angeles, CA 90068",https://www.zillow.com/homedetails/1940-N-Highland-Ave-APT-46-Los-Angeles-CA-90068/20803976_zpid/,2, Condo,2,987,Pamela Rich,310-666-7424,Compass,"Come home to this white, bright two-bedroom, two-bath condo in the heart of Hollywood. You'll be minutes from all of the attractions, including Hollywood & Highland, the Hollywood Bowl, Mann's Chinese Theatre, and Runyon Canyon, and within easy reach of the 101 Freeway. The 980-square foot unit has been thoughtfully updated with white subway tile in both bathrooms, stainless steel kitchen appliances, washer-dryer in unit, wide-plank wood flooring in all rooms, and white stone countertops in kitchens/baths. Unit has a balcony and two-car covered parking. Building has a pool, guest parking and HOA fees of $645.35 *****OFFERS DUE BY NOON ON TUESDAY JAN 25TH 2022****",stainless
88,"$1,199,000","728 E Palmer Ave, Glendale, CA 91205",https://www.zillow.com/homedetails/728-E-Palmer-Ave-Glendale-CA-91205/20847277_zpid/,5, House,3,"1,913",Jessie Rodriguez,,CORCORAN GLOBAL LIVING,"Completely remodeled units in the prime area of Glendale. Located at the base of Adams Hill. This 3 unit property features a main detached home with 2 bedrooms, a full bath, dining area and kitchen with private laundry room that provides additional storage. The second unit above the garage consist of 2 bedrooms, a full bath, kitchenette, exterior pantry with a laundry room downstairs that also provide additional storage. The third unit is a guess house studio with kitchenette and 3/4 bathroom. All three units have been fully remodeled with all new plumbing, electrical, mini split heating/cooling, LVM flooring, exterior paint, interior paint, remodeled bathrooms, all new kitchens with stainless steel appliances. Units 2 and 3 were just reroofed, sewer line inspected and cleared, new front landscaping, new fences on the side and a back gate added for additional safety. The property also comes with 2 large storage sheds for added convenience. A large 2 car garage with plenty of parking on the driveway and street. Also located within the Horace Mann Elementary which was just rated a 9 out of 10. Conveniently located right between Palmer Park and Adams Square Mini Park. Located just a couple minutes from the Gallaeria/Americana shopping centers and 3 major freeways. This property was built to last!",stainless
89,"$497,500","6800 Corbin Ave UNIT 204, Reseda, CA 91335",https://www.zillow.com/homedetails/6800-Corbin-Ave-UNIT-204-Reseda-CA-91335/82867550_zpid/,2, Condo,2,"1,290",Hugh Finkle,,Hugh Richard Finkle,"Almost New - LUXURY CONDO! Built in 2007 - Just Remodeled. Outdoor covered patio with a great floor plan, (2) Large Master Bedroom's, each with Separate Bathrooms, Bonus Office/Utility Room Off Kitchen, Granite Kitchen Counters, Custom Tile Flooring, and Stainless Appliances. Features Distressed Laminate Hardwood Flooring, New Designer Carpet, Custom Moldings and Doors, Walk in Closets, and Washer/Dryer Hookups in Unit, Security Control Panel at Entrance to Unit.  Project has Secured Access Entry and Assigned Parking for Two Cars.",stainless
90,"$1,325,000","2703 Via Chinarros, Alpine, CA 91901",https://www.zillow.com/homedetails/2703-Via-Chinarros-Alpine-CA-91901/17060003_zpid/,4, House,4,"3,851",Gregg Phillipson,,Keller Williams Realty,"GORGEOUS SINGLE STORY 4 BEDROOM, 4 BATH HOME IN THE GATED COMMUNITY OF RANCHO PALO VERDE AND THIS ONE IS LOADED, INCLUDING HUGE EAT IN KITCHEN WITH GRANITE COUNTERS, DOUBLE OVENS, PANTRY AND STAINLESS APPLIANCES, HIGH CEILINGS, SKY LIGHTS, LOTS OF WINDOWS, VERY LIGHT AND BRIGHT,  LARGE FAMILY ROOM WITH FIRE PLACE AND VAULTED CEILINGS, HUGE MASTER SUITE WITH FIRE PLACE, MASTER BATH HAS SEPARATE TUB/SHOWER, DUAL VANITY AND WALK IN CLOSET, VERY SPACIOUS GUEST BEDROOMS, LONG PRIVATE DRIVEWAY LOCATED AT THE END OF A CUL-DE-SAC, POOL, SPA, WATER SLIDE, FIRE PIT, WELL, SOLAR, AMAZING PRIVACY, HUGE USABLE LOT, TONS OF EXTRA PARKING, 2.08 ACRES, STUNNING VIEWS TO THE OCEAN, AMAZING AMMENITIES WITHIN THE COMMUNITY, HORSE FACILITIES, LAKES, FISHING, TENNIS COURTS AND MUCH MORE.",stainless
91,"$549,000","28326 Hearthside Dr, Menifee, CA 92584",https://www.zillow.com/homedetails/28326-Hearthside-Dr-Menifee-CA-92584/59420323_zpid/,3, House,2,"2,091",Jodi Diago,,Corcoran Global Living-Murrieta,"Welcome Home to this gorgeous highly upgraded ever popular Delphi Model in the 55+ Gate Guarded Resort Style Community of the OASIS. This TRUE 3 bedroom home features Custom Plantation Shutters throughout , Wood Plank Tile Flooring, 7-8"" Crowne & Base Molding, and Custom fans. The Fantastic Chefs kitchen was remodeled to include (all ) new Stainless Smart Appliances, including a double oven and oversize stainless farm sink. Quartz Counters and extended Island with pull out drawers throughout. This elegant plan has coffered ceilings and a separate dining room for additional entertaining ! The Master Suite features Closet World built in Closet System. The Beautiful rear yard was professionally landscaped with extended patio, raised garden beds, new sprinklers & lighting. Full length alumawood patio cover with 6 privacy shades and two fans. The over size two car garage has multiple storage and separate Golf Cart parking area or workshop. Newer Water heater and many additional upgrades and improvements. HOA includes front yard maintenance & water as well as the trash service. Please view the Video provided for best viewing of the home and the OASIS Amenities!  Fabulous location approx.. one hour from Desert, Beaches and Mountains. Close to all new shopping, restaurants,  medical and  freeway access, Just a short drive to Temecula Wine Country! Don’t miss out on this  Beauty!",stainless
92,"$365,000","2889 Laurel St, Rosamond, CA 93560",https://www.zillow.com/homedetails/2889-Laurel-St-Rosamond-CA-93560/18967899_zpid/,5, House,4,"1,850",Gary Julian,661-483-8322,Help U Sell Julian Team,"TWO HOUSES ON ONE LOT. Both houses renovated. Per seller almost 1,850 sq ft with total 5 bed & 4 bath. Main home features 4 bed & 3 bath. Second home ''ADU'' with 1 bed, 1 bath and kitchen. Live in the main house and rent the guest house for perhaps $800 a month. Date of renovation completed September 2021. Both houses include the following brand new: water proof laminate flooring, kitchen with white shaker soft closing cabinets, large pantry, lazy Susan, stainless steel Samsung French door refrigerator with water/ ice dispenser, dual sink, Whirlpool over-the-stove microwave, dish washer, gas oven range and gorgeous grey Quartz counter top with metallic flakes. New bathroom vanities, bathtubs and mirrored closet doors. Ceiling fans in all rooms. Smooth ceiling with recessed lighting. Tankless water heater in both houses. New tinted tempered glass double paned windows with 2'' faux wood blinds. Large storage room. New evaporative cooler, heater, roof, exterior/ interior paint & more.",stainless
93,"$600,000","1226 Willowspring Ln, Corona, CA 92882",https://www.zillow.com/homedetails/1226-Willowspring-Ln-Corona-CA-92882/17772916_zpid/,3, Townhouse,3,"1,486",Patricia Figueroa,562-381-4207,eXp Realty of California Inc,"Location, location, Location!!!  This very desirable and highly sought after home in Corona’s central location. Enjoy your quite neighborhood with convenient 91 freeway access for commuters. This 3 bedroom 2.5 bath home offers  new flooring in first floor, a stunning upgraded kitchen with granite countertops, stainless steel appliances and MUCH MUCH MORE! Also offering a luxurious master bathroom with remodeled master bathroom. Relax and entertain outside under your covered patio with well maintained backyard featuring artificial turf. THIS HOUSE IS A MUST SEE!!!",stainless
94,"$1,098,000","26231 Sandcastle Ct, San Juan Capistrano, CA 92675",https://www.zillow.com/homedetails/26231-Sandcastle-Ct-San-Juan-Capistrano-CA-92675/54973441_zpid/,4, House,3,"2,245",Kathleen Kiang,,Regency Real Estate Brokers,"Welcome to Summer Walk in the coastal valley of San Juan Capistrano!  Summer Walk is a gated community of 25 homes built in the year 2000.  This fabulous home is situated on the corner lot of a small culdesac and features 3 bedrooms (the 3rd and 4th bedrooms have been combined into a large bonus or playroom with 2 closets and 2 large picture windows) in addition to a spacious loft that is perfect for an office or?  The interior has been freshly painted throughout with a soft grey palette that enhances the new designer carpet and handsome laminate flooring.  High ceilings and windows galore draw you into the living room and dining area.  The bright white gourmet kitchen features an island and new quartz countertops with a subway tile backsplash. You'll be cooking up a storm with all new stainless steel appliances, plus there's a new really big single bowl stainless steel sink, and new fixtures!  You can stock up on goodies in the convenient pantry!   The sunny breakfast nook is open to an expansive family room where you and the kiddies can gather around the cozy fireplace and the media niche.  Looking for a large master bedroom?  It's here!.....along with a huge walk-in closet!  In the master bath, there are dual vanities, a relaxing oval soaking tub, and a separate shower.  The upstairs hallway leading to the secondary bedrooms offers tons of storage cabinets!  The hall bath also has dual vanities and a tub-shower combination.  There is a separate laundry room downstairs that leads to the 2 car garage with a brand new epoxy coated floor!  The back and side yards (could be a potential dog run for Rover) have a manicured lawn and there are lovely English roses along the rear fence.  There is a small community park at the end of Beachcomber Lane where you can throw frisbees to Rover.  And no Mello Roos bonds here!  Enjoy close proximity to the beach, the quaint city center with great restaurants and shops, and the ""Jewel of California Missions,"" the historic Mission San Juan Capistrano ~ be there when the sparrows return!  Freeway access and the Amtrak are just minutes away!  Don't miss this Gem!",stainless
95,"$614,989","7781 Isabella Way, Gilroy, CA 95020",https://www.zillow.com/homedetails/7781-Isabella-Way-Gilroy-CA-95020/61324056_zpid/,2, House,2,"1,110",Tess Tan,408-813-9255,Keller Williams San Jose Gateway,"A great opportunity to live in this spectacular, serene, and tranquil area of the Village Green Senior Community for residents 62+. Buyers can be younger than 62, however, renter or occupant must be 62 or older. The Master bed/bath is located downstairs that is accessible to a patio with Sunsetter retractable awning, just a perfect way to relax and enjoy the backyard. Home is equipped with water softener that is included; gutter was installed with $4000 leaf filter; brand new, stainless steel, top of the line appliances, as well as a gorgeous and glaring chandelier included. Hardwood laminated flooring, window shutters, granite countertops, upgraded cabinetries, surely, a huge plus. The gated community has pool/spa to enjoy during the hot summer days. Walking trail, dog park, dining, shopping, golf course, wineries, are just minutes away.",stainless
96,"$819,000","646 Springfield Ave, Ventura, CA 93004",https://www.zillow.com/homedetails/646-Springfield-Ave-Ventura-CA-93004/16337261_zpid/,4, House,3,"1,577",Jessica Judd,,Keller Williams West Ventura County,"Welcome home! 4 Bedroom, 2.5 Bathroom home located in East Ventura! (RV Parking!)This sprawling, single level property boasts more upgrades than can be described! Luxury, vinyl plank flooring, refinished fireplace, recessed lighting, and an open concept layout greet you as you enter. The updated kitchen features concrete countertops, stainless steel appliances, and custom cabinetry.Primary bedroom includes two closets and an en suite, complete with double vanity and a gorgeous luxury shower.Walking distance to the Ventura aquatic center, bike paths, and quick freeway access to both the 101 and 126 freeway, you cannot beat this location!Recent upgrades include roof, furnace, ductwork, air conditioning, re-poured driveway, newer windows, exterior paint and MORE.Schedule an appointment today to get the full experience!",stainless
97,"$3,800,000","533 Via Media, Palos Verdes Estates, CA 90274",https://www.zillow.com/homedetails/533-Via-Media-Palos-Verdes-Estates-CA-90274/21340132_zpid/,4, House,4,"3,051",Robert Mullarkey,,"Robert Mullarkey, Broker","Beautiful 4 bedroom, 3.5 Bath home built in 1948, renovated in 2010 with stunning panoramic ocean and coastline views. Located in the highly sought after Malaga Cove area of the Palos Verdes Peninsula, this home features a gated courtyard entry with a beautiful south facing pool surrounded by a landscaped brick patio with mature trees. In addition, there's a large terrace with expansive ocean views for outdoor entertaining and relaxing. The updated kitchen features stone counter tops, hard wood floors and white wood cabinets with stainless steel appliances. The kitchen opens up to the family room and formal living room each with their own fireplaces. The master bedroom and updated bathroom are located on the main level with three additional bedrooms on lower level. A bonus room downstairs can be used as an office or laundry room. Hardwood and natural stone floors throughout. Extra large 2-car garage and property is fenced. Located on a 7,130 sq. ft. lot, walking distance from the beach and Palos Verdes Beach Club.",stainless
98,"$1,249,000","235 S Tower Dr UNIT 301, Beverly Hills, CA 90211",https://www.zillow.com/homedetails/235-S-Tower-Dr-UNIT-301-Beverly-Hills-CA-90211/20514366_zpid/,2, Condo,2,"1,533",Dafna Tene,818-331-0016,Century 21 Peak,"Welcome to this stunning front facing Penthouse unit in Beverly Hills. This elegant unit offers open bright floor plan, Large living room with cozy fireplace that leads you to a nice balcony with such beautiful views, incredible  dining area, high ceilings, newer stainless steel appliances in kitchen as well as wine fridge, lots of built in  cabinets, nice size breakfast area that leads you to an additional den, can also be used as an office,  spacious romantic master suite has fireplace,remodeled walk-in closet and more built ins, master bath has large spa tub, separate shower and double vanity, laundry in unit, near second bedroom, hardwood floors throughout, recess lights, nest security, The Hamptons offer many amenities such as , Pool, Spa, Sauna, Gym, BBQ grills, 24/7 surveillance, two side by side parking and many guests parking spaces, two storage spaces, walking distance to all shops, restaurant, park and new metro station. This is a true Gem!!!!",stainless
99,"$349,000","11581 Cactus Dr, Desert Hot Springs, CA 92240",https://www.zillow.com/homedetails/11581-Cactus-Dr-Desert-Hot-Springs-CA-92240/18098823_zpid/,3, House,2,"1,118",Aaron Mazzrillo,,MARKET STREET REALTY,"Turnkey and 100% move in ready on the day escrow closes. Beautifully remodeled ranch style home is ready for its new owner. Gorgeous galley kitchen features exquisite quartz countertops, stainless steal appliances, and new cabinets. The home also features a wood burning fireplace and tankless hot water heater, new bathrooms, and laminate flooring throughout. The house 2 bonus rooms which may or may not be permitted. This is the area of the former covered walk-way to the garage. Buyer to do own due diligence and satisfy self. Houses are still selling fast. Get your offer in before this one is off the market too.",stainless
100,"$698,000","7138 Farmland Ave, Pico Rivera, CA 90660",https://www.zillow.com/homedetails/7138-Farmland-Ave-Pico-Rivera-CA-90660/21101066_zpid/,3, House,3,"1,770",Ling Liu,,"ATM Asset Mgmt, Inc.","Welcome to a charming house located the most convenient location in Pico River, close to 605 freeway, market, shopping stores, banks and restaurants. This beautifully newly remodel single story residence offers 3 bedrooms with 2 and a half bath. It had been completely renovated and equipped with many energy saving products, brand new LED lights fixtures throughout the whole house. Auto light sensors in all bathrooms. brand new ductless wall split A/C units. It also comes with a brand new renovated kitchen with all the stainless steel appliances and the kitchen sensor faucet. New roof, new windows, doors and waterproof wood like vinyl floor throughout the whole house. A good size living room open to a spacious kitchen and to the Large family room with a fireplace. It also offers a huge game room equipped with a wet bar counter. This lovely home is a move-in ready and offers a perfect entertainment area for you and your family. A great place for you to call HOME SWEET HOME!",stainless
101,"$499,000","6295 Rancho Mission Rd UNIT 104, San Diego, CA 92108",https://www.zillow.com/homedetails/6295-Rancho-Mission-Rd-UNIT-104-San-Diego-CA-92108/52516493_zpid/,2, Condo,2,"1,044",Dan Parker,,Real Broker,"Welcome to your new home! This is a beautiful townhome feel that has just been updated with new dual pane windows, upgraded electrical smart switches, quartz countertops, fully renovated bathrooms, and lots of natural light! That's right, you don't have to worry about anyone living above or below you! You'll also enjoy the walk-in closet, stainless steel appliances, private front patio, and proximity to everything Mission Valley has to offer. You have grocery stores, shops, malls, SDSU campus, Snapdragon Staduim, and the trolley station - It's all right here! The oversized covered parking space (big enough for 2 small cars) is a real bonus and the additional guest parking pass is a great perk. This community features a pool, hot tub and community room, along with additional amenities. This one won't last long - come see it today!",stainless
102,"$345,900","12 W Swain Rd, Stockton, CA 95207",https://www.zillow.com/homedetails/12-W-Swain-Rd-Stockton-CA-95207/15287348_zpid/,3, House,1,"1,104",Lin Huynh,916-896-4099,eXp Realty of California Inc.,"This home features 3 bedrooms and 1 bath, measures in at 1104 sq/ft. Freshly painted interior and exterior. New laminate floor in kitchen and bathroom and wood floor throughout the house. New stainless steel appliances. Large size backyard with a covered patio is perfect for BBQs and entertaining guests, plus 2 storage sheds in the backyard for all the gardening tools. Convenient location with close proximity to convenient stores, restaurants, freeway access, parks, and school. Come and see this home before it is gone!",stainless
103,"$311,500","9725 Winter Gardens Blvd UNIT 106, Lakeside, CA 92040",https://www.zillow.com/homedetails/9725-Winter-Gardens-Blvd-UNIT-106-Lakeside-CA-92040/52515331_zpid/,2, Condo,1,728,Robert J Olson,,eXp Realty of California Inc,"This is a cute and cozy must see condo at the outer edge of this peaceful  community in one of the best parts of lakeside. It fearures a newly remodeled kitchen and Bathroom, new carpeting, freshly painted, lots of Granite and stainless steel appliances. A nice community center with an inground pool and BBQ area. At this price point this home gives you the best value that you can get for your investment.",stainless
104,"$725,000","11652 Chenault St APT 14, Los Angeles, CA 90049",https://www.zillow.com/homedetails/11652-Chenault-St-APT-14-Los-Angeles-CA-90049/20535875_zpid/,2, Condo,2,916,Bijan Hojjat,,"Pinnacle Estate Properties, Inc.","Great Brentwood Condominium. High quality of upgraded end unit, which offers a brand new kitchen, including cabinets, stainless appliances, Granite countertops. Tastefully upgraded bathrooms. Light & bright great floor plan and view of pool and treetops. Pergo and tile flooring, painted with an awesome neutral color which gives it a soothing and serene feeling. Central AC/ Heat. Two cars Tandem parking. Minutes walking distance to Brentwood’s finest boutiques, restaurants, shops, and much more to mention. Motivated seller and priced to a fast sale!",stainless
105,"$319,000","280 S Avenida Caballeros UNIT 242, Palm Springs, CA 92262",https://www.zillow.com/homedetails/280-S-Avenida-Caballeros-UNIT-242-Palm-Springs-CA-92262/18026625_zpid/,2, Condo,2,"1,128",Gregory Albert,,Keller Williams Luxury Homes,"Location, location, location! nestled in the heart of Palm Springs, walking distance to downtown with its restaurants, shops & entertainment, and near all conveniences, this bright, clean, freshly painted spacious and updated 2-bedroom condo is ready for a new owner. This condo features an open floor plan with great natural light, a cozy fireplace, laminate flooring and an updated kitchen / breakfast bar with slab granite countertops, stainless steel refrigerator, stove, dishwasher, microwave and an updated powder room. Upstairs, await a spacious primary bedroom & guest suite with vaulted ceilings and brand-new carpet & a separate laundry room. The large bathroom features an oversized tub and updated cabinetry. Outside, an oversized outdoor deck steps from two pools offers beautiful West Mountain views perfect to entertain friends and family. Caballeros Estates offers manicured grounds, 4 sparkling remodeled solar heated pool/spa, a clubhouse/sauna and assigned gated parking. Reasonable monthly dues include trash, water, gas, outside maintenance, roof. This could be a terrific seasonal rental (30 day minimum) or primary residence.",stainless
106,"$487,500","220 Loma Verde Dr, San Lorenzo, CA 94580",https://www.zillow.com/homedetails/220-Loma-Verde-Dr-San-Lorenzo-CA-94580/24961298_zpid/,2, Condo,2,"1,056",Ralph Watkins III,510-278-2121,Watkins Real Estate,"Must See!!  Excellent End unit!!  Fresh interior paint!  Updated baths and kitchen!!  New quartz countertops in kitchen. New vinyl flooring in kitchen and bathrooms!  Stainless Steel kitchen appliances with a new dishwasher!  New vanities in bathrooms!  New LED lighting!  Stackable washer/dryer in unit.  Dual Pane Windows!  All equipment stays!  Oversized rear yard!  1 car garage detached and 1 car assigned parking in front of unit.  NO Section 1 Pest!!  Move right in!!  Close to everything!  Minutes to shopping, 880, 580 freeways, transportation, restaurants....Offer date to be determined.",stainless
107,"$789,000","1066 Oleander Ave, Chula Vista, CA 91911",https://www.zillow.com/homedetails/1066-Oleander-Ave-Chula-Vista-CA-91911/17177496_zpid/,4, House,2,"1,620",Jezer E Manalastas,,Keller Williams SD Metro,"Enjoy this Cozy Single Story Home situated in East Chula Vista | Modern living room w/ exposed beams | Floor to ceiling bricks around the fireplace | Laminate floors throughout | Updated Kitchen | Quartz counter tops | Shaker cabinets | Stainless steel appliances | Energy efficient home w/ paid off solar panels | Huge backyard perfect for outdoor fun and entertainment | 2 car garage and a outdoor shed | Plenty of space for storage | Great location and easy access to schools, highways, shopping malls | Walking distance to the park",stainless
