,prices,address,links,bed,type,baths,sq_feet,Listing Agent Name,Listing Agent Contact,Listing Agent Company,Description,Key Word
131,"$449,900","7408 Lindale Dr, Sacramento, CA 95828",https://www.zillow.com/homedetails/7408-Lindale-Dr-Sacramento-CA-95828/25852399_zpid/,3, House,2,"1,506",Fred Wilcox,916-718-1470,RE/MAX Gold Folsom,"Beautiful Turn Key home in desirable Lindale 3 Subdivision.  Spacious lots, wide streets and well kept yards greet you as you arrive. Truly a great, quiet and wide street.  This classic Ray Grenz built Ranch style home is in fabulous condition. The roof and HVAC are not too old, the kitchen and bathrooms have been nicely updated.  Stainless appliances and granite counters on top of upgraded wood cabinetry. A huge living room and family room. Gorgeous Hardwood floors and I mean gorgeous. Breakfast bar top and a cozy wood burning fireplace. Out back you are greeted with nice aggregate stone patio decking, a pool with waterfall, personal spa, new rear lawn and a large aluminum patio cover. Updated electrical panel too. Over all a really lovely home.  Clear Pest report as well too. Original Owners are moving on.",stainless
132,"$825,000","720 Ebony Dr, Oxnard, CA 93030",https://www.zillow.com/homedetails/720-Ebony-Dr-Oxnard-CA-93030/16378791_zpid/,3, House,2,"1,705",Isaiah Haro,,EXP REALTY OF CALIFORNIA INC,"Welcome to this beautiful home in Summerfield Community in Northwest Oxnard. This home sits on a 7,141 square foot lot, which includes a perfectly manicured astroturf front lawn. As you enter your new home you are met with a beautiful chandelier and skylight that floods the entryway and den with natural light. The spacious vaulted ceiling living room is made cozy with a warm wood-burning, brick fireplace. The beautiful kitchen is upgraded with granite counters and stainless steel appliances along with the view of the gorgeous backyard. Your master bedroom features an updated bath with double sinks and a tile shower. Your gorgeous backyard is perfect for entertaining with green grass, a rebuilt patio cover with new lights, a tile floor, and an amazing area for gardening. Save money on electricity because your solar is paid off! The central air will keep you cool during warm Southern California days and you’ll only be 3.5 miles away from some of the best beaches in Southern California! Your turn-key home is ready for you and your family to move in!    ** SEE LISTING INSTRUCTIONS **  ** OFFERS WILL BE REVIEWED ON 1/31 **",stainless
133,"$844,900","2600 David Ave, La Habra, CA 90631",https://www.zillow.com/homedetails/2600-David-Ave-La-Habra-CA-90631/25104192_zpid/,4, House,2,"1,280",Jun Hoang,,Realty Connection Group,"Newly renovated 3bedroom 2bath Contemporary Home in a highly sought-after neighborhood of La Habra! This home has many upgrades and highly desired features including a Spacious Open Layout, New Custom designed Kitchen, New Roof, New driveway, New Copper plumbing, New dual pane windows, HVAC with New Nest thermostat, New stainless steel Oven range, 200 AMP Electrical panel, 2 Remodeled restrooms, Recessed lighting, freshly painted interior/exterior and new laminate flooring throughout! This home is situated on a 6000 sq ft lot with long driveway and 2 car garage. The front yard and backyard are freshly landscaped with new irrigation system. This home is located to many shopping centers, restaurants, parks and entertainment. Highly ranked assigned schools are close by from kindergarten to high school! Great opportunity in the City of La Habra! Make your appointment to see this home today!",stainless
134,"$739,000","19807 Grandview Dr, Corona, CA 92881",https://www.zillow.com/homedetails/19807-Grandview-Dr-Corona-CA-92881/17883026_zpid/,3, House,3,"2,451",Nahed Benyamein,,Allstars Realty,"Welcome to the beautiful city of Corona! This charming 4 bedroom, 3 bathroom home is the definition of private living. Boasting more than 2,400 sqft of living space on nearly 14,000 sqft of land, this is the home for someone looking for a tranquil lifestyle. As you enter the home you are immediately greeted by vaulted ceilings and tons of natural light. The kitchen is a chef’s dream with custom wood cabinets and etched glass inserted upper cabinets as well as granite countertops and stone backsplash. The focal point in the kitchen is a beautiful stainless steal stove hood and oversized island island perfect for entertaining.  Retreat to either of your 2 master suites, both on the first floor. This is perfect for multigenerational living! Both master bedroom’s include double doors leading to the outside while one flaunts a travertine stand up shower while the other boasts a fully remodeled bathroom with grey shaker cabinets and tile tub/shower. Make your way to the backyard that is built for entertaining! Host gatherings under your massive covered patio and take the fun into your large grass yard. Homes like this do not become available often so schedule your showings while it is available!",stainless
135,"$639,000","2884 Sawtelle Blvd APT 118, Los Angeles, CA 90064",https://www.zillow.com/homedetails/2884-Sawtelle-Blvd-APT-118-Los-Angeles-CA-90064/82881701_zpid/,2, Condo,2,850,Susan Asch,310-600-5446,Keller Williams Beverly Hills,"Dreamy space located in trendy WEST LA...one of the most sought after locations in the entire city!  Near Starbucks, shopping and restaurants.  1st fl condo easily accessible/open floor plan, updated kitchen, 2 updated bathrooms & floors. The kitchen has an amazing newer stainless Bosch range and dishwasher built in microwave, oversized  and newer faucet.  Two oversized bedrooms offer great space. Master ensuite offers a private retreat.  There is a second large bedroom & another updated bathroom. Private outdoor space...enclosed patio.   Well maintained property  with a courtyard and secure building.   Gated, covered carport (2 spots) make this the perfect choice for your new home. This condo has very little/no  traffic noise.   Close to UCLA, Easy access to nearby studios...Fox & Sony...the 405 and most of the city.  This unit is extremely quiet, located near the front of the building but buffered from the streets for easy, quiet living. Extremely low HOA fees. Storage area.",stainless
136,"$699,900","916 Vale View Dr, Vista, CA 92081",https://www.zillow.com/homedetails/916-Vale-View-Dr-Vista-CA-92081/16634848_zpid/,3, House,2,"1,068",Pat Fuller,,Mission Realty Group,"Quaint 3 Bed/2 Bath Vista home set in a peaceful and quiet neighborhood. Renovated with modern updates such as quartz countertops, custom cabinetry, stainless steel appliances and range hood. Bathrooms fully renovated, all new luxury vinyl plank flooring, new carpet in bedrooms, new dual pane windows, recessed lighting and more! Home located on a HUGE corner lot with beautiful and mature shade trees!! Equipment:  Range/Oven Sewer:  Sewer Connected Topography: LL",stainless
137,"$950,000","9133 Ronda Ave, San Diego, CA 92123",https://www.zillow.com/homedetails/9133-Ronda-Ave-San-Diego-CA-92123/16932544_zpid/,3, House,2,"1,200",Joseph Caltabellotta,,RE/MAX City Real Estate,"Breathtaking canyon view property on canyon rim! Completely remodeled! Shaker kitchen cabinets with granite aggregate counters, stainless appliances and Island bar counter! All appliances stay! Bathrooms remodeled with designer touches. Elegant hardwood flooring, Plantation Shutters! Full solar system owned. Newer Central A/C! Water softener/RO. New main sewer line. Digital Irrigation. EV outlet in Garage. New Bedroom Carpet. Stunning panoramic views of canyon and Mission Valley night lights. Stylish trellis patio! Sparkling below ground pool! Tens of thousands spent on new deck, perfect for entertaining while enjoying views. New Palm Trees and Turf!",stainless
138,"$535,000","1640 Marion Ave, Lancaster, CA 93535",https://www.zillow.com/homedetails/1640-Marion-Ave-Lancaster-CA-93535/63791443_zpid/,5, House,3,"2,662",Alexander Seropian,,FIRST PACIIFIC REALTY,"Magnificent newly remodeled House with 5 bedrooms and 3 bathrooms. Public record shows 3 bedrooms but the property is actually 5 bedrooms.  This property features a large Living room with a Fireplace and Hardwood Floors as well as a separate Family room. Family room leads to a bedroom and a full bathroom. Kitchen has a tile countertop Oak wood Cabinets and tile floors as well as Stainless steel appliances, Gas range and a microwave. Beautiful stairway leads to the second floor. There are brand new laminate floors, throw-out the 2nd floor, and tile in the bathrooms. Loft has been converted into a 5th bedroom. Master bedroom is large and has double entry doors with laminate floors. Masters Bathroom with a double sink, Combo Shower and bath-tub, and two walking closets. Property Has 3 Car Garage  with newly painted floors and newer 2 garage door Motors. So you can bring all your toys and still have a great deal of free space. Property has a large oversized backyard over 12500 Sq. Ft.  The Property shows very well.",stainless
139,"$739,000","4565 Harbinson Ave, La Mesa, CA 91942",https://www.zillow.com/homedetails/4565-Harbinson-Ave-La-Mesa-CA-91942/17000340_zpid/,2, House,1,840,Memo Cardona,,Allison James Estates & Homes,"Fully renovated home with a bright and open floor plan. Gorgeous kitchen features quartz countertops, stainless steel appliances, white shaker cabinets and lots of storage space. Beautiful designer fixtures all throughout home! Remodeled bath, brand new doors, new flooring and fresh interior & exterior paint. Detached garage with potential to be converted into an ADU. New side fence, updated landscaping in front and rear yard. Desirable area close to schools, shopping and FWY. Don't wait, this beauty will sell fast!",stainless
140,"$249,000","1225 Vienna Dr SPACE 906, Sunnyvale, CA 94089",https://www.zillow.com/homedetails/1225-Vienna-Dr-SPACE-906-Sunnyvale-CA-94089/153147122_zpid/,2, Home,2,"1,296",Pamela Sauceda,408-541-1700,Pams Homes,"Beautifully Remodeled Home with 2 car garage, private side yard with deck for outside entertaining. Kitchen features granite counter tops, lots of storage, beautiful new stainless steel appliances. Split floorplan with large master, walk in closet! Bathrooms features new vanities with granite counter tops. 2019 New A/C, 2019 New Heater,& 2018 New Water Heater, Roof estimated about 13 years old. Make: Goldenwest/Immobile 1981 SM61238A/B",stainless
141,"$399,000","17628 Alburtis Ave UNIT 22, Artesia, CA 90701",https://www.zillow.com/homedetails/17628-Alburtis-Ave-UNIT-22-Artesia-CA-90701/21120620_zpid/,2, Condo,1,809,Gabriel Arambula,,"Broker Groves, Inc","Welcome to 17628 Alburtis Ave., #22..    Located in the heart of Artesia, just minutes away from the 605 freeway, 91 freeway, and los Cerritos center. This turnkey second-story unit places the best of dining and shopping at your disposal. With clean laminate floors in the common areas and plush carpet in the bedrooms, move right in and call this place home. The quartz kitchen counter tops, tasteful tile backsplash, and stainless steel electric cooktop are enough to make Emeril Lagasse say Bam! The bedroom closets that span the length of the room have enough space for the clothes of a runway model. The laminate floors and quartz countertops in the bathroom make you feel like you’re at the Ritz Carlton. Come on by, take a look, and get your offers in ASAP.    **** HOA Includes, water, gas & trash ****",stainless
142,"$427,000","1516 Carpenter Rd, Stockton, CA 95206",https://www.zillow.com/homedetails/1516-Carpenter-Rd-Stockton-CA-95206/15343461_zpid/,4, House,2,"1,568",Anne Balbarino,209-915-0904,PMZ Real Estate,"Situated in an established neighborhood, this Fully upgraded Beautiful home offers 4 bedrooms, 2 bathrooms with bright and open living space. The kitchen has granite countertops, stainless steel appliances, ample pantry cabinets. The interior laundry room is finished with upper cabinetry. The open floor plan for the great living room and a formal dining area gives the family and the guests an opportunity to bond and enjoy meals together. Front security gate gives you privacy to the home. Large backyard lot is waiting for your inground pool, an Accessory Dwelling Unit or an oasis for entertaining guests. The home is an excellent for commuters, a few blocks away from Amazon Fulfillment Center, FED EX Distribution center with easy access to all freeways, San Joaquin County Hospital and the Stockton Metropolitan Airport.",stainless
143,"$499,990","12807 Clallam Rd, Apple Valley, CA 92308",https://www.zillow.com/homedetails/12807-Clallam-Rd-Apple-Valley-CA-92308/53065657_zpid/,6, House,3,"2,408",Tanykea Ingram,,"Broadnax Properties, Inc.","A rare find! This desirable renovated six-bedroom single-story home has been updated with the highest quality finishes, leaving no small detail overlooked, from the new plank and new carpet flooring to new fresh interior paint. The entertainers' floor plan includes large open spaces for hosting gatherings or enjoying everyday life. Flex your cooking skills in the brand new kitchen with tall white cabinets, new gorgeous quartz counters, new flooring, new stainless steel appliances, and a peninsula-style island that is just waiting for bar-style seating! After dinner, cozy up with a good book around the roar of the fireplace in the living room grounded by a hand-crafted stone surround, or watch your favorite movie with loved ones.     Entertain guests on the enclosed patio that overlooks the large yard with a concrete gazebo, lush florals, and room to roam. The oversized driveway provides space to park an RV (RV parking in the back too!), motorized toys, multiple cars, and additional storage space in the garage. Notable updates to the home include new exterior paint, all new fixtures, fresh interior paint, new carpet, new plank flooring, and updated bathrooms. This property is near many local amenities, including shopping, restaurants, and area businesses, making your daily commute more accessible than ever! All that's left to do is pack your bags, move in, and make your mark on your new neighborhood!",stainless
144,"$1,599,000","35380 Sky Ranch Rd, Carmel Valley, CA 93924",https://www.zillow.com/homedetails/35380-Sky-Ranch-Rd-Carmel-Valley-CA-93924/19388789_zpid/,3, House,3,"2,419",Sig Ponce,831-261-3758,Berkshire Hathaway HS Real Time Realty,"Welcome to your private paradise sitting 2000 sq ft above sea level surrounded by unobstructed views of the serene hills of Carmel Valley. Exquisite home was recently renovated. Kitchen was beautifully remodeled w/ new custom cabinetry, gorgeous Granite and Brazilian Quartz counter tops. High end finishes are complemented with top of the line appliances incl: Thermadore induction cook top, Viking French door double oven, stainless steel hood, pot filler over the cook top, dishwasher, refrig, wine cooler, barn sink, custom faucet, and stylish backsplash. The Main bed room has been enhanced with a walk in shower, Italian imported bath faucet, Oceania tub, custom cabinetry w/marble countertops, and perimeter lighted mirror. All rooms have radiant heat as well. A full bath was added off the office w/ extensive wall and shower floor tiling and curved sliding shower doors.  A brand new rain soft water, dual  and purification system combined with a solar panel system on roof.",stainless
145,"$565,000","20832 Shrub Oak Dr, Patterson, CA 95363",https://www.zillow.com/homedetails/20832-Shrub-Oak-Dr-Patterson-CA-95363/79576497_zpid/,3, House,3,"2,658",Adrian Goss,209-226-3096,eXp Realty of California Inc,"Come and fall in love with 20832 Shrub Oak Drive in the beautiful gated community of Diablo Grande, with stunning views & complete privacy. This home features 3 bedrooms, 2.5 bathrooms, a spacious downstairs with separate living areas. Pride of ownership & attention to detail at it's finest. Tons of upgrades and renovations with amazing light fixtures, 2 tone kitchen cabinets, custom quartzite stone counter tops with wrapped island and matching backsplash, stainless steel appliances, amazing master bathroom remodel with open bay shower with floor to ceiling tile, luxury vinyl plank flooring, stone accent walls, 30 year exterior paint, spacious master suite with bonus room for office/gym. Extended driveway for added parking and stamped concrete backyard for low maintenance. Come and take a tour of this beauty today!",stainless
146,"$329,780","260 N 15th St, Chowchilla, CA 93610",https://www.zillow.com/homedetails/260-N-15th-St-Chowchilla-CA-93610/19117719_zpid/,3, House,3,"1,144",Rosario Garcia,559-999-8587,Better Homes & Garden Real Est,"This newly renovated 3 bed, 2 1/2 bath has just what you are looking for! Walk through the front door and you will be immediately stunned by the open floor plan. To your left is your spacious living room that leads right into the newly renovated kitchen. Stainless steel appliances, quartz counter tops, and lots of cabinet space give a modern twist on this charming house. Entertain with ease with this open concept. Brand new water proof laminate flooring leads you through the dining room and into the hall, where your bedrooms and bathroom await. All three bedrooms are large, and the master has a full bathroom en suite. Outside, you will find your garage. Attached to the garage is a large shop area with it's own attached bathroom! This leads you straight to your large back yard, perfect for large family gatherings! Located on a corner lot, this newly renovated house allows you extra parking not only in the front and side, but the back alley with additional entry ways into the yard through the back gate! The freeway is a minute drive, and schools, restaurants, and shopping is just a walk away. This house is just waiting for you to make it a home.",stainless
147,"$535,000","15230 Roxford St UNIT 29, Sylmar, CA 91342",https://www.zillow.com/homedetails/15230-Roxford-St-UNIT-29-Sylmar-CA-91342/20067188_zpid/,3, Condo,3,"1,311",Janette Correa,,Keller Williams Central,"This nice two-story private END unit condo was renovated under three years ago! It is centrally located in a quiet area of Sylmar. Upon entering the first floor, find tile flooring throughout, a spacious living room, a cozy brick fireplace, an upgraded kitchen with granite countertops, stainless steel sink, built-in water filtration, mahogany color kitchen cabinets, raised ceiling, recessed lighting, a spacious dining area with extra hidden storage space under the staircase and a 3-ton central A/C and heating system.  On the second floor, find a spacious master bedroom, a walk-in closet, its own private bathroom, and two good size bedrooms with its own full bathroom in the hallway. The condo has its own private patio area that leads to a two-car garage with plenty of built-in storage shelves. Ideal for storing away all seasonal items! The condo is a few steps from the well-maintained community pool and spa—lastly, nearby shopping centers, restaurants, and the 210 freeway. DISCLAIMER -unit is currently tenant-occupied.",stainless
148,"$544,900","3631 Citrus St, Highland, CA 92346",https://www.zillow.com/homedetails/3631-Citrus-St-Highland-CA-92346/17611630_zpid/,5, House,2,"1,661",Blanca Arellano-adams,909-262-8844,REALTY MASTERS & ASSOCIATES,"Welcome to this Entertainer's home complete with sparkling swimming pool and spa, built in BBQ, fire pit, patio covers, and incredible panoramic views! The home exterior features luxurious landscape elements such as cascading fountain, koi pond with waterfall, sprinkler system and lights. The home features vinyl dual pane windows, custom wood shutters, was recently painted throughout, copper plumbing and has a tankless water heater. The lovely kitchen was recently remodeled with granite countertops, nickel cabinet hardware, custom backsplash, new sink, recessed lights, 5 burner gas cooktop and paint throughout. The bathrooms were also upgraded a couple of years ago and have newer cabinets with granite, newer mirrors and lighting, tile flooring, modern frameless shower enclosures with nickel hardware, double shower heads in the main bath and newer toilets. The oversized patio doors lead out to the spectacular custom entertainer's back yard with in-ground pool and spa, a stainless-steel gas Barbeque Island covered with Italian stacked stone, complete with area for refrigerator and sink. Relax and enjoy the gas firepit as you gaze upon the panoramic vistas of the morning and evening skies and the valley below. This is a rare opportunity, as this home is being sold by the original owner, who has invested much love and care into every detail.",stainless
149,"$729,900","14412 Killion St UNIT 303, Sherman Oaks, CA 91401",https://www.zillow.com/homedetails/14412-Killion-St-UNIT-303-Sherman-Oaks-CA-91401/95529439_zpid/,3, Condo,3,"1,620",Clark Hill,,Pinnacle Estate Properties,"Luxurious contemporary condo in the heart of trendy Sherman Oaks. Built in 2009, this single-story 3rd floor unit features high ceilings, recessed lights, and a fantastic floor plan with a huge open kitchen, true primary bedroom, and serene treetop views of the neighborhood. Features include an oversized kitchen with wood cabinets, upgraded stainless appliances, granite counters, and custom corner pull-outs; open living room with balcony and flip-switch fireplace; and a primary bedroom that features dual closets and ensuite bathroom with jetted tub, separate shower, dual sinks, and stone floor and counters. Upgrades include LED lighting, keyless entry, Ecobee thermostat, and USB charging ports. The well-managed building is located on a cul de sac and features gated parking, gym, and enormous recreation room. Easy access to Sherman Oaks Park and great proximity to both the 101 and 405 freeways.",stainless
150,"$649,000","52811 Browns Rocky Rd, Anza, CA 92539",https://www.zillow.com/homedetails/52811-Browns-Rocky-Rd-Anza-CA-92539/18049756_zpid/,6, Home,4,"3,178",William Kohl,,DCH Real Estate,"Seldom does a property become available quite like this, offering an opportunity to have your very own family compound on over 6 acres of meticulously cared for land. With more amenities and infrastructure than you’ll know what to do with, this property boasts a 1,793 sqft home, 1,386 sqft accessory dwelling unit (ADU), detached two car garage, two barns, two carports, and four cargo containers. Power and water runs to multiple outbuildings, and there’s enough usable land to expand even further. Fully perimeter fenced with cross fencing over the entire property, appreciate the varied terrain ranging from private glades to plateaus offering views of the entire valley. The main residence is nicely crafted for entertaining, privacy, and comfort. Offering a beautiful front deck with lighted pergola looking out over the circular driveway and fully mature landscaping—only bested by the back patio offering another covered entertaining area, built-in barbecue, jacuzzi, privacy hedges and stone steps descending to the robust lawn, and offering views of the entire Anza Valley. Inside there are three bedrooms and two full baths, with a separate living and family room divided by a delightful see though, two-sided wood burning fireplace. A lovely equipped kitchen offers all stainless steel appliances, large kitchen island with breakfast nook, and rich wood cabinets. His and her sinks in the master suite with soaker tub and walk-in closet, formal dining room, and a fully equipped laundry room with utility sink make this the complete package. A detached two car garage with 220v can make the ultimate workshop. Across the property enjoy the utility of the aforementioned storage containers, regulation horseshoe pit, two-story playhouse, numerous outbuildings, a wisteria draped third pergola adjacent to the stone grotto and fire pit, and much, much more. Perfect still is the splendidly landscaped and maintained area of the property that contains the ADU, with its large, raised Trex deck overlooking those same valley views, with three bedrooms and two baths and a lovely fully equipped kitchen. Separately fenced, this guest home is the answer to either a large family, regular visitors, or anything else. The love, care, and time that the owners have put into this property is something that needs to be seen to be believed. With so much being offered and in such fine condition, this tour de force of residential amazement surely won’t last long.",stainless
