,prices,address,beds,links,type,baths,sq_feet,Listing Agent Name,Listing Agent Contact,Listing Agent Company,Description,Key Word
0,"$278,000","12594 E Pacific Cir, Aurora, CO 80014",1,https://www.zillow.com/homedetails/12594-E-Pacific-Cir-Aurora-CO-80014/2066667884_zpid/, Coming soon,1,877,Anna Bliska,720-484-9360,Coldwell Banker Realty 02,"Fully remodeled ground level condo in the highly sought-after Heather Ridge community and Cherry Creek school district! The kitchen boasts custom soft close cabinets, high-end granite countertops, pendant lights, an extra deep sink with high tech faucet, stainless steel appliances, and canned lighting. The flooring is laminate and thick carpet with tempurpedic padding. Two ceiling fans add year around comfort, and they are reversible for winter. The cozy wood burning fireplace is perfect for the cold months. New double pained windows and sliding glass door leading out to covered patio. Spacious bedroom with a large redesigned closet. New bathroom with custom soft close cabinets, spacious shower with massage shower-head, custom tile and added nook for soaps and shampoo. Added bonus: All popcorn removed from ceilings! Garage includes 8’ by 4’ overhead storage rack and Rocksolid Metallic Orange Floor Coating. The community offers a newly renovated club house that includes pool and tennis courts. Located close to almost everything including shopping, restaurants, schools, parks. Prime location with easy access to I-225, DTC, Denver Airport and downtown Denver. Just minutes to Denver RTD rail system that operates 365 days a year! Showings start Friday.",soft%20close
1,"$499,000","2226 Daley Dr, Longmont, CO 80501",4,https://www.zillow.com/homedetails/2226-Daley-Dr-Longmont-CO-80501/13227108_zpid/, House,2,"1,984",Heather White,303-588-3317,"White & White Realty, Inc.","Beautifully updated home located on a culdesac in northwest Longmont.   Enjoy the summers evenings on your large back deck overlooking your huge backyard. The kitchen has newer soft close cabinets and SS appliances which all stay including the washer and dryer.  The bathrooms have newer vanities and fixtures.  This is a lovely, clean home in a great neighborhood.  Please follow all Covid procedures.  Easy to show.",soft%20close
2,"$345,000","72 Everett Dr, Colorado Springs, CO 80911",3,https://www.zillow.com/homedetails/72-Everett-Dr-Colorado-Springs-CO-80911/13640188_zpid/, House,1,"1,051",Cheryle F Burgess PSA e-PRO,719-457-3815,"RE/MAX Advantage Realty, Inc.","Beautifully Updated Ranch Style Home Nestled On  A Private Cul-De-Sac Lot.  Home Updates Include Stainless Steel Kitchen Appliances, Custom Interior Paint, Luxury Vinyl Plank Flooring & Newer Carpeting.  This Home Remodel Includes  Top Of The Line Custom Cabinetry With Soft Close Feature, Tile Backsplash, New Vinyl Windows, New Interior Doors, New Lighting & More.  The Lot Encompasses Over A Quarter Acre Of Land And Boasts Spectacular Views Of Pikes Peak.  One Car Garage and Additional Parking Space For RV Parking Is Also A Wonderful Addition To This Home. This Home Shows True Pride Of Ownership.",soft%20close
3,"$449,000","1820 Elm Ave, Canon City, CO 81212",3,https://www.zillow.com/homedetails/1820-Elm-Ave-Canon-City-CO-81212/218694698_zpid/, House,2,"1,124",Ashley Adrian,719-283-1170,Keller Williams Performance Realty,"This unique, fully remodeled 1124 sq ft sturdy ranch home features 3 bedrooms, 2 bathrooms and two workshops. Every surface of this home has been touched during this architect-designed renovation. The open concept living room opens to the gourmet kitchen with soft-close cabinets, top-line stainless LG smart appliances, gas range, pot-filler, oversized farm sink, leathered porcelain counters and six-foot center island with quartzite slab. Dining room features tongue and groove wood ceiling with cove lighting and hidden-storage seating. From the dining room, a sliding glass door opens to a spacious patio looking out to the backyard and mountains. The original oak floors were refinished. Wi-fi connected dimming light switches, appliances, Nest thermostat, smoke/Co2 detectors. USB B-C adapters integrated in many wall outlets. Ring alarm system with exterior lights/cameras. All new wiring and electric with energy efficient soft LED recessed fixtures and accent lighting features. Ceiling fans in all bedrooms. New furnace with central A/C. All plumbing replaced and new sewer line. Custom tile work in kitchen & bathrooms. Powered anti-fog backlit vanity mirrors in both bathrooms. Two sun-tunnels fill interior spaces with natural light. New HE windows and patio doors and new roof. Convenient 144 sq foot downstairs storage area just off kitchen. New LG wash-tower. The workshop has new utility connections and is ready to be finished, with new roof and stucco exterior to match the house.",soft%20close
4,"$850,000","8792 E Grand Ave, Denver, CO 80237",4,https://www.zillow.com/homedetails/8792-E-Grand-Ave-Denver-CO-80237/13427144_zpid/, Coming soon,3,"2,773",Emily Chaney,303-564-3534,"BSW Real Estate, LLC","This stunning 1970’s Pine Valley home has been professionally updated with no detail spared. This is not a fix and flip. The home has designer colors, hickory floors throughout and thoughtful modern amenities. The beautiful open kitchen was expanded to house an oversized island, coffee bar and appliance wall. The kitchen was appointed with grey cabinets that have soft close design and pull-out drawers, quartz counters, and custom lighting fixtures. The large windows pour in light and give an open view to the meticulously landscaped backyard. The kitchen opens to the dining with wainscoting details and a new sliding door. There is a large living room with vaulted ceilings at the front of the home. The lower level has a cozy fireplace with a custom wood mantle and real barn wood details. There is a wet bar or second kitchen for future mother in law space, large bedroom, updated bathroom with walk in shower. Upstairs you will find a true primary bedroom with a stunning 5 piece ensuite, heavenly soaking tub and two closets, one that is walk in. There are two additional large bedrooms, a fully remodeled bathroom, utility room and storage. The owners have gone above and beyond in installing systems including a brand new roof, new gutters, two furnaces and two ac units as well as a tankless hot water heater. They have also had the home professionally painted, new doors and a new garage door installed. The yard has a brand new concrete patio poured, newer pergola and a storage shed. The owners paid in full for the solar which will be a huge savings to the next buyer.  It dots the i’s and crosses the t’s of any buyers wish list by finishing up with a large two car garage. The home is walking distance to George Wallace Park and minutes to Belleview Square Shopping Center, Cherry Creek State Park and the Denver Tech Center.",soft%20close
5,"$799,000","3233 N Marion St, Denver, CO 80205",3,https://www.zillow.com/homedetails/3233-N-Marion-St-Denver-CO-80205/13306070_zpid/, House,2,"1,705",Pat Sanchez,303-523-9200,Resident Realty South Metro,"Welcome to this beautiful remodeled 3 bedroom 2 bathroom Victorian home.  When you open the front door you are greeted with high ceilings, gleaming hardwood floors . As you enter the main living space you will see exposed brick and an open concept. There is 1 bedroom and a bathroom on the main floor. In the kitchen you have beautiful new soft close white shaker cabinets, quartz countertops, new appliances with a smart hub refrigerator and a península to enjoy.  The laundry room is on the main level and there is also an amazing bathroom with a walk-in shower. As you go upstairs you have amazing black powder coated stair railings and hardwood stairs. Upstairs you have two bedrooms, a bathroom with a dual vanity and an amazing walk-in shower. Outside you have a private fenced backyard with new sod, and 2 private parking spaces in back. New high efficiency furnace, a/c and water heater. This home has an outstanding centralized location. A few blocks away and you're in the heart of RINO. Quick access to downtown Denver. Close to shopping. An amazing house in the heart of Denver. Come see for yourself.",soft%20close
6,"$775,000","1429 Niagara St, Denver, CO 80220",4,https://www.zillow.com/homedetails/1429-Niagara-St-Denver-CO-80220/13389632_zpid/, Coming soon,2,"2,299",Illona Gerlock,303-809-1235,Coldwell Banker Realty 18,"Stunning 1940's brick ranch, remodeled in 2018, and located in the Montclair neighborhood of Denver! As you enter, hardwood floors greet your feet & flow throughout the main floor. The main level floor plan has been opened up with the addition of structural beams during the remodel. The great room & kitchen flow seamlessly together making it great for entertaining, or any layout flexibility. The kitchen is a chef's dream! It boasts black granite countertops, 42"" white soft-close cabinets, white dimensional subway tile backsplash, wood-look tile floors, Bosch stainless steel appliances, including a 5-burner gas range. The attached garage was converted into an inviting and cozy, sunken family room with vaulted ceilings & skylight. 2 bedrooms on the main floor have charcoal gray solid-core doors, carpeted floors, and single closets. The uniquely designed full bathroom features black & white decorative floor tile, black marble countertops, and completes the main floor. The basement holds the master suite, auxiliary bedroom, laundry room, and utility closet. The spacious master suite includes an open sitting area with gas fireplace, a 5-piece master bathroom, and a walk-in closet with built-in folding table. The master bathroom welcomes you with striking Carrara marble countertops, tile floors, and tile half wall. The shower stall includes a pebble floor, bench, glass door, and marble tile surround. Both basement bedrooms feature solid-core doors & carpeted floors. The large laundry room has wood-look laminate floors, granite countertops, utility sink, and soft-close cabinetry. The backyard includes a stamped concrete patio, new fencing, storage shed, professional landscaping, and an oversized 2-car garage that includes a 2nd fridge & built-in shelving. Less than a mile to grocery, banking, brewery, restaurants, and Montclair Park with tennis courts, horseshoe pits, and more. 2 miles to City Park, Denver Zoo, the Museum of Nature & Science, and Lowry Plaza. Welcome Home!",soft%20close
7,"$460,000","22152 E Dry Creek Pl, Aurora, CO 80016",3,https://www.zillow.com/homedetails/22152-E-Dry-Creek-Pl-Aurora-CO-80016/67445797_zpid/, Townhouse,4,"2,429",Fred Smith,303-930-5132,RE/MAX Masters Millennium,"You will love coming home to this gorgeous townhome with a great location only steps away from the pool and playground!  New carpet, flooring, paint and railings throughout!  Relax by the gas fireplace in the comfortable living room with built-in surround sound speakers and new gorgeous LifeProof luxury vinyl floors that extend throughout the main level.  Enjoy cooking in the beautiful kitchen with granite counters, tile backsplash, soft close Cherry cabinets with pull-out drawers, under cabinet lighting, pantry, breakfast nook and new stainless steel appliances.  Escape to the lovely master bedroom with a bay window, walk-in closet and master bath with two sinks.  Use the basement as a family room or as a 3rd bedroom with a private bath and walk-in closet.  Benefit from the garage work bench and 220 outlet to charge your car.  Have a barbeque on the enlarged and fenced in back patio or take your dog on a walk to the dog park.  Close to the Saddle Rock Village shopping center and Southlands too!",soft%20close
8,"$390,000","3924 Eagles Nest Dr, Evans, CO 80620",3,https://www.zillow.com/homedetails/3924-Eagles-Nest-Dr-Evans-CO-80620/54819871_zpid/, House,2,"1,210",Bradon Amen,970-324-3373,"C3 Real Estate Solutions, LLC","Come and get it!  2 story home with three beds, 2 baths, and main floor master. In close proximity to parks, schools, shopping, and dining.  Backyard with dog run, newer shed, and firepit.High efficiency furnace and air conditioner new from 2020 and new hot water heater from 2021.  Newer, soft-close cabinets in kitchen with Whirlpool stove and stainless steel appliances.",soft%20close
9,"$2,250,000","18320 Table Rock Rd, Colorado Springs, CO 80908",5,https://www.zillow.com/homedetails/18320-Table-Rock-Rd-Colorado-Springs-CO-80908/88908189_zpid/, House,5,"5,977",Ruth Wordelman,303-437-6010,Front Range RE Professionals,"Truly one of the most remarkable luxury properties along the Front Range on 5.74 acres! Spectacular 2 story impeccably maintained home w/ walk out basement AND 2 story guest home. Original owners custom designed this home & no detail left un-done. All Alder wood cabinetry (both homes); beautiful Maple engineered wood flooring on main & granite accents throughout. The lovely front porch greets you & then you are welcomed into large foyer w/ access to formal dining or the great room which flows seamlessly to the gourmet giant kitchen w/ small custom fireplace, soft close drawer, Thermador gas range & double oven, large eating area, enormous granite island. Main level has bedroom (or office) & 3/4 bath. Oversized (1291 sq ft), finished garage w/ custom cabinetry, tub sink & exterior access. Upper level features large loft (could be additional bedroom) overlooking great room; private master suite w/ fireplace & gorgeous 5 piece bath w/ separate vanities/walk in closet; 2 large additional bedrooms w/ private full bathrooms; upper level laundry room. Lower walk out level has large wet bar w/ wine fridge, full sized refrigerator & dishwasher! Additional office area adjacent to bar w/ built ins; large additional bedroom; 3/4 bathroom, gym/office w/ French doors; very large family room area w/ fireplace, built-ins & access to back patio w/ pergola & fire pit. The outdoor space is a resort complete w/ basketball court, securely mounted trampoline, playset w/ clubhouse (one of 4 sheds - 2 with power), horseshoe pit, outdoor wood-burning fireplace & additional pergola & ATV trail with bridges all around the property! Exterior lighting at all vantage points including the walk to the beautiful guest home! 20x65 heated RV garage attached to guest home w/ 1 bedroom, sitting area, lovely kitchen & 2 baths! Custom landscaping, retaining walls (which haven't moved an inch!). Bring your most discerning buyer to this palatial masterpiece! Impossible to list all the phenomenal features!",soft%20close
10,"$360,000","1725 N Dolores Rd, Cortez, CO 81321",4,https://www.zillow.com/homedetails/1725-N-Dolores-Rd-Cortez-CO-81321/113182721_zpid/, House,3,"2,026",Jason Witt,970-570-9051,Regents Real Estate Group Inc.,"MOTIVATED SELLERS of a one-of-a-kind, stick-built rambling ranch home, sitting on over a half acre! Imagine yourself relaxing on the covered front patio taking in the views of Mesa Verde, La Plata Mountain and Conquistador Golf Course. From the back deck you are only a few steps away from enjoying Kiwanis Park. The inside of the house is bright and airy, with that perfect mixture of original architectural features. You get newly remolded bathrooms and a kitchen that features soft closing cabinets and stainless steel appliances. The designer choices in this stunning home set it apart from every other house in the neighborhood.  The attached workshop gives you yet another place to find serenity. Landscaping includes a finished detached garden shed, flagstone pavers and fruit trees. The homeowners have taken special care to update and maintain this home. These efforts make this home eligible for those with VA, FHA and USDA loans. If that isn't enough the sellers are including a 1 year home warranty form American Home Shield.",soft%20close
11,"$578,300","10186 Ventura St, Commerce City, CO 80022",4,https://www.zillow.com/homedetails/10186-Ventura-St-Commerce-City-CO-80022/72297713_zpid/, House,3,"3,166",Austin Edwards,,"Zillow Homes, LLC","This impressive 4 bedroom, 3 bathroom home can be found in the Reunion community of Commerce City! Upon entering, you will immediately notice gorgeous hardwood floors, brilliant natural light, and an open concept layout with high ceilings. The kitchen is perfect for entertaining, featuring durable countertops, sleek appliances, ample cabinet space, and a breakfast bar with room for seating. The adjoining living room features a warm, inviting fireplace to cozy up to and escape those cold Colorado nights. After a long day, retreat to the relaxing primary bedroom, complete with a walk-in closet, a 5-piece en suite bathroom with dual vanity sinks and a large soaking tub. This home also includes an attached 2-car garage, a fully enclosed backyard oasis, and pergola covered patio, perfect for entertaining. You will love being conveniently located close to Southlawn Park, dining, parks, and major roads for an easy commute.",soft%20close
12,"$641,000","683 Millet Cir, Brighton, CO 80601",4,https://www.zillow.com/homedetails/683-Millet-Cir-Brighton-CO-80601/61505177_zpid/, House,3,"3,482",Austin Edwards,,"Zillow Homes, LLC","Don't miss your opportunity to reside in this beautiful 4 bedroom, 3 bathroom, 2 story home that is perfect for today's live, work, and play environment! As you enter, stunning wood-look flooring welcomes you into a bright and airy foyer. Flow into the gourmet eat-in kitchen boasting granite countertops, a gas stove, double ovens, ample cabinetry, an island, and a cozy breakfast nook to make preparing meals and conversing with guests a breeze. The living room features custom built-in shelves, a soaring ceiling, large windows to make the space feel bright, and a fireplace to curl up beside on a chilly evening. Venture upstairs to the primary suite with vaulted ceilings, a large walk-in closet, and a five-piece en suite bathroom with dual sinks, and a soaking tub to relax in after a long day. The fenced-in backyard offers a deck that lends shade to the lovely patio below, perfect for entertaining. Close to parks, shopping, and nearby access to I76 for easy commuting!",soft%20close
13,"$488,900","596 Newton Dr, Loveland, CO 80537",4,https://www.zillow.com/homedetails/596-Newton-Dr-Loveland-CO-80537/124228446_zpid/, House,4,"2,772",Austin Edwards,,"Zillow Homes, LLC","Photos coming soon. Come see this picturesque 4 bedroom, 3.5 bathroom home in this beautiful Loveland neighborhood! Entering this home is like a breath of fresh air with high ceilings and a thoughtful open floor plan. The spacious living room features large windows to allow natural light to cascade throughout. Prepare a delicious meal in this gorgeous gourmet kitchen with durable countertops, crisp white cabinetry, sleek appliances, gas range, and a breakfast bar, perfect for entertaining. Venture out to your backyard to host a gathering or enjoy some fresh Colorado air! After a long day, retreat to your primary bedroom boasting an oversized closet and en suite bathroom. Additional highlights included an attached garage and a furnished basement, outfitted with a media room, a bedroom, and a bathroom. Conveniently located near Loveland Sport Park, schools, dining, and major roads for an easy commute.",soft%20close
14,"$479,900","618 Wadas Ct, Johnstown, CO 80534",3,https://www.zillow.com/homedetails/618-Wadas-Ct-Johnstown-CO-80534/14082675_zpid/, House,3,"2,656",Austin Edwards,,"Zillow Homes, LLC","Build memories in this stunning 3 bedroom, 3 bathroom home on a charming cul-de-sac street in Johnstown! Upon entering, you will immediately notice the thoughtful floor plan that guides you to the shared spaces. The spacious living room features large windows allowing natural light to cascade in and flows effortlessly into the dining area. Delight your inner chef by preparing a meal in this eat-in kitchen with durable countertops, crisp white cabinetry, and sleek appliances. Venture out to your fenced-in backyard and deck to host a BBQ or just enjoy some fresh Colorado air! After a long day, retreat to your primary bedroom boasting an oversized closet and en suite bathroom. Conveniently located near Sunrise Park, Mad Russian Golf Club, nearby schools, shopping, and dining!",soft%20close
15,"$616,100","4056 Mandall Lakes Dr, Loveland, CO 80538",5,https://www.zillow.com/homedetails/4056-Mandall-Lakes-Dr-Loveland-CO-80538/248796815_zpid/, House,4,"3,132",Austin Edwards,,"Zillow Homes, LLC","Pride of ownership shines throughout this 5 bedroom, 3.5 bathroom two-story home. You will love the open floorplan flooded with natural light as you enter the house. The living room calls you to settle in, relax and read your favorite book after a long day next to the fireplace. The kitchen features plenty of durable countertops, a gas range, a huge pantry, an island with additional seating, and spacious cabinets. The breakfast nook has a bay window, and food preparation and serving your guests will become a simple task. The primary bedroom is a lovely retreat and features an en suite bathroom with a garden tub, dual vanity, a spa-like shower, and a walk-in closet. The covered front porch is ideal for enjoying a cup of coffee on a sunny morning. The back patio is the perfect barbecue and gathering spot. Long Pine Park is in your neighborhood. Restaurants, grocery stores, and I-25 are all within a 10-minute drive.",soft%20close
16,"$461,900","4850 Findon Pl, Colorado Springs, CO 80922",4,https://www.zillow.com/homedetails/4850-Findon-Pl-Colorado-Springs-CO-80922/13538485_zpid/, House,3,"1,832",Austin Edwards,,"Zillow Homes, LLC","Be among the first to see this well-maintained 4 bedroom, 3 bathroom single-family home nestled in a cul-de-sac on a large lot. Entering you will be met with vaulted ceilings and a spacious floorplan that lets natural light settle in all the right places. Prepare a delicious meal in this gourmet kitchen with durable countertops, crisp white cabinetry, sleek appliances, and ample cabinet space, perfect for entertaining. Retreat to the relaxing primary bedroom with an en suite bathroom and a spacious closet. The fully fenced-in backyard sports a large wooden deck, and a huge lawn, great for all sorts of recreational activities. Conveniently located nearby Powers Corridor, several parks, and shopping.",soft%20close
17,"$495,000","636 Torrey Pines Ln, Johnstown, CO 80534",6,https://www.zillow.com/homedetails/636-Torrey-Pines-Ln-Johnstown-CO-80534/14082722_zpid/, House,3,"2,462",Austin Edwards,,"Zillow Homes, LLC","Prepare to fall in love with this gorgeous 6 bedroom, 3 bathroom, single-family ranch home in the prestigious area of Johnstown. Enjoy a few quiet moments in the afternoon with your front-covered porch. Upon entry, you are met with sleek wood-like flooring, large windows, and high vaulted ceilings. The open concept in the kitchen and living room is perfect for comfortable living and entertaining. The chef of the household will enjoy cooking in this kitchen with ample cabinet space, durable countertops, and a large kitchen island that will help make food preparation and serving your guests a simple and easy task. The primary bedroom is on the main floor, has an en suite bathroom, a jetted tub, tiled backsplash, and a sizeable walk-in closet. The finished basement is spacious and has a kitchen to host gatherings or enjoy some movie nights with friends! Located minutes away from local parks, and dining options.",soft%20close
18,"$630,300","6853 Tenderfoot Ave, Firestone, CO 80504",4,https://www.zillow.com/homedetails/6853-Tenderfoot-Ave-Firestone-CO-80504/71349172_zpid/, House,4,"4,462",Austin Edwards,,"Zillow Homes, LLC","If you are looking for luxury living and a spacious floor plan; the search is over! A spectacular 4 bedroom, 3.5 bathroom home located in Firestone. This generously sized home features an attached 2 car garage, high ceilings, a cozy fireplace, a fully enclosed backyard oasis, and is perfect for entertaining family and friends. Upon entering, you immediately notice the open floor plan and natural lighting. Enjoy cooking in this kitchen that offers sleek appliances, dual ovens, spacious countertops, ample cabinet space, a kitchen island, and breakfast bar with room for seating. After a long day at work, retreat to the comfort of the primary bedroom, complete with a connecting bathroom with double vanity sinks. This home is a rare find and move-in ready. Conveniently located near parks, dining, schools, and major roads for an easy commute.",soft%20close
19,"$582,900","6946 Buckskin Dr, Littleton, CO 80125",4,https://www.zillow.com/homedetails/6946-Buckskin-Dr-Littleton-CO-80125/13488083_zpid/, Condo,3,"2,631",Austin Edwards,,"Zillow Homes, LLC","Don’t miss out on this beautiful 4 bedroom, 3 bathroom condominium in the Ramparts at Roxborough community! Mature trees line the street and lead you into a home with an inviting layout and brilliant natural light. Host guests in the large living room with large windows, tall ceilings, and a luxurious fireplace perfect for cozying up by on a chilly evening. Prepare meals in the charming kitchen surrounded by ample countertop and cabinet space as well as sleek appliances. The enormous primary bedroom features a vaulted ceiling, a roomy closet, and an en-suite bathroom with an enclosed glass shower. Make the backyard your private oasis or host a barbeque under the partially covered deck surrounded by lush landscaping. Located near Arrowhead Golf Course, Waterton Canyon hiking, and 45 minutes from downtown Denver!",soft%20close
