,prices,address,beds,links,type,baths,sq_feet,Listing Agent Name,Listing Agent Contact,Listing Agent Company,Description,Key Word
0,"$750,000","8261 W 70th Ave, Arvada, CO 80004",3,https://www.zillow.com/homedetails/8261-W-70th-Ave-Arvada-CO-80004/13714917_zpid/, Coming soon,3,"2,292",Katie Kessler,720-351-5110,KELLER WILLIAMS AVENUES REALTY,"This incredible South facing split level in Huntington Heights is nestled in one of Arvada's most desirable neighborhoods with breathtaking City Views.  Southern exposure allows for a light filled open living space accented by a beautiful brick fireplace where you can spread out comfortably and entertain your guests.  Take in Denver's Skyline from the comfort of your living room, extended dining room, and covered front deck ideal for sipping your morning coffee and watching the sunrise.  The view of the city lights at night can't be forgotten as well.  Tastefully updated kitchen includes high end luxury vinyl plank flooring, soft close drawers and cabinets with pull-out shelving, granite countertops, backsplash, recessed lighting, and pantry.  Custom built-ins give the home that mid-mod feel and allows for you to display your finest dinnerware.  Newly remodeled main level master suite boasts a large walk-in closet, 5 piece owners bath featuring spa-like jacuzzi soaking tub, double sinks, and top of the line shower system.  Updated powder room with bidet.  Downstairs offers an additional cozy living space with a fireplace, 2 more bedrooms, 3/4 bath, laundry room with washer and dryer included, and plenty of storage.  Mature landscaping consists of a variety of fruit trees and expansive garden area with hail resistant netting, offering a serene and private backyard setting for you to enjoy Colorado living at its best.  Adorable potting shed adds charm and is a gardeners dream.  Entertain on the 26x12 trex deck with custom railing.  Newer Roof, Boiler, and Tankless Hot Water Heater.  Just minutes from Historic Olde Town's shopping, dining, light rail, and more! Truly an opportunity not to be passed up!",soft%20close
1,"$278,000","12594 E Pacific Cir, Aurora, CO 80014",1,https://www.zillow.com/homedetails/12594-E-Pacific-Cir-Aurora-CO-80014/2066667884_zpid/, Condo,1,877,Anna Bliska,720-484-9360,Coldwell Banker Realty 26,"Fully remodeled ground level condo in the highly sought-after Heather Ridge community and Cherry Creek school district! The kitchen boasts custom soft close cabinets, high-end granite countertops, pendant lights, an extra deep sink with high tech faucet, stainless steel appliances, and canned lighting. The flooring is laminate and thick carpet with tempurpedic padding. Two ceiling fans add year around comfort, and they are reversible for winter. The cozy wood burning fireplace is perfect for the cold months. New double pained windows and sliding glass door leading out to covered patio. Spacious bedroom with a large redesigned closet. New bathroom with custom soft close cabinets, spacious shower with massage shower-head, custom tile and added nook for soaps and shampoo. Added bonus: All popcorn removed from ceilings! Garage includes 8’ by 4’ overhead storage rack and Rocksolid Metallic Orange Floor Coating. The community offers a newly renovated club house that includes pool and tennis courts. Located close to almost everything including shopping, restaurants, schools, parks. Prime location with easy access to I-225, DTC, Denver Airport and downtown Denver. Just minutes to Denver RTD rail system that operates 365 days a year! Showings start Friday.",soft%20close
2,"$499,000","2226 Daley Dr, Longmont, CO 80501",4,https://www.zillow.com/homedetails/2226-Daley-Dr-Longmont-CO-80501/13227108_zpid/, House,2,"1,984",Heather White,303-588-3317,"White & White Realty, Inc.","Beautifully updated home located on a culdesac in northwest Longmont.   Enjoy the summers evenings on your large back deck overlooking your huge backyard. The kitchen has newer soft close cabinets and SS appliances which all stay including the washer and dryer.  The bathrooms have newer vanities and fixtures.  This is a lovely, clean home in a great neighborhood.  Please follow all Covid procedures.  Easy to show. ** Multiple offers have been received.  Please submit all highest and best offers by 5:pm MST Tuesday, Jan., 25th.",soft%20close
3,"$345,000","72 Everett Dr, Colorado Springs, CO 80911",3,https://www.zillow.com/homedetails/72-Everett-Dr-Colorado-Springs-CO-80911/13640188_zpid/, House,1,"1,051",Cheryle F Burgess PSA e-PRO,719-457-3815,"RE/MAX Advantage Realty, Inc.","Beautifully Updated Ranch Style Home Nestled On  A Private Cul-De-Sac Lot.  Home Updates Include Stainless Steel Kitchen Appliances, Custom Interior Paint, Luxury Vinyl Plank Flooring & Newer Carpeting.  This Home Remodel Includes  Top Of The Line Custom Cabinetry With Soft Close Feature, Tile Backsplash, New Vinyl Windows, New Interior Doors, New Lighting & More.  The Lot Encompasses Over A Quarter Acre Of Land And Boasts Spectacular Views Of Pikes Peak.  One Car Garage and Additional Parking Space For RV Parking Is Also A Wonderful Addition To This Home. This Home Shows True Pride Of Ownership.",soft%20close
4,"$449,000","1820 Elm Ave, Canon City, CO 81212",3,https://www.zillow.com/homedetails/1820-Elm-Ave-Canon-City-CO-81212/218694698_zpid/, House,2,"1,124",Ashley Adrian,719-283-1170,Keller Williams Performance Realty,"This unique, fully remodeled 1124 sq ft sturdy ranch home features 3 bedrooms, 2 bathrooms and two workshops. Every surface of this home has been touched during this architect-designed renovation. The open concept living room opens to the gourmet kitchen with soft-close cabinets, top-line stainless LG smart appliances, gas range, pot-filler, oversized farm sink, leathered porcelain counters and six-foot center island with quartzite slab. Dining room features tongue and groove wood ceiling with cove lighting and hidden-storage seating. From the dining room, a sliding glass door opens to a spacious patio looking out to the backyard and mountains. The original oak floors were refinished. Wi-fi connected dimming light switches, appliances, Nest thermostat, smoke/Co2 detectors. USB B-C adapters integrated in many wall outlets. Ring alarm system with exterior lights/cameras. All new wiring and electric with energy efficient soft LED recessed fixtures and accent lighting features. Ceiling fans in all bedrooms. New furnace with central A/C. All plumbing replaced and new sewer line. Custom tile work in kitchen & bathrooms. Powered anti-fog backlit vanity mirrors in both bathrooms. Two sun-tunnels fill interior spaces with natural light. New HE windows and patio doors and new roof. Convenient 144 sq foot downstairs storage area just off kitchen. New LG wash-tower. The workshop has new utility connections and is ready to be finished, with new roof and stucco exterior to match the house.",soft%20close
5,"$850,000","8792 E Grand Ave, Denver, CO 80237",4,https://www.zillow.com/homedetails/8792-E-Grand-Ave-Denver-CO-80237/13427144_zpid/, Coming soon,3,"2,773",Emily Chaney,303-564-3534,"BSW Real Estate, LLC","This stunning 1970’s Pine Valley home has been professionally updated with no detail spared. This is not a fix and flip. The home has designer colors, hickory floors throughout and thoughtful modern amenities. The beautiful open kitchen was expanded to house an oversized island, coffee bar and appliance wall. The kitchen was appointed with grey cabinets that have soft close design and pull-out drawers, quartz counters, and custom lighting fixtures. The large windows pour in light and give an open view to the meticulously landscaped backyard. The kitchen opens to the dining with wainscoting details and a new sliding door. There is a large living room with vaulted ceilings at the front of the home. The lower level has a cozy fireplace with a custom wood mantle and real barn wood details. There is a wet bar or second kitchen for future mother in law space, large bedroom, updated bathroom with walk in shower. Upstairs you will find a true primary bedroom with a stunning 5 piece ensuite, heavenly soaking tub and two closets, one that is walk in. There are two additional large bedrooms, a fully remodeled bathroom, utility room and storage. The owners have gone above and beyond in installing systems including a brand new roof, new gutters, two furnaces and two ac units as well as a tankless hot water heater. They have also had the home professionally painted, new doors and a new garage door installed. The yard has a brand new concrete patio poured, newer pergola and a storage shed. The owners paid in full for the solar which will be a huge savings to the next buyer.  It dots the i’s and crosses the t’s of any buyers wish list by finishing up with a large two car garage. The home is walking distance to George Wallace Park and minutes to Belleview Square Shopping Center, Cherry Creek State Park and the Denver Tech Center.",soft%20close
6,"$799,000","3233 N Marion St, Denver, CO 80205",3,https://www.zillow.com/homedetails/3233-N-Marion-St-Denver-CO-80205/13306070_zpid/, House,2,"1,705",Pat Sanchez,303-523-9200,Resident Realty South Metro,"Welcome to this beautiful remodeled 3 bedroom 2 bathroom Victorian home.  When you open the front door you are greeted with high ceilings, gleaming hardwood floors . As you enter the main living space you will see exposed brick and an open concept. There is 1 bedroom and a bathroom on the main floor. In the kitchen you have beautiful new soft close white shaker cabinets, quartz countertops, new appliances with a smart hub refrigerator and a península to enjoy.  The laundry room is on the main level and there is also an amazing bathroom with a walk-in shower. As you go upstairs you have amazing black powder coated stair railings and hardwood stairs. Upstairs you have two bedrooms, a bathroom with a dual vanity and an amazing walk-in shower. Outside you have a private fenced backyard with new sod, and 2 private parking spaces in back. New high efficiency furnace, a/c and water heater. This home has an outstanding centralized location. A few blocks away and you're in the heart of RINO. Quick access to downtown Denver. Close to shopping. An amazing house in the heart of Denver. Come see for yourself.",soft%20close
7,"$775,000","1429 Niagara St, Denver, CO 80220",4,https://www.zillow.com/homedetails/1429-Niagara-St-Denver-CO-80220/13389632_zpid/, Coming soon,2,"2,299",Illona Gerlock,303-809-1235,Coldwell Banker Realty 18,"Stunning 1940's brick ranch, remodeled in 2018, and located in the Montclair neighborhood of Denver! As you enter, hardwood floors greet your feet & flow throughout the main floor. The main level floor plan has been opened up with the addition of structural beams during the remodel. The great room & kitchen flow seamlessly together making it great for entertaining, or any layout flexibility. The kitchen is a chef's dream! It boasts black granite countertops, 42"" white soft-close cabinets, white dimensional subway tile backsplash, wood-look tile floors, Bosch stainless steel appliances, including a 5-burner gas range. The attached garage was converted into an inviting and cozy, sunken family room with vaulted ceilings & skylight. 2 bedrooms on the main floor have charcoal gray solid-core doors, carpeted floors, and single closets. The uniquely designed full bathroom features black & white decorative floor tile, black marble countertops, and completes the main floor. The basement holds the master suite, auxiliary bedroom, laundry room, and utility closet. The spacious master suite includes an open sitting area with gas fireplace, a 5-piece master bathroom, and a walk-in closet with built-in folding table. The master bathroom welcomes you with striking Carrara marble countertops, tile floors, and tile half wall. The shower stall includes a pebble floor, bench, glass door, and marble tile surround. Both basement bedrooms feature solid-core doors & carpeted floors. The large laundry room has wood-look laminate floors, granite countertops, utility sink, and soft-close cabinetry. The backyard includes a stamped concrete patio, new fencing, storage shed, professional landscaping, and an oversized 2-car garage that includes a 2nd fridge & built-in shelving. Less than a mile to grocery, banking, brewery, restaurants, and Montclair Park with tennis courts, horseshoe pits, and more. 2 miles to City Park, Denver Zoo, the Museum of Nature & Science, and Lowry Plaza. Welcome Home!",soft%20close
8,"$460,000","22152 E Dry Creek Pl, Aurora, CO 80016",3,https://www.zillow.com/homedetails/22152-E-Dry-Creek-Pl-Aurora-CO-80016/67445797_zpid/, Townhouse,4,"2,429",Fred Smith,303-930-5132,RE/MAX Masters Millennium,"You will love coming home to this gorgeous townhome with a great location only steps away from the pool and playground!  New carpet, flooring, paint and railings throughout!  Relax by the gas fireplace in the comfortable living room with built-in surround sound speakers and new gorgeous LifeProof luxury vinyl floors that extend throughout the main level.  Enjoy cooking in the beautiful kitchen with granite counters, tile backsplash, soft close Cherry cabinets with pull-out drawers, under cabinet lighting, pantry, breakfast nook and new stainless steel appliances.  Escape to the lovely master bedroom with a bay window, walk-in closet and master bath with two sinks.  Use the basement as a family room or as a 3rd bedroom with a private bath and walk-in closet.  Benefit from the garage work bench and 220 outlet to charge your car.  Have a barbeque on the enlarged and fenced in back patio or take your dog on a walk to the dog park.  Close to the Saddle Rock Village shopping center and Southlands too!",soft%20close
9,"$461,900","4850 Findon Pl, Colorado Springs, CO 80922",4,https://www.zillow.com/homedetails/4850-Findon-Pl-Colorado-Springs-CO-80922/13538485_zpid/, House,3,"1,832",Austin Edwards,,"Zillow Homes, LLC","Be among the first to see this well-maintained 4 bedroom, 3 bathroom single-family home nestled in a cul-de-sac on a large lot. Entering you will be met with vaulted ceilings and a spacious floorplan that lets natural light settle in all the right places. Prepare a delicious meal in this gourmet kitchen with durable countertops, crisp white cabinetry, sleek appliances, and ample cabinet space, perfect for entertaining. Retreat to the relaxing primary bedroom with an en suite bathroom and a spacious closet. The fully fenced-in backyard sports a large wooden deck, and a huge lawn, great for all sorts of recreational activities. Conveniently located nearby Powers Corridor, several parks, and shopping.",soft%20close
10,"$578,300","10186 Ventura St, Commerce City, CO 80022",4,https://www.zillow.com/homedetails/10186-Ventura-St-Commerce-City-CO-80022/72297713_zpid/, House,3,"3,166",Austin Edwards,,"Zillow Homes, LLC","This impressive 4 bedroom, 3 bathroom home can be found in the Reunion community of Commerce City! Upon entering, you will immediately notice gorgeous hardwood floors, brilliant natural light, and an open concept layout with high ceilings. The kitchen is perfect for entertaining, featuring durable countertops, sleek appliances, ample cabinet space, and a breakfast bar with room for seating. The adjoining living room features a warm, inviting fireplace to cozy up to and escape those cold Colorado nights. After a long day, retreat to the relaxing primary bedroom, complete with a walk-in closet, a 5-piece en suite bathroom with dual vanity sinks and a large soaking tub. This home also includes an attached 2-car garage, a fully enclosed backyard oasis, and pergola covered patio, perfect for entertaining. You will love being conveniently located close to Southlawn Park, dining, parks, and major roads for an easy commute.",soft%20close
11,"$495,900","10532 Cherry St, Thornton, CO 80233",3,https://www.zillow.com/homedetails/10532-Cherry-St-Thornton-CO-80233/13004898_zpid/, House,2,"1,244",Austin Edwards,,"Zillow Homes, LLC","Make lasting memories in this charming 3 bedroom, 2 bathroom split-level home in Thornton! As you enter, you are welcomed into a transitional living space with dramatic vaulted ceilings and lots of natural light. Follow the wood flooring into the eat-in kitchen boasting a stylish backsplash, granite countertops, sleek appliances, and a plethora of cabinet space. The lower level invites you in to relax and curl up next to the wood-burning brick surround fireplace with a good book. The sliding glass door leads you out to your private oasis with a patio, great for entertaining! Venture up to the primary suite with a vaulted ceiling, a sizable closet, and an en suite bathroom. There are two additional bedrooms with vaulted ceilings and a shared bathroom on this sprawling second floor. Close to Riverdale Open Space and Prairie dog habitat, trails, Thornton Sports Complex, Carpenter Park, shopping, dining options, and more!",soft%20close
12,"$384,900","1966 Birmingham Loop, Colorado Springs, CO 80910",3,https://www.zillow.com/homedetails/1966-Birmingham-Loop-Colorado-Springs-CO-80910/294979186_zpid/, Townhouse,3,"1,692",Austin Edwards,,"Zillow Homes, LLC","Get ready to fall in love with a spectacular 3 bedroom, 2.5 bathroom townhouse located in the Polaris Peak community. As you enter this two-story home, you will be impressed with an open floorplan that has natural lighting in all the right places. Settle in and relax in the living room as you enjoy your next movie or game night. The kitchen is a chef's dream and features durable countertops, plenty of dark cabinets, a pantry, a gas range, and an island that offers additional seating. The dining area next to the kitchen will allow you to prepare meals and serve guests efficiently. After a long day, retreat to the primary bedroom with a walk-in closet and an en suite bathroom with dual vanity and spa-like shower. Enjoy a cup of coffee on a sunny morning on the front porch. You can quickly get to the local grocery stores, restaurants, and I-25; they are all within a 10-minute drive.",soft%20close
13,"$479,900","618 Wadas Ct, Johnstown, CO 80534",3,https://www.zillow.com/homedetails/618-Wadas-Ct-Johnstown-CO-80534/14082675_zpid/, House,3,"2,656",Austin Edwards,,"Zillow Homes, LLC","Build memories in this stunning 3 bedroom, 3 bathroom home on a charming cul-de-sac street in Johnstown! Upon entering, you will immediately notice the thoughtful floor plan that guides you to the shared spaces. The spacious living room features large windows allowing natural light to cascade in and flows effortlessly into the dining area. Delight your inner chef by preparing a meal in this eat-in kitchen with durable countertops, crisp white cabinetry, and sleek appliances. Venture out to your fenced-in backyard and deck to host a BBQ or just enjoy some fresh Colorado air! After a long day, retreat to your primary bedroom boasting an oversized closet and en suite bathroom. Conveniently located near Sunrise Park, Mad Russian Golf Club, nearby schools, shopping, and dining!",soft%20close
14,"$423,900","4695 Meadowland Blvd, Colorado Springs, CO 80918",4,https://www.zillow.com/homedetails/4695-Meadowland-Blvd-Colorado-Springs-CO-80918/13583603_zpid/, House,2,"1,621",Austin Edwards,,"Zillow Homes, LLC","Photos coming soon. This charming 4 bedroom, 2 bathroom home is located in a beautiful cul-de-sac surrounded by mature trees! As you enter you will notice an open bi-level floorplan with brilliant natural light coming through multiple windows. Entertain guests in the living room which includes tall ceilings and easy access to the dining area. The home cook will love preparing meals in the kitchen featuring modern appliances, stone-look countertops, a luxurious backsplash, and ample cabinet storage. Retreat to the primary bedroom and create your private oasis and enjoy a spacious closet. Add your finishing touches to the backyard and host a barbeque or a summer party amongst the lush lawn and a large deck. Conveniently located near Keller Park, Costco, and I-25.",soft%20close
15,"$500,900","6932 Red Cardinal Loop, Colorado Springs, CO 80908",4,https://www.zillow.com/homedetails/6932-Red-Cardinal-Loop-Colorado-Springs-CO-80908/121870131_zpid/, House,3,"2,965",Austin Edwards,,"Zillow Homes, LLC","Photos coming soon! A charming 4 bedroom, 2.5 bathroom two-story home awaits its new owners. As you enter, you will be impressed by an open concept floorplan that lets natural light settle in all the right places. After a long day, relax in the living room as you settle in to watch a new release movie or start your next streaming binge next to the fireplace. The eat-in kitchen is a dream with tons of durable countertops, sleek appliances, a gas range, spacious cabinets, and an island that offers additional seating. The dining room is next to the kitchen; preparing food and serving guests will be a dream. Retreat to the primary bedroom to enjoy your large walk-in closet, an en suite bathroom with dual vanity, a large soaking bathtub, and a separate spa-like shower. The spacious back patio will be the perfect spot for a weekend barbecue or to enjoy your morning coffee. Grocery stores, restaurants, and I-25 are 15 minutes away.",soft%20close
16,"$491,900","6165 Fiddle Way, Colorado Springs, CO 80925",4,https://www.zillow.com/homedetails/6165-Fiddle-Way-Colorado-Springs-CO-80925/247508713_zpid/, House,3,"2,768",Austin Edwards,,"Zillow Homes, LLC","Make lasting memories in this beautiful 4 bedroom, 2.5 bathroom home in Colorado Springs. As you enter, you will fall in love with the turnkey house with a plethora of natural light settling in all the right places. Get cozy in the living room as you settle in for your next movie or game night. Fulfill a chef's dream with durable countertops, sleek appliances, spacious dark cabinets, tile backsplash, and an island in the kitchen. The adjacent dining area will make food preparation and serving your guests a simple task. Retreat to the primary bedroom with vaulted ceiling, walk-in closet space, and en suite bathroom with dual vanity. The fenced backyard is generously sized and will be perfect for grilling and entertaining! Stingray Park is a couple of minutes away. Restaurants, grocery stores, and I-25 are 15 minutes from this home.",soft%20close
17,"$495,000","636 Torrey Pines Ln, Johnstown, CO 80534",6,https://www.zillow.com/homedetails/636-Torrey-Pines-Ln-Johnstown-CO-80534/14082722_zpid/, House,3,"2,462",Austin Edwards,,"Zillow Homes, LLC","Prepare to fall in love with this gorgeous 6 bedroom, 3 bathroom, single-family ranch home in the prestigious area of Johnstown. Enjoy a few quiet moments in the afternoon with your front-covered porch. Upon entry, you are met with sleek wood-like flooring, large windows, and high vaulted ceilings. The open concept in the kitchen and living room is perfect for comfortable living and entertaining. The chef of the household will enjoy cooking in this kitchen with ample cabinet space, durable countertops, and a large kitchen island that will help make food preparation and serving your guests a simple and easy task. The primary bedroom is on the main floor, has an en suite bathroom, a jetted tub, tiled backsplash, and a sizeable walk-in closet. The finished basement is spacious and has a kitchen to host gatherings or enjoy some movie nights with friends! Located minutes away from local parks, and dining options.",soft%20close
18,"$461,900","4850 Findon Pl, Colorado Springs, CO 80922",4,https://www.zillow.com/homedetails/4850-Findon-Pl-Colorado-Springs-CO-80922/13538485_zpid/, House,3,"1,832",Austin Edwards,,"Zillow Homes, LLC","Be among the first to see this well-maintained 4 bedroom, 3 bathroom single-family home nestled in a cul-de-sac on a large lot. Entering you will be met with vaulted ceilings and a spacious floorplan that lets natural light settle in all the right places. Prepare a delicious meal in this gourmet kitchen with durable countertops, crisp white cabinetry, sleek appliances, and ample cabinet space, perfect for entertaining. Retreat to the relaxing primary bedroom with an en suite bathroom and a spacious closet. The fully fenced-in backyard sports a large wooden deck, and a huge lawn, great for all sorts of recreational activities. Conveniently located nearby Powers Corridor, several parks, and shopping.",soft%20close
19,"$578,300","10186 Ventura St, Commerce City, CO 80022",4,https://www.zillow.com/homedetails/10186-Ventura-St-Commerce-City-CO-80022/72297713_zpid/, House,3,"3,166",Austin Edwards,,"Zillow Homes, LLC","This impressive 4 bedroom, 3 bathroom home can be found in the Reunion community of Commerce City! Upon entering, you will immediately notice gorgeous hardwood floors, brilliant natural light, and an open concept layout with high ceilings. The kitchen is perfect for entertaining, featuring durable countertops, sleek appliances, ample cabinet space, and a breakfast bar with room for seating. The adjoining living room features a warm, inviting fireplace to cozy up to and escape those cold Colorado nights. After a long day, retreat to the relaxing primary bedroom, complete with a walk-in closet, a 5-piece en suite bathroom with dual vanity sinks and a large soaking tub. This home also includes an attached 2-car garage, a fully enclosed backyard oasis, and pergola covered patio, perfect for entertaining. You will love being conveniently located close to Southlawn Park, dining, parks, and major roads for an easy commute.",soft%20close
