,prices,address,links,bed,type,baths,sq_feet,Listing Agent Name,Listing Agent Contact,Listing Agent Company,Description,Key Word
28,"$235,000","1010 E Madison Ave, Harlingen, TX 78550",https://www.zillow.com/homedetails/1010-E-Madison-Ave-Harlingen-TX-78550/50714097_zpid/,4, House,3,"3,361",David A. Tobar,956-867-2340,Trademark Real Estate Group,"Vintage remodeled home in an established neighborhood. This property includes: 4 bedrooms, 2 and 1/2 baths, recently remodeled master bedroom and bath, kitchen has a new lay out and upstairs bedrooms have been updated with its own unique side entry. On top of that this property also has an additional structure in the back that has a two additional units that each have two bedrooms, one full bath, laundry room, kitchen and a spacious living room, that each have their own private entry. The additional structure in that back that is soon to be completed can be easily used as an additional source of income as rental properties. Centrally located in Harlingen this property is a must see.",updated
29,"$204,000","4307 Colby Dr, Killeen, TX 76542",https://www.zillow.com/homedetails/4307-Colby-Dr-Killeen-TX-76542/49543807_zpid/,4, House,2,"1,605",Tina Walden,254-493-5076,Nextage Lone Star Realty,"YOU WILL NOT WANT TO MISS OUT ON THIS HOME! The sellers have taken great pride in this home and now you can benefit from all their updating. Updated features: paint throughout the home, freshly stained fireplace mantle, fresh clean carpet in all bedrooms, kitchen cabinets painted a popular grey color, quartz countertop’s added to kitchen and both bathroom’s. Previous sellers added insulated garage door and a portable stand alone AC for the garage area, making for a comfortable Texas summer workspace. This home will not last long.",updated
30,"$199,450","1015 Marshall Leigh Rd, Marshall, TX 75672",https://www.zillow.com/homedetails/1015-Marshall-Leigh-Rd-Marshall-TX-75672/239921463_zpid/,3, House,2,"1,977",Christy Orear,903-238-6846,COLDWELL BANKER LENHART,"Peaceful country feeling just minutes from everything!  Log cabin is situated on a 1 acre lot, with a huge front porch to sit and rock.  Updates include roof, exterior paint, HVAC and water heater.  Large dining and living area with wood burning fireplace.  Covered back patio with attached carport and storage area.  Great location off Hwy 43, near Marshall Country Club, it's the perfect place to call home.",updated
31,"$299,900","415 Magnolia Estates Dr, League City, TX 77573",https://www.zillow.com/homedetails/415-Magnolia-Estates-Dr-League-City-TX-77573/68405539_zpid/,4, House,2,"1,802",Jennifer Bustamante,281-602-9923,Realty Associates,"Honey Stop the Car! FANTASTIC 4 bedroom, 2 bath home beautifully gorgeous inside with updated doors, neutral colors, tile & wood look flooring, beautiful tile & lighting, wonderful open concept! Formal dining with chandelier on the other side of the living room. Windows with blinds throughout. Nicely sized closets. Beautiful bathrooms with updated tile, great mirrors, faucets, etc. Kitchen has granite countertops, attractive cabinets, tile backsplash, gas range, 2-sided breakfast bar with pendant lights, elevated ceilings and more! Large front yard.",updated
32,"$399,900","13046 Rainey Ridge Ln, Abilene, TX 79602",https://www.zillow.com/homedetails/13046-Rainey-Ridge-Ln-Abilene-TX-79602/120679391_zpid/,4, House,2,"1,996",Pamela Trull,,Arnold-realtors,"Beautifully renovated home, sitting on 1.001 acre, in quiet sub-division with beautiful views!  Renovations include new flooring throughout and both showers have been re-tiled.  Updated, white kitchen cabinets and new granite countertops and backsplash.  Spacious master bedroom has en-suite bath with new shower.   Living area fireplace is brick with shiplap installed above the fireplace. Inside has been newly painted.   Covered patio with large wooden deck in backyard, including a fire pit in the yard.  Deck has nice fencing with unobstructed views. There is also an adjoining side-yard for additional storage or would be a great place for pets.  Buyer and agent to verify schools and home square footage.",updated
33,"$235,000","8009 Bedwell Pl, Amarillo, TX 79121",https://www.zillow.com/homedetails/8009-Bedwell-Pl-Amarillo-TX-79121/50669836_zpid/,4, House,2,"2,188",The Connie Taylor Group,806-414-2750,Keller Williams Realty Amarillo,"Pucket West With Curb Appeal! 4 Bedroom, 2 Bath, 2 Car Garage Plus 2 Living Areas On A Quiet Cul-De-Sac With Mature Trees. HUGE family room with vaulted ceiling, beautiful wood laminate floors, built in desk, and cozy fireplace. This leads to a cheery sunroom w/ door to back yard. Kitchen has granite countertops,eat in bar,stack stone backsplash, high end stainless steel appliances, & updated cabinets! Dining area w/ bay window is open to kitchen. Spacious  Master Suite has 3/4 bath. Bedrooms 2 & 3 share a full bath. 4th bedroom is isolated. Crown molding, decorator paint colors, & great storage. Large backyard to enjoy!",updated
34,"$259,000","1035 Helms Rd, Houston, TX 77088",https://www.zillow.com/homedetails/1035-Helms-Rd-Houston-TX-77088/28088111_zpid/,4, House,2,"1,261",David Hulsey,713-692-2272,"David Hulsey, REALTORS","Remarkable updated home in desirable area very convenient to freeways and downtown. This home features an elegant patio 25x47 with finished wood ceiling, marble flooring in kitchen, dining and living room with granite counter top cabinets and kitchen island. Backsplash in kitchen is marble. Tiled shower in primary bath and tiled tub in second bath.",updated
35,"$289,900","3234 Hunters Glen Dr, Missouri City, TX 77459",https://www.zillow.com/homedetails/3234-Hunters-Glen-Dr-Missouri-City-TX-77459/27595321_zpid/,4, House,3,"2,304",Alan Hernandez,832-532-9229,White Picket Realty LLC,"It’s bright and windy, perfect day for a day of golf, or a pleasant stroll with your loved ones. You have found your sanctuary, a spacious and beautifully designed home walking distance from the Quail Valley City Centre, Golf course & Fitness Center. Home boasts an oversized and secured backyard with drive through garage, covered patio, beautiful pool & an amazing location. The interior floor plan allows for a large group with formal living and dining areas, breakfast room with a dry bar and an optional office/bedroom, in addition to generous sized bedrooms. Upgrades include; new roof, recently updated AC units & 2 water heaters, lifetime foundation warranty. Granite kitchen with custom under lighting and plenty of storage. This home includes a rare Hurricane room for your family's safety.",updated
36,"$254,900","4209 Lariat Dr, Baytown, TX 77521",https://www.zillow.com/homedetails/4209-Lariat-Dr-Baytown-TX-77521/28153760_zpid/,3, House,2,"1,816",William Malpass,409-284-1625,Connect Realty,"New Listing! This 3 bedroom, 2 bath home sits on quiet corner lot. It's a Must See with lots of beautiful updates and upgrades. Newly renovated kitchen with new shaker style cabinets, quartz countertops and stainless steel appliances. Home has fresh paint and new luxury vinyl flooring and tile throughout. Lots of closet space throughout  home, in addition to a seperate laundry room. Newly remodeled bathrooms with updated vanities, showers, tile and fixtures. Also has new solar screens, new driveway, new light fixtures inside and out. This home is Move-In Ready so Make your appointment today for a showing.",updated
37,"$269,000","9215 Hidden Ct, Magnolia, TX 77354",https://www.zillow.com/homedetails/9215-Hidden-Ct-Magnolia-TX-77354/80092648_zpid/,3, House,2,"1,783",Elizabeth Kenline,713-494-8225,BHGRE Gary Greene,"1 STORY on QUIET CULDESAC with HUGE FENCED backyard in beautiful family neighborhood.!  UPDATED TILE,  LIGHT FIXTURES, CEILING FANS, ETC.  Great open floorplan with 11 foot ceilings, LARGE MASTER BEDROOM WITH HUGE WALK-IN CLOSET, DOUBLE SINKS & SEPARATE SHOWER & GARDEN TUB IN MASTER BATH.  KITCHEN WITH LOTS OF COUNTER SPACE & BREAKFAST AREA. DINING ROOM COULD ALSO SERVE AS SECOND LIVING AREA OR STUDY. DOUBLE SINKS IN 2ND BATHROOM, FIREPLACE WITH GAS LOGS, CEILING FANS IN ALL BEDROOMS AND LIVING AREA, WINDOW BLINDS THROUGHOUT.  CONVENIENT LOCATION (ONLY A MILE FROM THE WOODLANDS) TO SHOPPING, RESTAURANTS, ET.C   ELEMENTARY SCHOOL AND COMMUNITY LAKE AND PLAYGROUND IN NEIGHBORHOOD.LOW TAX RATE.  NO MUD TAX.  HOME DID NOT FLOOD.",updated
38,"$149,900","5604 Boca Raton Blvd APT 151, Fort Worth, TX 76112",https://www.zillow.com/homedetails/5604-Boca-Raton-Blvd-APT-151-Fort-Worth-TX-76112/29062186_zpid/,3, Condo,3,"1,445",Shokor Jawshan,,Jpar Cedar Hill,"Very RARE Corner Lot 3 bedroom, 2.5 bath condo, with one bdrm downstairs, and other 2 upstairs.  New electric breaker panel, and plumbing for washer and dryer...all done with PERMITS.  Ordinarily, these units don't come with laundry connections, and have weaker breaker panels.  Updated kitchen cabinets, sink, GRANITE COUNTER, disposal system, and more. AC ducts cleaned 4 months ago.   Comes with designated covered parking spot approximately 60 ft. to the front door. Patio is fenced in for extra privacy. Enjoy a scenic view of the courtyard and pool area from the second floor balcony.  The HOA fee covers the cost of hot and cold water, trash, the exterior of the building, roof, the lawn, and the pool.",updated
39,"$350,000","5148 W Fm 917, Godley, TX 76044",https://www.zillow.com/homedetails/5148-W-Fm-917-Godley-TX-76044/28642792_zpid/,4, House,2,"2,200",Dann Walley,,"The Sales Team, Realtors Dfw","This property has lots of possibility! It would be great for a business that needs room to park vehicles. It has 4.55 acres with a pond. Home features recently updated kitchen with an open floor plan to living room & dining room. There are 3 bedrooms & 2 bathrooms with a large master suite that has been added on. The add on has not been finished. The bedroom is being used, but there is space for a large closet & bathroom that has not been done so you can finish how you want.  The add on also has an office area or second living area. The home does need work. It would be great for an investor or developer that wanted to build additional homes. The garage has been converted, but garage door could easily be put on.",updated
40,"$190,000","4702 Casa Espana St, San Antonio, TX 78233",https://www.zillow.com/homedetails/4702-Casa-Espana-St-San-Antonio-TX-78233/26338537_zpid/,4, House,2,"1,413",Charles Renneker,210-833-6832,"JB Goodwin, REALTORS","Open floor plan living areas and kitchen! Great 4 bedroom, 2 full bath home with updated kitchen. Master Suite: bedroom, bathroom, walk in closet on the right side of the large living areas. 3 bedrooms and 1 full bathroom on the left side of the large living areas. Open Kitchen has lots of cabinets, granite, nice sink, faucet, and appliances. Master suite includes both a walk in closet and shower.  Nice location with lots of shopping and entertainment options. Near 35, 410, SAFC Soccer Stadium and Morgan's Wonderland. Quick access to Wurzbach Pkwy. This home is located in the North East Independent School District. Check and confirm room sizes, overall square footage. Sold as is.",updated
41,"$249,900","136 N Goliad St, Amarillo, TX 79106",https://www.zillow.com/homedetails/136-N-Goliad-St-Amarillo-TX-79106/50803946_zpid/,4, House,3,"1,952",Living TX Style Team,806-683-7026,"EXP Realty, LLC","PERFECT FOR AIR B&B, RENTAL or Home w/Mother-in-law or income producing Apt!  3/2 Home and 1/1 Apartment!  Beautifully UPDATED and REMODELED while maintaining the Charm and Character in this Wonderful West Hills Home! Newer windows in front of house bring in so much light in this cute living room, with touches of it's mid-century charm!  Gorgeous kitchen is open to a HUGE Den! Dishwasher, electric stove, 2 pantries!  Amazing Den w/Fireplace!  Luxury vinyl wood look tile; CHA!  New electrical box- All up to code!  Main bedroom w/bath!  Hall bath w/walk-in shower!  Sunroom and utility room!  2nd house has a living room, Kitchen w/gas stove, bedroom and large walk-in shower! Central heat, and new water heater!  Cute fenced backyard, Potting shed w/storm shelter inside!",updated
42,"$167,500","4906 Ripple Creek Dr, Baytown, TX 77521",https://www.zillow.com/homedetails/4906-Ripple-Creek-Dr-Baytown-TX-77521/28279875_zpid/,3, House,3,"1,558",Lesly Torres,832-283-1680,Coldwell Banker Realty,"This wonderful home has so much to offer! Upon entering you walk in to an open concept living area, an updated kitchen with lots of cabinet space! Primary bedroom has a nice walk in closet & a balcony to enjoy your morning coffee/tea. The secondary bedrooms upstairs have brand new carpet, and the spacious backyard is perfect for gatherings. Amenities in the subdivision include a great community building for gatherings/birthday parties & a neighborhood pool for residents to use. There is also a lot next door that is up for sale 4908 Ripple Creek Dr, MLS #85735098 it is fenced onto this property which calls for a HUGE backyard. Schedule a showing to see it for yourself!",updated
43,"$199,900","213 Chrystal Ln, Ore City, TX 75683",https://www.zillow.com/homedetails/213-Chrystal-Ln-Ore-City-TX-75683/90566244_zpid/,3, House,2,"1,356",Victoria Wolfe,903-720-3826,"TEXAS REAL ESTATE EXECUTIVES, THE DANIELS GROUP - GILMER","GREAT SPOT TUCKED AWAY FROM TOWN. THREE BEDROOM, 2 BATH WITH LARGE FENCED IN YARD. FRESH PAINT AND OTHER UPDATES THROUGHOUT THE HOME. 2 ADJACENT LOTS ALSO AVAILABLE FOR PURCHASE BUT ARE LISTED SEPARATELY. .",updated
44,"$52,000","18 Ash Ln, Brackettville, TX 78832",https://www.zillow.com/homedetails/18-Ash-Ln-Brackettville-TX-78832/97356759_zpid/,3, Home,2,"1,344",Dee Dee Brown,830-261-1970,Keller Williams Starr Realty,"Private location within walking distance to the 18 hole golf course.   1999 manufactured home has extra long paved driveway with covered parking,big fence back yard, 2 large storerooms/workshops, and plenty of natural open space around .  HVAC and roof have been recently updated and appliances convey. This great offering consists of 4 lots which may be negotiated with owner to be split under agreeable conditions. Enjoy 24 hour security, walking trails, swimming, golf and more in the beautiful Ft Clark Springs gated community.",updated
45,"$245,000","6115 Robin Frst, San Antonio, TX 78239",https://www.zillow.com/homedetails/6115-Robin-Frst-San-Antonio-TX-78239/26177710_zpid/,4, House,2,"1,631",Dayton Schrader,210-757-9785,eXp Realty,"MULTIPLE OFFERS!  Highest & Best Deadline 1/25/22 @ 5:00 pm.  Fabulous one-story brick home outside 410 inside the 1604 loop (less taxes, no HOA) and 15 minutes from Downtown! Move-in and enjoy this modern and updated home immediately! Two eating areas, updated paint, carpet, vinyl plank flooring, and ceramic tile throughout.  Roof and water heater are new within two years. Large master bedroom with tons of closet space also features a full en-suite bathroom with granite countertops. The eat-in kitchen features granite countertops.  New 2-inch faux wood blinds throughout.  2 1/2 car garage with garage attic access with fold downstairs.  Large back yard (just shy of a 1/4 acre) with covered patio and privacy fence perfect for entertaining! Extra privacy with no rear neighbors!  This one will go fast!",updated
46,"$289,000","310 E 43rd St, Odessa, TX 79762",https://www.zillow.com/homedetails/310-E-43rd-St-Odessa-TX-79762/50469665_zpid/,5, House,3,"3,859",Adriana Ontiveros,432-238-4528,"Home Charm Realty, LLC","Looking for a large family home? This is your chance to own this spacious, updated home!  Features include 5 bedrooms, 2 and a half baths, an office, and 3 living areas! Beautiful spacious kitchen has lots of cabinets, cabinet space, and a lovely breakfast bar. Backyard is perfecting for entertaining!  You will enjoy the pergola, turf, and stained wooden fence. Detached oversized 2 car garage with 1/2 bath.  Other features include RO and water softener. Call your favorite realtor today!",updated
47,"$250,000","10326 Sagevale Ln, Houston, TX 77089",https://www.zillow.com/homedetails/10326-Sagevale-Ln-Houston-TX-77089/28202552_zpid/,3, House,2,"1,910",Juan Luis Macedo,281-701-9303,"MRG Realty, LLC","The impressive living space is created by a modern interior and provides a formal dining room, expansive living areas and a flow-through living/dining area. Enjoy the sleek finishes in this well-equipped kitchen that has been beautifully updated and includes stainless-steel appliances, freestanding oven, granite countertops and white cabinetry. Sized for spacious comfort, the well-proportioned master bedroom affords a private bathroom and a wardrobe. Enjoy the indoor/outdoor lifestyle in your beautifully maintained backyard which includes a large Cover patio for outdoor grilling and creating unforgettable memories with you friends and family. A short drive to mixed-use shopping and dining areas. All the conveniences you could possibly need are just minutes away. This unique home won't last long. Want to know more? Call today.",updated
48,"$424,900","20667 County Road 189 N, Flint, TX 75762",https://www.zillow.com/homedetails/20667-County-Road-189-N-Flint-TX-75762/152588874_zpid/,3, House,2,"1,934",Brad Newberry,,Newberry Real Estate,"Precious updated home on 2.8 acres! Easy access to Tyler, Bullard, and Frankston with Lake Palestine just minutes away! Updated paint throughout the home gives it a fresh, bright feeling. Open living/kitchen/dining are perfect for entertaining. Brick fireplace and vaulted ceilings in the living. Spacious kitchen with gorgeous butcher block countertops and large island with granite countertop. Master is large and has updated en suite bathroom. Two guest rooms share an updated hall bath. Enjoy summertime in and around the pool! A stand-alone porch is the perfect place to host guests and relax. This one won't last long so see it today!",updated
49,"$365,000","6011 Brigstone Park Dr, Katy, TX 77450",https://www.zillow.com/homedetails/6011-Brigstone-Park-Dr-Katy-TX-77450/27547929_zpid/,4, House,3,"2,233",Leann Acuna,361-813-3143,San Antonio Portfolio KW RE,"Amazing Cinco Ranch home with a pool & spa and stunning updates throughout! Two story entry opens to the formal living & dining rooms that have elegant wainscoting & designer fixtures. Sliding barn doors in dining room open to the kitchen. The kitchen boasts slate appliances, granite, stone backsplash, farmhouse sink, painted white cabinetry, breakfast bar & adjoining casual dining area. Beautiful floor-to-ceiling stone fireplace in the family room. Custom hidden reading nook under the stairs. Laminate wood floors extend through the 1st floor. Custom built-in mud area in utility room. Master suite features a granite vanity w/dual vessel sinks, frameless glass shower & soaking tub. Energy efficient windows & exterior doors. Several home automation features including smart thermostat & security system. Large backyard has a pool w/rock waterfall and a covered patio. Conveniently located minutes from Westpark & 99. Less than 1 mile from the elementary & junior high.",updated
50,"$250,000","505 Clarice St, Grand Prairie, TX 75051",https://www.zillow.com/homedetails/505-Clarice-St-Grand-Prairie-TX-75051/27069281_zpid/,4, House,2,"1,526",Lisa A. Golding,,Keller Williams Realty-fm,"Charming drive up on this 4 bed, 2 bath home in the established neighborhood of Indian Hills. Being sold AS IS. Large covered porch accessible via stairs or ramp. Enter & appreciate rich wood  flooring through most of home with new carpet in bedrooms and gameroom. Living area with dining area that can accommodate formal or casual sets. Galley kitchen with granite counters, glass mosaic backsplash & 5 burner gas cooktop range. Split bedrooms with 2 in one wing & 2 in another. Both baths updated with granite, 1 with large walk-in tiled shower. Garage conversion makes great gameroom, study, flex living or bed 5. 2 car carport. Sprawling backyard.",updated
51,"$569,900","5411 Tyler Park Ln, Katy, TX 77494",https://www.zillow.com/homedetails/5411-Tyler-Park-Ln-Katy-TX-77494/89631192_zpid/,4, House,4,"3,307",Rebecca Locke,281-536-0724,Century 21 Parisher Prop.,"Nestled in the Park Place section of Cinco Ranch is this Highland Homes 4/3.5, 2.5 car garage, study, game and media rooms. The charming exterior has a gabled roof, brick, stone and architectural accents. Enter the home with soaring ceilings and hardwood floors in the entry, study and dining. The kitchen is appointed with SS appliances, island, gas cooktop and is open to the family room. In addition to the study there is a desk area convenient to the kitchen. There is a floor to ceiling rock FP w/cedar mantle and gas logs in the family room with wood floors. The living area overlooks a covered patio with a rock fireplace and oversized backyard which is pool ready! At the top of the stairs is a computer desk area that seats two. Large bedrooms up w/high ceilings, including the game and media rooms. Recent updates comprise of painted interior walls, trim, doors and all recessed lights replaced w/LED. Walk to neighborhood trails, lakes and highly acclaimed Seven Lakes Jr/Sr High Schools.",updated
52,"$185,000","4919 Grape Creek Rd, San Angelo, TX 76903",https://www.zillow.com/homedetails/4919-Grape-Creek-Rd-San-Angelo-TX-76903/75332971_zpid/,2, House,1,"1,580",Premier Realty Group,325-763-4663,Keller Williams Realty,"Ring in the new year with a new home! This cozy two bedroom one bath home has been recently updated with a new well, new insulation in the roof, new flooring, a recently serviced AC unit, and new windows! This welcoming home features a newly added laundry room with exceptional storage and a brand-new relaxing hot tub with beautiful trees on one acre of land. Conveniently located near the Coliseum and Lincoln Middle School, this move-in ready home has all the country feels (and appliances!) with the convenience of being in the city--and it's just waiting for you! Realtor is related to Seller.",updated
53,"$875,000","30302 Live Oak Trl, Georgetown, TX 78633",https://www.zillow.com/homedetails/30302-Live-Oak-Trl-Georgetown-TX-78633/29523406_zpid/,3,"<abbr class=""list",4,"3,802",Lori Schultz,,"Schultz Texas Properties, LLC","Looking for privacy and seclusion on over 6 acres with a gorgeous custom home close to Austin?  Then enter through your wroght iron security gate down the 380' winding driveway to your stunning rock and cedar home in Georgetown!  Large living area boasts high cathedral ceiling, tall rock fireplace with gorgeous live edge wood mantel, and a wall of windows looking out to the back acreage.  Open concept kitchen/living with dining area surrounded by windows with gorgeous wood trim throughout.  Three bedrooms plus loft, office (down) and bonus room (down).  Huge TREX wood deck with multiple areas to gather for outside entertaining or just watching the wildlife. Hot tub and fire pit also.  Garage connected to house by 24' windowed hall, storage area above garage approx. 11x27' with electric (could easily be renovated to a bonus room).  Updates include entire home just painted 1/22, gutters and roof 2021.  Two a/c units, 2 water heaters, antenna in attic for local channels.  Washer and Dryer convey, Refrigerator and gas grill are available for purchase.  Home is in 100 year flood plain.  The breezeway and kitchen areas flooded in 2010 while vacant, mold remediation completed May 2011, flood diversion completed 2012.  Home has not flooded since then due to the rock wall diverting water away.  Current owners installed rock/cut stone wall along SW property line to divert water away from house.  Voluntary HOA.",updated
54,"$185,000","6545 Ridgecrest Ln, Argyle, TX 76226",https://www.zillow.com/homedetails/6545-Ridgecrest-Ln-Argyle-TX-76226/27290954_zpid/,3, Home,4,"1,820",Thalia Valencia,,"Lugary, Llc","**Country living with NO city limits**SOLD AS IS**Very large MFH with a work shop (has electricity) & extra room added (has AC) that can be used as an office, extra bedroom, living area. Partial interior renovation (2015). Updated electrical panel, plumbing & 5 Ton AC unit. Kitchen fully remodeled (2016) appliances will stay. MFH is securely held down by metal posts in concrete and has an aluminum roof. Recently added cedar wood front deck. Plenty of land around property. Master bathroom has been partially remodeled. All electrical and plumbing work have been done. Bathroom is ready for vanities to be installed. Jacuzzi tub installed and working. Make it your perfect space with a little TLC! COME SEE!",updated
55,"$109,000","5121 Peachtree St #1/2, Houston, TX 77016",https://www.zillow.com/homedetails/5121-Peachtree-St-1-2-Houston-TX-77016/27872312_zpid/,2, House,1,754,Ty Robinson,346-291-0272,"Compass RE Texas, LLC",Come check out this recently renovated property in Northeast Houston. This home was updated with the latest real estate trends in mind. Don't miss this opportunity to acquire this property which is perfect for a starter home or investment to add to your portfolio.,updated
