,prices,address,links,bed,type,baths,sq_feet,Listing Agent Name,Listing Agent Contact,Listing Agent Company,Description,Key Word
56,"$568,900","7 Chipping Gln, San Antonio, TX 78257",https://www.zillow.com/homedetails/7-Chipping-Gln-San-Antonio-TX-78257/26476770_zpid/,3, House,2,"2,322",Matthew Resnick,210-849-8837,Kuper Sotheby's Int'l Realty,"Impeccable updated one-story home on a corner lot in The Dominion Gardens. Soaring ceilings and ample windows throughout make the home light and bright. The living room opens to the formal dining room with upgraded light fixtures. The updated kitchen offering gas cooking with pot filler, ample cabinetry space, custom backsplash, and granite countertops overlooks the breakfast area and family room with wood-burning fireplace. Luxurious and spacious master suite with sitting area features soaring ceilings, a spa-like bath with walk-in shower and garden tub, and large walk-in closet. Two additional spacious guest bedrooms afford room for all. Low maintenance yard with extensive outdoor patio spaces. Two-car garage plus golf cart garage. Golf course view from the street with access at the end of cul-de-sac. Lock and leave property! Recent updates include: roof (2019), HVAC (2020), water heater (2021), carpet, sprinkler system, and landscaping.",updated
57,"$265,000","9661 S Fm 548, Royse City, TX 75189",https://www.zillow.com/homedetails/9661-S-Fm-548-Royse-City-TX-75189/28889060_zpid/,2, House,2,"1,431",Ron Moore,,Team Moore,"Beautifully updated home with pier and beam foundation conveniently located between Rockwall, Royse City, Forney, and Terrell. This home is a one owner 2 bedroom 2 bath with 2 large living areas which sits on almost 1.5 acres and features a tree lined pond.    Don't miss the detached 4 car garage with electricity and 4 additional covered parking spaces, also has storage shed. Home renovations were competed July 2020. Includes washer & dryer, central HVAC replaced in 2021...",updated
58,"$1,149,000","3642 Quail Hollow St, Celina, TX 75009",https://www.zillow.com/homedetails/3642-Quail-Hollow-St-Celina-TX-75009/53112098_zpid/,5, House,4,"3,747",Michelle Campbell,,Coldwell Banker Realty Frisco,"Charming Country Estate situated on 1.01 ACRES in the heart of Celina with guest house! Completely updated luxury home with a farmhouse feel, simply STUNNING! Single story floor plan offers 7 in white oak plank wood flooring, large circular drive, mature trees and a white brick elevation! Kitchen is a show stopper and offers a built-in Kitchen-Aid fridge, Viking stove, walk in pantry, large island + an abundance of counter & cabinet space!Formal Dining and study floor to ceiling stone FP, all new fixtures, tile, counter tops & more. Huge Utility rm w-sink, built in cabinets!Massive Master Ste with a sitting area and all new bathroom! Backyard w-large covered patio overlooks the huge yard! Long list of upgrades",updated
59,"$279,000","242 Kirkaldy Dr, Houston, TX 77015",https://www.zillow.com/homedetails/242-Kirkaldy-Dr-Houston-TX-77015/28172846_zpid/,4, House,3,"2,064",Jacqueline Andel,281-630-8182,Keller Williams Elite,"Welcome to 242 Kirkaldy located in the desirable Woodforest subdivision.Spacious 4 bedroom,2.5 bath,has additional downstairs space for formal dining/study/game room as well as a small nook upstairs that can be used for an exercise area or student study.Located on a huge lot,allowing room for plenty of outdoor activities.Lovely brick and wood elevation with small covered front porch with an over grown oak tree.Updated kitchen with upscale custom espresso kitchen cabinets,under cabinet lighting and black galaxy granite counters.The home features hand scraped real wood floors downstairs,new carpet in the master bedroom,tile in the wet areas and laminate wood floors in all of the large upstairs bedrooms.All bathrooms have new toilets and beautifully renovated shower areas.Enjoy the wood burning fireplace in the living room as well as the views to the huge yard.There is an electric wrought iron fence that leads to the oversized 2 car detached garage,plenty of storage.You'll love this home!",updated
60,"$349,900","2515 NW County Road 1110, Corsicana, TX 75110",https://www.zillow.com/homedetails/2515-NW-County-Road-1110-Corsicana-TX-75110/250499892_zpid/,3, House,2,"1,488",Sherry Frye,,Premier Realty,"Delightful home, with acreage and a short drive from town! This property sits on 7.5 (+-) acres in a quiet, desirable area! Adorable updates through the home, with a split floor plan. The master includes a walk-in closet with built-in cabinets and a master bath to enjoy after a long day. The kitchen is complete with granite countertops, a farmhouse sink, eye-pleasing appliances, lovely backsplash, and breathtaking cabinetry! Entertainers will take advantage of the large fenced backyard to host gatherings with family and friends. Don't let this one pass by!",updated
61,"$319,000","7409 Shadow Hill Dr APT 113, Austin, TX 78731",https://www.zillow.com/homedetails/7409-Shadow-Hill-Dr-APT-113-Austin-TX-78731/2067360020_zpid/,2,"<abbr class=""list",2,968,Chase Cangelosi,,All City Real Estate Ltd. Co,"***OFFER DEADLINE: Monday 1/24 @ 6pm***    Location is everything! This townhouse-style condo with no neighbors above or below you flaunts easy access to Mopac and Far West Blvd. With the Domain under 3 miles away, downtown under 8 miles away, and all the convenience of Far West Blvd (HEB, CVS, Library, Wendy's, etc) at your fingertips, this condo's location is perfect.     The unit features 2 bedrooms, both upstairs, large living room with half-bathroom, updated kitchen, and laundry in-unit.     The pool is right outside the unit for easy access in the Texas heat!     For the low monthly HOA fee, it covers nearly everything: internet, cable, water, plumbing, pool, lawn, covered parking, guest parking, and the unit's patio fence.",updated
62,"$324,900","305 Black Hills Ct, Cibolo, TX 78108",https://www.zillow.com/homedetails/305-Black-Hills-Ct-Cibolo-TX-78108/84060174_zpid/,4, House,3,"2,518",Karl Meyers,210-651-9300,Simmonds Real Estate Inc.,"**MULTIPLE OFFERS**BEST AND FINAL DUE NLT 6 PM SUNDAY 23 JANUARY. Very nice 4 bedroom and 2.5 bath home in Cibolo's desirable Buffalo Crossing neighborhood w/great backyard w/long open views--partial greenbelt/cul-de-sac, huge side lot gives a much larger lot feel!! Superb location for shopping & great schools (New Cibolo HEB coming in 2022). Updated ""wood looking"" ceramic tile flooring downstairs. Vaulted-ceiling family room w/lots of windows & bright light, along w/a nice wood burning corner fireplace. Primary bedroom downstairs w/large bay window/sitting area; bath has sep. shower/garden tub, double vanity & walk in closet. Lots of kitchen cabinet space - solid surface counters, double built-in ovens, flat cook top, dishwasher, microwave & negotiable high-end fridge. Nicely sized secondary bedrooms upstairs, the largest of which has 2 closets. It also boasts a 15x13 game room, plus an extra study/office area for the kids school work. Two other inside storage rooms for your extra stuff! Covered back patio.  Home has water softener & full yard sprinkler system.",updated
63,"$430,000","452 E Fair Harbor Ln, Houston, TX 77079",https://www.zillow.com/homedetails/452-E-Fair-Harbor-Ln-Houston-TX-77079/28191756_zpid/,4, House,3,"2,548",Nicki DeMary,832-985-9896,C.R.Realty,"Unique Mediterranean/Spanish style home in the Houston Energy Corridor. 95% of the home has been updated in the last 3-4 years. Tile roof, all interior plumbing, travertine floors, kitchen and all restrooms were updated 2017.  Interior and exterior paint were updated in 2021. Exterior landscaping updated in 2019. Kitchen/Dinning/Living area are open to each other with high ceilings and floor to ceiling Pella windows. All bathroom have high end cabinetry/faucets. Master bath has Restoration Hardware cabinets with Jacuzzi jetted tub. Front and rear door were updated with custom wrought iron with window opening capabilities. Kitchen has stainless steel Kitchen Aid appliances custom granite and Kohler faucet. Rheem tankless water heater was replace in 2021 with Whirlpool water softener. Location is convenient to 1-10, Beltway 8, Hershey Park, City Centre and Memorial City shopping centers and located in Katy ISD with nearby private schools.",updated
64,"$289,900","14742 Fir Knoll Way, Cypress, TX 77429",https://www.zillow.com/homedetails/14742-Fir-Knoll-Way-Cypress-TX-77429/112081405_zpid/,4, House,3,"2,390",Suzanne Mason,810-300-6501,BHGRE Gary Greene,"WELCOME HOME TO The Villages of Cypress Lakes where community is squarely at the center of this entire area!  This home boasts approximately 2,390 square feet of inside living including 4 bedrooms, two and one half baths and a generous two car garage with extra work space!  This move-in ready beauty has a recently updated kitchen with an eat in breakfast area as well as a breakfast bar for additional seating.  Primary bedroom with ensuite down and three large secondary bedrooms on the second level.  Laundry is on the second floor too! Meticulously maintained and zoned to highly acclaimed schools within CFISD.  Close to Hwy 290, Grand Parkway, Houston Premium Outlet Mall, Memorial Hermann & HCA hospitals as well as many shops and restaurants! Call today for your private tour!",updated
65,"$379,000","5223 Mystic Trl, Dallas, TX 75241",https://www.zillow.com/homedetails/5223-Mystic-Trl-Dallas-TX-75241/26776734_zpid/,4, House,2,"2,312",Kelly Foster,,Elite Agents,"Talk About - New Year New Me!! This Super Spacious Home in the Established Quiet Glenview Neighborhood - Home to the 2021 State Football Championship South Oak Cliff Bears - has been Completely Renovated from Top to Bottom and is Ready for You to Call it Home! New Roof, New Driveway, New Open Concept Kitchen & Great Room are Perfect for Entertaining, RING Home Video Surveillance System...Updates are Endless! This Home is An Absolute Must See!",updated
66,"$150,000","2313 E Yandell Dr, El Paso, TX 79903",https://www.zillow.com/homedetails/2313-E-Yandell-Dr-El-Paso-TX-79903/27396443_zpid/,2, House,1,"1,128",Jesus Acevedo,915-449-3816,Thrive Realty,"Enjoy a glass of wine or a warm cup of coffee on the porch of this charming, centrally located home surrounded by quiet streets and prompt access to I-10 East/West & Montana Street. Near entertainment area and top-notch Mexican food restaurants. All-new updates include: flooring, windows, kitchen cabinets, lighting fixtures, updated bathroom and freshly painted walls within. Well-maintained wrought iron fence surrounds this low-maintenance landscaped yard. Ramp access to porch; alley access for additional parking. Central cooling and heating. Two spacious bedrooms and a built in desk.",updated
67,"$213,500","1522 Butterfield Dr, Mesquite, TX 75150",https://www.zillow.com/homedetails/1522-Butterfield-Dr-Mesquite-TX-75150/27156005_zpid/,3, Multifamily home,2,"1,252",Jamie Brannagan,,"Compass Re Texas, Llc","Unique opportunity to purchase this cozy home, conveniently located near plenty of dining and shopping options and major highways just around the corner. NO HOA! Kitchen has been recently updated with new cabinets, counter top, sink, faucet, disposal, oven, dishwasher, refrigerator and all have been rarely used and well taken care of. Bathroom vanities and counter tops have been updated, as well as lighting throughout the home. Major improvements include new AC, new roof, 14 in insulation in attic, recently replaced fence, freshly painted front exterior, gutters and downspouts. Includes new, barely used washer and dryer. Wood burning fireplace makes home warm and inviting. Completely move in ready!",updated
68,"$379,900","14301 Highway 16 S, Comanche, TX 76442",https://www.zillow.com/homedetails/14301-Highway-16-S-Comanche-TX-76442/2066710865_zpid/,3, House,2,"1,998",Kerry Kersh,,Kersh Real Estate,"Gorgeous home place on 4 acres!  This property is magazine worthy and one of a kind.  It has all the modern updates keeping all the old character and charm.  You won't find another one like this!  Right outside of town surrounded by beautiful trees this home features 3 bedrooms, 2 baths, with an additional office laundry combo.  The front and side deck will bring you amazing views.  Metal roof, wood floors, original doors and transoms, 11 foot ceilings, open for entertaining and a must see!  This property won't last so bring your buyers.",updated
69,"$550,000","1411 E Seneca Ct, Granbury, TX 76048",https://www.zillow.com/homedetails/1411-E-Seneca-Ct-Granbury-TX-76048/80304583_zpid/,4, House,3,"2,706",Todd Tramonte,,Market Experts Realty,"Secluded waterfront getaway sitting on a large lot backing to a canal on Lake Granbury! The expansive back yard features a boat dock and lift that comes with a covered deck above it. The home's open living and dining area gives you great views of the water through a pair of bay windows and an awesome space for hosting friends and family. A huge stone fireplace gives the space rustic character. Kitchen has been updated with sleek quartz countertops. The home features a pair of master suites. Off the back of the house, a second-story deck gives you another vantage point of the water, plus a ground-level covered patio below. Sprinkler system from the lake for helps keep the one-acre lot in great shape.",updated
70,"$389,900","8825 Skyline Dr, Joshua, TX 76058",https://www.zillow.com/homedetails/8825-Skyline-Dr-Joshua-TX-76058/28644237_zpid/,3, House,2,"2,240",Tara Roden,,"Coldwell Banker Apex, Realtors",Looking for a great home on acreage ? This is the one for you. Really nice 2 story 3-2 home on 6 acres !! This home has lots of wonderful  features including updated flooring and spacious master bath .  Large kitchen and dining area .  Bring your horses or livestock and enjoy the beautiful acreage .   Call today to  schedule an appointment to see this great home .,updated
71,"$460,000","1639 Rockin Dr, Houston, TX 77077",https://www.zillow.com/homedetails/1639-Rockin-Dr-Houston-TX-77077/28315396_zpid/,4, House,3,"2,397",Paul Holub,713-817-2958,Keller Williams Realty - Memor,"Beautifully updated home on one of the best lots in the Energy Corridor! Fully updated kitchen with quartz countertops, new soft-close cabinets, stainless steel appliances & wonderful views of the amazing yard and patio! NEVER FLOODED! Modern epoxy floors throughout the downstairs! Spacious living room with wood-burning fireplace & updated wet-bar with no-touch faucet.  Inviting master bedroom with custom barndoors leading to the most amazing bathroom! Modern vanity with chrome hardware and light fixtures, elegant freestanding bathtub, spacious standup shower & generously sized closet with a new closet container system! You have to see this! Three bedrooms upstairs with an updated hall bathroom. 15 USB outlets, double paned windows & fresh paint throughout! 1/4 acre lot with a backyard large enough for a full sized volleyball court! Spacious patio for a full dining & sitting area! Quiet street with only one next door neighbor! Minutes from the Village School!",updated
72,"$320,000","10716 Ambling Trl, Fort Worth, TX 76108",https://www.zillow.com/homedetails/10716-Ambling-Trl-Fort-Worth-TX-76108/70572626_zpid/,3, House,2,"2,009",Pamela Caywood,,Indwell,"This home is located in the highly desireable Vista West community. A beautiful updated home kept in pristine condition.  One story, open concept home with 3 bedrooms, 2 baths, 2 car garage. Large living room with gas fireplace. Eat-in kitchen with island and stainless appliances. Kitchen recently updated. Large formal dining room.   Owner's bedroom has an ensuite bath with shower, double sinks, walk-in closet. Flex room between the owner's suite and the other 2 bedrooms that can be used for media room, game room, office or kid's play room. Hardwood floors.  Neighborhood includes community pool, playground, sidewalks.  Great location central to shopping, restaurants, etc.  Easy commute to downtown.",updated
73,"$3,399,000","10911 Kirwick Dr, Houston, TX 77024",https://www.zillow.com/homedetails/10911-Kirwick-Dr-Houston-TX-77024/28051408_zpid/,5, House,7,"9,261",Kellie Geitner,713-213-2011,Martha Turner Sotheby's,"Sleek | Sophisticated | Elegant | This Modern-Contemporary has been extensively remodeled—including plumbing and wiring—and displays lustrous detail within every room. First floor complete with sparkling white terrazzo, professional grade appliances, custom soft close cabinetry and quartz countertops, as well as designer hardware and finishes. Massive floor to ceiling windows within the first floor Grand Room provides impeccable views to the back and front of the rejuvenated estate grounds and waterfront, which includes decking, retaining and decking. Entire second floor updated with new flooring and paint and an extensive update of the primary bathrooms with new quartz vanities and hardware. Home addition of a potential guest suite/quarters or game room has separate exterior entrance. Professionally designed outdoor lighting accentuates the clean lines geometric features of the home at night. Come take a tour of this one of kind home today !",updated
74,"$289,990","6318 Balky St, San Antonio, TX 78240",https://www.zillow.com/homedetails/6318-Balky-St-San-Antonio-TX-78240/26159364_zpid/,3, House,2,"1,633",Christopher Marti,830-660-1004,"Rebate Haus, LLC","Beautifully updated home close to everything! Updates include all new flooring, paint, bathroom and kitchen fixtures. Large open floor plan living/kitchen/dining area perfect for entertaining. Cary the gathering outside onto the covered patio and beautifully shaded backyard. With three bedrooms and two bathrooms, this is the ideal floor plan. Both secondary bedrooms are a great size but one room is almost the size of two bedrooms and would be perfect as a combo bedroom/playroom. The owners retreat has also been updated with newly stained beams and an updated bathroom with a gorgeous tiled walk-in shower and updated vanity. New light fixtures complete the spaces and welcome you into your new home! Schedule a private tour today because this home won't last long!",updated
75,"$297,500","434 S Vine Ave, Tyler, TX 75702",https://www.zillow.com/homedetails/434-S-Vine-Ave-Tyler-TX-75702/299184958_zpid/,3, House,3,"2,128",Jason Echols,,Echols Real Estate Assoc. Llc,"This immaculate Tudor style home located in the Azalea District has old world charm and striking curb appeal.  This home has been completely remodeled and would make a great home or office.  Updates and amenities include a modern kitchen with granite and stainless appliances, formal dining, updated bathrooms, utility, hardwood floors, arched doors and entries, zoned HVAC, tankless HW, new windows, new paint inside and out with covered parking and a large storage building in back.  Roof replaced in 2016.  Zoned for commercial or residential(AR per City of Tyler).",updated
76,"$650,000","9705 Castle Pines Dr, Austin, TX 78717",https://www.zillow.com/homedetails/9705-Castle-Pines-Dr-Austin-TX-78717/88021526_zpid/,4,"<abbr class=""list",2,"2,281",Daniel Wilson,,Keller Williams Realty,"Immaculate single story home in the Red Hot Avery Ranch Community! Beautifully updated with barn wood ceramic tile flooring in all rooms, custom interior paint throughout, stainless steel subway tile kitchen back splash & more! Private backyard oasis featuring an        in-ground salt water pool w/ water feature & custom LED lights. Open concept living w/ high ceilings & kitchen looking out to the family room. Ideal layout w/ primary bedrooms separate from secondary rooms & a second full bathroom. Fourth bedroom with French doors can be used as an office.  Fantastic location zoned to exemplary RRISD schools, close to numerous parks, easy access to major highways/tolls & close to shopping & restaurants. A must see!  Additional Features: Formal dining room off front entry can be used as a  second living area, Fireplace w/ stone surround & mantle  Granite counters, center island, breakfast bar & breakfast area in kitchen, Community Amenities: Amenities center w/ pavilion & 3 main pools. 4 additional pools throughout Avery Ranch, several parks, 5 tennis courts, 2 basketball court, Golf club & more",updated
77,"$675,000","411 Lakeside Estates Dr, Houston, TX 77042",https://www.zillow.com/homedetails/411-Lakeside-Estates-Dr-Houston-TX-77042/28148728_zpid/,5, House,3,"3,791",Wayo Dorsey,713-501-7151,Martha Turner Sotheby's,"You absolutely must see this chic, beautiful, completely updated 5 bed 3 full bath colonial home in Lakeside Forest, where tradition meets modern living. Bathed in natural light, this spacious home will be your oasis from daily life. Featuring an absolute chef's dream kitchen, complete with borderline-excessively amazing custom soft-close cabinetry, with in-cabinet organizers, under-cabinet lighting and Wolf gas range in peninsula. You have to see the cabinets! Kitchen opens up into the generously apportioned living space with vaulted ceiling and solarium. The master is down, and features a large closet, secondary ""safe-room"" style closet with 3/4 inch plywood, and an absolutely dreamy master bath with separate shower and tub, all surrounded by stone. Downstairs also has a secondary bedroom with full bathroom en suite. Other features include, complete and insulated bonus room off garage, tankless water heater, replaced drainage system, formal dining and living and large cedar closet.",updated
78,"$264,900","808 Brown Trl, Bedford, TX 76022",https://www.zillow.com/homedetails/808-Brown-Trl-Bedford-TX-76022/28929753_zpid/,3, House,2,"1,282",Jack Mclemore,,"Listing Results, Llc","This gorgeous home is newly renovated with all the bells and whistles. The 3 bed 2 bath home has a great floor plan. Updated on November 2021 with AC, Electrical Panel, Water Heater, Fresh paint, Laminate, carpet, All New Doors & Windows are just a few reasons not to miss this one. The restrooms & kitchen are built from scratch with granite countertops, cabinets, tiles, backsplash, new faucets & light fixtures. All matching Samsung SS Appliances in kitchen with Range Hood. The price is right. Won't last.",updated
79,"$435,000","1416 Tuffit Ln, Austin, TX 78753",https://www.zillow.com/homedetails/1416-Tuffit-Ln-Austin-TX-78753/29434723_zpid/,3,"<abbr class=""list",2,"1,200",Mando DeLaCerda,,Realty Texas LLC,"Beautiful, fully remodeled home! Nicely designed with modern updates throughout, great floor plan with a separate master suite, lots of natural light and great flow. New white shaker style cabinets with ample storage space as well as chic open shelves. All new Samsung appliance, gas oven is also an air fryer! Large granite peninsula is great for entertaining. Walk into the fully converted garage space that has been transformed into a spacious master bedroom and a good size closet. Not to mention the gorgeous master bath with an oversized round mirror and a stunning pendant light. A large spacious yard with lots of potential. Near Dell, Samsung, Apple and Tesla campus.    House is turn key move-in ready!    Renovations include newly installed HVAC system, granite counter tops, interior lighting thought out the house, bathrooms, all flooring, most windows, all interior and exterior doors, all cabinets, all plumbing fixtures, water heater.",updated
80,"$235,000","4403 Peppermint Hill Ln, Richmond, TX 77469",https://www.zillow.com/homedetails/4403-Peppermint-Hill-Ln-Richmond-TX-77469/84753180_zpid/,4, House,2,"1,834",Wendi Fancher,832-578-6822,REALM Real Estate Professional,"Beautiful, updated 4 bed & 2 bath home: New Puron A/C 2021, new carpet & new paint!! Open floor plan, spacious kitchen & dining area. Kitchen opens to family room with vaulted ceiling. Primary bedroom with en-suite bath includes separate shower/tub & large walk-in closet. Updated light fixtures & ceiling fans throughout. Spacious laundry room. 2-car garage attached. Large fenced backyard with covered patio. A MUST SEE! This home won't last!",updated
81,"$115,000","317 E Wright Ave, Pharr, TX 78577",https://www.zillow.com/homedetails/317-E-Wright-Ave-Pharr-TX-78577/52749570_zpid/,3, House,2,"1,686",Maggie Harris,956-821-9990,Keller Williams Realty Rgv,"Charming home in the heart of Pharr TX.  This lovely home sits on 3 lots and features 3 bedrooms, 2 baths , covered carport and shed in back. Roof was replaced 2 years ago and house just needs a little updating. The location is great between Business 83 & expressway.",updated
82,"$170,000","4600 Ocean Dr APT 307, Corpus Christi, TX 78412",https://www.zillow.com/homedetails/4600-Ocean-Dr-APT-307-Corpus-Christi-TX-78412/2066707680_zpid/,2, Condo,2,"1,219",Sally Bales,361-442-5305,"Safe Harbor Real Estate, LLC","Live on the prestigious Ocean Drive hugging our sparkling Corpus Christi Bay. Enjoy the pool, take a walk or bike ride along the bay. The condo building even has it's own pier! The building welcomes you into an expansive foyer with plenty of room to work, meet guests and even has a party room for you to use. The unit itself is almost like having two condos! There are two huge bedrooms, three balconies, a spacious laundry room with full-sized washer & dryer, loads of storage, an updated kitchen with breakfast bar, two private bathrooms all located in a desirable corner unit. There have been thoughtful updates throughout the unit, including luxurious CORK flooring; it's gorgeous. And I especially love the bonus sunroom perfect for plants or additional living space. You must see this low-maintenance, condo that is turn-key ready for it's new owner.",updated
