,prices,address,links,bed,type,baths,sq_feet,Listing Agent Name,Listing Agent Contact,Listing Agent Company,Description,Key Word
0,"$365,900","7026 Lanyon Dr, Dallas, TX 75227",https://www.zillow.com/homedetails/7026-Lanyon-Dr-Dallas-TX-75227/26905033_zpid/,4, House,3,"2,185",Michelle Carr,,Berkshire Hathawayhs Penfed Tx,"Do not miss your chance to own this freshly updated 4 bedroom, 2.5 bathroom brick home in Everglade Park with charming curb appeal. Through the front door, you are welcomed into an open living space that leads you to a second living room with a cozy fireplace and views of the backyard. The newly remodeled kitchen features a gas range, a large pantry, and modern flooring. Head up the stairs to the primary bedroom that offers a large ensuite with dual sinks, soaking tub, separate shower, and a Texas-sized walk in closet. The private backyard has a mature tree giving the yard the perfect balance of sun and shade. Great location near schools, shopping, and Interstate 30 for commuting to downtown Dallas.",updated
1,"$234,900","4402 Palestine Cove Ln, Humble, TX 77396",https://www.zillow.com/homedetails/4402-Palestine-Cove-Ln-Humble-TX-77396/112162256_zpid/,3, House,2,"2,098",MARK Dimas,,Mark Dimas Properties,"Charming 3 bedroom, 2 bathroom, single-story home featuring a 2-car attached garage! Inside, you'll finds an open floor plan that features updated carpet, a dining area, spacious living room, and a kitchen with granite countertops, tile backsplash, and a breakfast bar. The primary bedrooms is separate from the secondary bedrooms and includes an en-suite bathroom with a walk-in closet. There's a utility room, 2 secondary bedrooms, and a 2nd full bathroom that make up the rest of the home while the fenced-in backyard offers a patio and plenty of green space. This home is minutes away from Beltway 8 with easy access to I-69/Eastex Fwy! *Refrigerator present in the home will be at no charge; no guarantee of condition, functionality &/or warranty by Seller",updated
2,"$328,900","1152 Prospect Dr, Flower Mound, TX 75028",https://www.zillow.com/homedetails/1152-Prospect-Dr-Flower-Mound-TX-75028/27268651_zpid/,3, House,2,"1,455",Michelle Carr,,Berkshire Hathawayhs Penfed Tx,"Come and check out this uniquely charming 3 bedroom, 2 bathroom home on a huge corner lot surrounded by mature shade trees. This home features sleek, easy-to-clean concrete floors throughout, a wood-look accent wall providing an open flow with separation, soaring ceilings with a skylight. The large eat-in kitchen boasts stainless steel appliances, vaulted ceilings, and open sightlines to the formal dining or transitional space. The primary bedroom features an en suite bathroom with a beautifully updated shower. Unwind outside in your large fenced backyard on one of two patios.  Lots of potential in the backyard. This home offers convenient access to recreational amenities, schools, dining, shopping, and I-35E.",updated
3,"$409,900","4217 Wild Cherry Dr, Carrollton, TX 75010",https://www.zillow.com/homedetails/4217-Wild-Cherry-Dr-Carrollton-TX-75010/27276362_zpid/,3, House,3,"2,493",Donna Bradshaw,,Re/max Dfw Associates,"Updated EAST facing 2 story beauty in Oak Hills! Wide open floor plan with natural light. Huge updated kitchen with granite,ss appliances + eat in island open to family room. Formal dining at entry adjacent to spacious flex space perfect for home office! All bedrooms plus game room upstairs. Master suite with updated bath & private balcony to enjoy gorgeous sunsets! Large secondary bedrooms with good storage.  Recent updates: kitchen,master bath, interior paint,carpet & tile flooring,HVAC,roof,window glass entire home,hot water heater,Nest thermostats.  Great parking! 2018 carport added for more covered parking! Great access to 121,DNT,Grandscape, Legacy West & much more. This home is a must see!  Will go fast.",updated
4,"$475,000","132 Carrington Dr, Fate, TX 75032",https://www.zillow.com/homedetails/132-Carrington-Dr-Fate-TX-75032/55674499_zpid/,4, House,2,"2,701",Maribel Calzado,,Berkshire Hathawayhs Penfed Tx,"One of a kind home! This beautifully maintained 1-story 4 bedroom 2 bath home with a 2 car garage features updates to most interior & exterior finishes. The main living area is anchored by a fireplace & is centrally located within the home. The secondary living space offers a dry bar & built-in bench, perfect for entertaining. The kitchen boasts granite countertops, SS appliances & plenty of storage. The spacious master bedroom is split from the secondary bedrooms & offers an on-suite complete with dual sinks, shower-tub, & large WIC. The 1-acre lot has a large outbuilding with a half bath & AC+heat, as well as an outdoor living area & kitchen. This highly sought after acreage neighborhood has NO HOA!",updated
5,"$485,000","13142 Hunters Valley St, San Antonio, TX 78230",https://www.zillow.com/homedetails/13142-Hunters-Valley-St-San-Antonio-TX-78230/26398083_zpid/,3, House,3,"2,423",Madi Ybanez Rico,210-367-8910,Homebuying Homeselling Realty  LLC,"LOCATION LOCATION! nestled on .26 acre lot in the much desired community of HUNTERS CREEK.  The house boasts living and dining areas that are enhanced with gorgeous hardwood flooring & Saltillo tile though out. This great home features a spacious family room with a dual fireplace(shared with the master bedroom), a wet bar, high ceiling and lots of natural light. The split floor plan incorporates a luxurious owner's suite with a personal refrigerator, his & her closets, access to the backyard through new double doors. The master bath has a separate shower/jacuzzi. The kitchen has granite counter tops, triple sink, island and breakfast nook with new windows. This spectacular back yard has heated pool, hot tub, gazebo, and grilling area. Perfect for entertaining and relaxing all year around, beautifully landscaped with mature trees. Lots of updates ask agent for list.",updated
6,"$275,000","11210 Crooked Pine Dr, Cypress, TX 77429",https://www.zillow.com/homedetails/11210-Crooked-Pine-Dr-Cypress-TX-77429/28373735_zpid/,4, House,3,"2,444",Will Puente,888-909-9914,"SavvyWay Realty, Inc.","Large 4 bedroom, 2.5 bathrooms home with a game room upstairs has too many upgrades to list here! Ceiling fans in every room. Newer roof, exterior paint, water heater, HVAC components, and whole house re-piped with PEX plumbing! Completely gutted and updated open concept kitchen with huge granite island, large walk in pantry, and stainless steel appliances. Gas fireplace and vaulted ceiling in living room.  Downstairs master bedroom suite has 2 walk in closets, separate shower, and jetted bathtub. Tons of storage available in the backyard with 3 storage sheds but still plenty of room to entertain on the large outdoor deck and covered patio. Don't wait! Call your agent for a private showing today!",updated
7,"$599,998","685 County Road 3371, Kempner, TX 76539",https://www.zillow.com/homedetails/685-County-Road-3371-Kempner-TX-76539/87404272_zpid/,4, House,2,"2,429",Jodie Nobles,254-278-8368,The NOBLE Group,"This One is INCREDIBLE!! Stunning 4 Bedroom, 2 Bath Home with Swimming Pool and Man Cave in the Highly Desired Chica Ranch of Kempner! 1.36 acres Boasts Covered RV parking, Carport Addition, Pavilion, Glorious Live Oak Trees, Extended patio with Tile, Gourmet kitchen with New Refrigerator and Dishwasher, Farm Sink, Custom Knotty Alder Cabinets, Gutters, Split Rail Cedar Fencing and Dog Run! Updated Light Fixtures, Fresh Exterior AND Interior Paint, All New; Pool Decking, Filter, Liner, Grill Gazebo, Gutters and Epoxy Garage Floor! All Rooms are Smart Ready, has Nest Theromast, Wireless Rainbird with Bluetooth, Rain Sensor, Front and Back Extended Sprinkler System! Outside City Limits for Country Living with Low Taxes in a One Street Neighborhood. Lampasas ISD. You Could Not Ask For More! This One is an Absolute MUST SEE! Contact Us Now!",updated
8,"$310,000","11153 Cedar Park, San Antonio, TX 78249",https://www.zillow.com/homedetails/11153-Cedar-Park-San-Antonio-TX-78249/26470108_zpid/,4, House,3,"2,682",Derrell Skillman,210-789-2608,Redfin Corporation,"Beautifully Updated 4 Bedroom Home In Parkwood! This home is ready for new owners,  and features hand scraped hardwood floors, granite countertops, updated bath fixtures, new HVAC system (2021),  new flooring and tile,  and new roof (2018) with 50-year composition shingles. Spacious open floor plan, with a living dining combo, fireplace, light and bright island kitchen with tile backsplash, lots of cabinetry for storage, breakfast bar and pantry. All bedrooms are upstairs, large fourth bedroom can be used as home office. The backyard is ready for entertaining or relaxing on the gorgeous flagstone covered patio with a view of a private 15 acre ranch and green space- no back neighbors! Yards are fully landscaped, with mature trees and playset.  Many HOA amenities, including a swimming pool, club house, playground, tennis courts and more! The neighborhood  has easy access to the extensive Leon Creek Greenway, with miles of bike and jogging trails. Close to USAA, Valero, Medical Center, UTSA, with easy access to restaurants, shopping, schools, and major employers. Book your showing today!",updated
9,"$245,000","18751 Candle Park Dr, Spring, TX 77388",https://www.zillow.com/homedetails/18751-Candle-Park-Dr-Spring-TX-77388/52416867_zpid/,3, House,2,"2,022",Julie Shalloup,281-731-3953,"CB&A, Realtors","Meticulously maintained and Move-in ready!  Located in the gated neighborhood of Candlelight Park Estates, this Open Concept home features 3 Bedrooms, 2 Full baths, Family room with Gas log Fireplace, Formal Dining room, and Breakfast room.  Large windows provide tons of natural light.  Generously sized Master retreat includes His & Her closets, updated en suite with oversized walk-in shower, large vanity with His & Her sinks, and jetted tub.  Enjoy relaxing evenings on the covered patio which includes ceiling fan, skylight, and brick paver extension. Vinyl plank flooring & carpet replaced 2020. HVAC System replaced 2021. Gutters with upgraded Leaf Guard feature.   Custom landscaped yard includes water feature, sprinkler system, and French drains. Great location- close to highways for commuters, shopping, and restaurants. Low Taxes, No flooding, No MUD tax.  No sign in the yard",updated
10,"$110,000","5210 E Highway 180, Snyder, TX 79549",https://www.zillow.com/homedetails/5210-E-Highway-180-Snyder-TX-79549/2070595981_zpid/,4, House,2,"2,296",Sherry DeLoera,325-574-5250,"DeLoera Realty, LLC","Recent Price adjustment ! Big country home outside of the city limits.  This gem has 4 bedrooms and 2 baths and has some nice updates to include a metal roof, extra insulation on outer walls ad ceiling, windows were replaced, one of the bathrooms remodeled and has heated floors ! Seller put new carpeting in one of the bedrooms and updates to the kitchen. All appliances will stay!   There are some repairs that still need completed and it is priced accordingly.",updated
11,"$329,900","12931 Harrisburg Cir, Farmers Branch, TX 75234",https://www.zillow.com/homedetails/12931-Harrisburg-Cir-Farmers-Branch-TX-75234/26996271_zpid/,3, House,2,"1,589",Aaron Jistel,,Listing Spark,"Don't miss out on this newly remodeled 3 Bed and 2 bath home with open floor plan, large family room. Kitchen is open to living room, with all new appliances, microwave, dishwasher. Updates include paint, flooring, plumbing fixtures, light fixtures, and fresh cosmetic updates. The kitchen has infinity large windows which get sunlight and sky. The home has a covered Backyard patio for a family sit-out.",updated
12,"$415,000","2238 Rippling Rill St, San Antonio, TX 78232",https://www.zillow.com/homedetails/2238-Rippling-Rill-St-San-Antonio-TX-78232/26379024_zpid/,4, House,3,"3,320",Jim Seifert,210-289-2015,Redfin Corporation,"Beautiful 4 Bedroom 2.5 Bath, traditional two-story nestled beneath mature trees in San Pedro Hills! Beautifully updated and sure to impress, this home features new flooring throughout, built-in shelving and storage throughout, a gourmet kitchen with crisp white cabinets, granite countertops and new Stainless steel appliances. a First-floor Primary bedroom with a spacious updated en-suite bathroom, and dual walk-in closets! Entertain with ease with this open and bright floorplan featuring a formal dining room, enclosed sunroom perfect for a playroom, office space or workout space which leads to the massive deck overlooking the spacious backyard. Close proximity to HEB, Blossom Athletic Park, shopping, dining, San Antonio Airport and so much more! Hurry before this unique opportunity is gone.",updated
13,"$469,000","7915 Capri Cir, Houston, TX 77095",https://www.zillow.com/homedetails/7915-Capri-Cir-Houston-TX-77095/28483729_zpid/,5, House,4,"4,264",Samuel Carratala,281-781-6969,"eXp Realty, LLC","Unmatched Luxury Home in Hearthstone. Bring your clients to this home and it will be your last stop. Located on the highly acclaimed Hearthstone Golf Course! Take optimal advantage of the huge patio & outdoor kitchen located on the prestigious 2nd hole. Not to be outdone, the interior of this 5 bedroom, 4 bath home has been updated with high-end finishes throughout. If you are looking for a forever dream home, look no further--this one truly is a MUST SEE! Home did not flood during Harvey or Tax Day!  Close to parks, club-house, pool. Quick access to Hwy. 6, Hwy. 290 529 and & beltway.",updated
14,"$425,000","1004 N Gray St, Caldwell, TX 77836",https://www.zillow.com/homedetails/1004-N-Gray-St-Caldwell-TX-77836/87194221_zpid/,4, House,3,"2,426",Melinda Scott,979-574-9228,Home & Ranch Real Estate,"Small town living at its best!  This 4 bedroom, 2.5 bath home is located in the popular Copperas Hollow Country Club area in Caldwell.  INSIDE:  Updates include planked tile floors in all common areas, fresh paint, granite countertops in the kitchen and baths with complimentary tile in showers and backsplashes, fixtures and hardware and newly installed camera/monitoring system.  OUTSIDE:  The beds are newly mulched, back yard sod is scheduled for install, wrought iron back yard fencing allows for open views of the wooded fence lines and creek beds, and the newly installed low-maintenance TREX board deck is a bonus to outdoor living. BONUS:  The golf course, clubhouse and pool are just around the corner and easy to enjoy - memberships available but not required.  Established neighborhood, mature trees and landscaping, quiet streets for walking, and no HOA dues - this is THE LIFE!",updated
15,"$397,117","268 Fawn Rdg, Cibolo, TX 78108",https://www.zillow.com/homedetails/268-Fawn-Rdg-Cibolo-TX-78108/49553559_zpid/,4, House,3,"2,137",Carol Woodward,210-823-0403,Keller Williams Boerne,"Entertainers Delight! 4 Bedrooms with 2 1/2 bath. Great outdoor Covered patio with Keith Zars Pool and Mosquito System. Enjoy waterfall feature and relax by the pool. Recently updated master bath and Roof replaced in Aug 2019. Granite in Kitchen with spacious Island and eat in breakfast area. Open Living room that overlooks pool with a fireplace. Many possibilities with additional Formal living and formal dining combo area. Walking distance to elementary school. Location in Cibolo off IH 35.    Simply Safe Security System, TV's, Brackets, fireplace Screen and Tools do not convey!",updated
16,"$249,900","10215 Catlett Ln, La Porte, TX 77571",https://www.zillow.com/homedetails/10215-Catlett-Ln-La-Porte-TX-77571/28033873_zpid/,4, House,2,"1,817",Jordan Bloodworth,713-909-9061,J.L. Wyatt Properties,"Beautifully updated 4/2 home on a large lot! Interior features include an open concept living with LVP flooring, tile, backsplash, paint and new carpet. This home has a big backyard great for entertaining or letting the kids run and explore. The primary bedroom has a large walk-in closet and private bathroom with standing shower and double sinks. Schedule your showing and make it yours today!",updated
17,"$247,500","679 Peterson Rd N, Iowa Park, TX 76367",https://www.zillow.com/homedetails/679-Peterson-Rd-N-Iowa-Park-TX-76367/206704129_zpid/,3, House,1,"1,623",Tyler Methvin,,Domain Real Est Services Inc,"Hunting for an updated home with a few acres in Iowa Park? This home has been completely remodeled with great taste, keeping the 1930’s feel with a classy, modern touch. The home features original hardwoods throughout the downstairs, new honed quartz countertops in the kitchen and laundry room, new stainless steel appliances, updated bathroom, new energy efficient windows, new siding and fresh paint throughout. There is a garage and shed for yard equipment, a storm cellar and a loafing shed for livestock.",updated
18,"$249,900","204 Delwood Dr, Longview, TX 75605",https://www.zillow.com/homedetails/204-Delwood-Dr-Longview-TX-75605/50783929_zpid/,3, House,2,"2,654",Lori Keebaugh,903-736-0873,KEEBAUGH & COMPANY,"Lots of space inside and out of this centrally located home. Old world charm mixed with nice updates makes this, a home to see.  So many possibilities with all the spaces inside. Many rooms can be used for buyers preference but main rooms include 2 living areas, office, large dining space, mudroom leading to backyard, formal dining and more. The kitchen has been updated with painted cabinets and granite counter tops. Commercial grade range with oven plus a built in oven, built in ice maker and sink with 2 faucets finish off the kitchen nicely. Lots of natural light comes in from the front windows also. Kitchen is open to large living room with gas log fireplace and formal dining space with built ins. Nice size bedrooms wrap around the hallway with the primary bedroom (with mock fireplace) at the back of the house.  This room is huge! Tons of closet space in this area as well as an updated bathroom. This home sits on a large fenced lot with a covered deck area with lights for entertaining. Lots of parking in front for easy access to Delwood Dr.",updated
19,"$285,000","704 Parkview Dr, Burleson, TX 76028",https://www.zillow.com/homedetails/704-Parkview-Dr-Burleson-TX-76028/28633146_zpid/,3, House,2,"1,666",Rebecca Byrd,,League Real Estate,"Beautiful home that has been very well taken care of over the years. Living has a brick fireplace & wood mantel, French doors that lead to a sunroom. A gorgeous glass & iron transom in the living makes this home unique. Concrete counters, all new appliances in kitchen. Both bathrooms were remodeled to present a modern clean feel. New vanities, tile, fixtures, hardware, toilets, flooring, mirrors, recessed lighting etc. Recent paint interior & exterior. 3rd bedroom being used as a music room. 10-12 ft. pergola with ceiling fan for entertaining friends & family. Very private backyard. New garage door & opener, new front digital lock, 16 seer HVAC unit inside and out is new. Many more updates. See complete list.",updated
20,"$649,999","4016 Beechwood Ln, Dallas, TX 75220",https://www.zillow.com/homedetails/4016-Beechwood-Ln-Dallas-TX-75220/26788894_zpid/,3, House,2,"1,788",Mindy Hopkins,,Allie Beth Allman & Assoc.,"Beautifully updated in 2021, 3 bed 2 bath in the highly sought out Midway Hollow. Spacious open floor plan for entertaining, new fixtures, new LED lighting, SS appliances, gas top, New AC one year GAF materials warranty, New tankless water heater, 14 seer HVAC, Carrels quartz countertops, wonderful private master bedroom, separate shower, soaking tub, double sinks, fandalier, new carpet, two large walk in closets. Laundry conveniently located off master with second private back door. Third bedroom has built-ins and lots of windows that can be used alternately as an in home office. Backyard is large and open with a detached one car garage. 2021 new gutters and roof. Truly a must see move in ready.",updated
21,"$475,000","158 County Road 6245, Dayton, TX 77535",https://www.zillow.com/homedetails/158-County-Road-6245-Dayton-TX-77535/192599551_zpid/,4, House,4,"2,780",Deyanira Martinez,832-457-5074,HomeSmart,"One of a kind property well located near major roads! Selling all 5.36 acres! $ 2,000 credit to replace carpet. Property has large 2 story home, guest house/entertainment house, private salt water pool, chicken coop, dog washing station, vegetable garden, boat entrance, fire pit, walking trail in the back, driveway holds up to 10 cars!!!. Updates made recently! Schedule your showing today to see it yourself! Property located near soon to be completed Grand Parkway",updated
22,"$340,000","2014 Anvil Dr, Houston, TX 77090",https://www.zillow.com/homedetails/2014-Anvil-Dr-Houston-TX-77090/28167573_zpid/,4, House,3,"3,067",Feras Rachid,855-327-9361,"Opendoor Brokerage, LLC","This charming 4 bedroom, 2.5 bathroom home is now on the market! The impeccable kitchen has beautiful updated counters and stainless steel appliances. Discover a bright interior w/ neutral tile floors and plush carpet in all the right places. The main bedroom boasts a glass mirror closet. Other bedrooms offer plush carpet, ceiling fans, and sizable closets. Relax with your favorite drink in the fenced in backyard with an in-ground pool, and great potential for adding personal touches. Don't miss this incredible opportunity. Call today!    This home has been virtually staged to illustrate its potential.",updated
23,"$285,000","3100 Flamingo Ave, Mission, TX 78574",https://www.zillow.com/homedetails/3100-Flamingo-Ave-Mission-TX-78574/2117692716_zpid/,3, Foreclosure,3,"2,417",Tom Shepherd,956-457-9248,Berkshire Hathaway Homeservices Rgv Realty,"Sharyland, 1/3 Acre Lot, Updated Inside, Oversize Garage with Workshop Space and a Back Yard Paradise!!!  This 3 Bedroom/2.5 Bath is in Move-In Condition.  The Home Features Tile in ALL Common Areas and Wood in the Bedrooms--NO CARPET! The Kitchen has Granite Counters, an Island with Glass Cooktop, Built-In Oven and Microwave, Pantry and Breakfast Bar next to the Breakfast Area with Bay Window. The Formal Dining is Adjacent to the Kitchen.  The Oversize Family Room has a Vaulted Ceiling and a Bay Window with a Box Seat and Storage. The Master Suite has been Updated with a Raised Double-Sink Vanity, Soaker Tub, Spacious Shower and Private Toilet.  Bedrooms 2 & 3 share an Updated Hall Bath.  The Garage is a Handyman's Paradise with Storage and TWO workspaces. The Garage is close to a 4-Car Garage with all of the Space to work with. The Back Yard has a Covered Patio,  Detached BBQ Area and Hot Tub w/Extended Covered Patio. Boat/RV storage is allowed. Special Financing from Sirva Mortgage.",updated
24,"$140,000","2345 Briarwest Blvd, Houston, TX 77077",https://www.zillow.com/homedetails/2345-Briarwest-Blvd-Houston-TX-77077/28234984_zpid/,2, Condo,2,"1,092",Carlen Rosson,713-293-2186,"eXp Realty, LLC","This beautifully updated townhome in Autumn Chase is move in ready! It was completely remodeled in 2020 with new kitchen cabinets, quartz countertops, a modern tile backslash that includes a stainless steel refrigerator, stove, dishwasher, and microwave. The bathrooms boast new marble counters, sinks, mirrors, bathtub and tile. The flooring downstairs is has beautiful new bamboo floors and the upstairs bath and bedrooms are lined with new carpet. Newer washer and dryer included from 2020. New central/heat units were installed in December 2019.  Enjoy coffee on your private back patio.  Private 2-car carport located behind home. Autumn Chase is a quiet community with a large sparkling community pool, clubhouse and tennis courts!  SHOWINGS START Thursday, January 20th.",updated
25,"$194,500","7655 S Braeswood Blvd APT 30, Houston, TX 77071",https://www.zillow.com/homedetails/7655-S-Braeswood-Blvd-APT-30-Houston-TX-77071/28225212_zpid/,2, Townhouse,2,"1,792",Jackie Zehl,713-349-9700,Coldwell Banker Realty,"Stunning One Story Fee Simple Townhome* Located in an Established Close in Gated Community. Features include a Community Pool, Clubhouse & Beautifully Landscaped Grounds. Sophisticated & Stylishly Updated 1 Story Townhome Offers Marble Look Polished Porcelain Flooring, &  Fresh Interior Paint. Breathtaking, Open Floor Plan. The Free Flowing Kitchen, Living & Dining Areas are Perfect for Entertaining or Everyday Living. Additional Amenities include a  Fireplace & Wet Bar w/ SS Sink. Granite Counters In the Kitchen and Bathrooms. Freshly Updated Kitchen touts Newly Installed  SS Appliances, Stainless Steel Refrigerator, Dishwasher, Freestanding Range/Oven & SS Built-in Microwave. Oversized Primary Suite & Ensuite Bath, Offering a Large Walk in Closet & a  Sliding Glass Door to Patio. Primary Bath offers Granite Topped Vanity, Dual Porcelain Sinks & Soaking Tub/Shower Combo. Versatile 2nd Bedroom or Home Office Features Mirrored Closet Doors. Attached Carport & Storage Closets. *PerSeller",updated
26,"$351,000","2704 Deerborn St, Wylie, TX 75098",https://www.zillow.com/homedetails/2704-Deerborn-St-Wylie-TX-75098/62610024_zpid/,4, House,3,"2,294",Sharyn Vernon,,Exp Realty,"Come see this beautiful two story home located close to schools and a park.   This 4 bedroom, two and a half bathroom home boasts of coziness with two living spaces.  Fresh paint throughout, along with updated kitchen and bathrooms.    Deadline for Offers is Friday, January 14th at noon!",updated
27,"$199,500","201 Polk St, Longview, TX 75603",https://www.zillow.com/homedetails/201-Polk-St-Longview-TX-75603/2066669253_zpid/,3, House,3,"1,398",Marian Freeman,903-331-7170,COLDWELL BANKER LENHART,"Don't miss this 3/2 in Kilgore schools. Parking for 2 vehicles beside the driveway leading thru a double gate to a carport for boat or vehicle storage. 28x18 shop that is insulated, heated & cooled and has a 1/2 bath. Vaulted living room ceilings with a cozy wood burning stove to heat the whole house. Updated baths & kitchen, new paint & light fixtures.",updated
