,prices,address,beds,links,type,baths,sq_feet,Listing Agent Name,Listing Agent Contact,Listing Agent Company,Description,Key Word
41,"$430,000","6658 Chantilly Pl, Colorado Springs, CO 80922",4,https://www.zillow.com/homedetails/6658-Chantilly-Pl-Colorado-Springs-CO-80922/13540741_zpid/, House,3,"1,840",Nazreen Kashani,719-728-9506,Springs Home Finders,"Beautiful 4-level story home in Constitution Hills with a city and mountain view. As you enter the home you notice the high ceilings and natural lighting throughout. The kitchen has a view of the city, all stainless steel appliances, and LVP. Upstairs has the master bedroom and two additional bedrooms with views of the city. The finished basement has enough room for a bedroom and second living room with a half bathroom and laundry room. The home is equipped with brand new carpet throughout and a brand new thermostat. Being located on a hill allows for privacy from the backyard neighbors. This home is located close to military bases, shopping, parks and schools and has spectacular views of the mountains and city.",stainless
42,"$750,000","1380 Glencoe St, Denver, CO 80220",3,https://www.zillow.com/homedetails/1380-Glencoe-St-Denver-CO-80220/13392240_zpid/, House,2,"2,306",Jason Putnik,720-470-7353,Coldwell Banker Realty 54,"Welcome to this beautifully updated home in the historic Bellevue/Hale neighborhood. The front living room is filled with natural light from the corner windows and newly installed smart skylights w/ automatic solar powered blinds. The hardwood floors take you into the dining room that features a custom black walnut bar top w/ seating, perfect for entertaining guests in the kitchen. The updated cabinets are topped with granite counters and all of the home chef-preferred stainless steel appliances including a brand new 4-Door LG Refrigerator, gas cooktop, microwave/oven wall combo and a brand new dishwasher. The breakfast nook and converted pantry finish off this fantastic kitchen. 2 bedrooms on the main offer ample closet space and a full bath w/ a modern remodel. The basement feels like it's own separate suite with a large living room, a bedroom and 3/4 bath. The rest of the basement includes a laundry room with tons of storage, an oversized utility room and a converted exercise room. The backyard was fully renovated by the current owner with new fencing, sod and a sprinkler system installed. The covered outdoor living space is perfect for BBQing and entertaining year-round. The 2-car detached garage has a new garage door and is behind a security gate from the front driveway. The location is unbeatable! Minutes from recreation and amusement at City Park or Cherry Creek, brand new restaurants and an IMAX Theater at 9+CO (check out 9thandcolorado.com), and all of your daily needs at Trader Joes on Colorado or from the famous Marczak Fine Foods on Historic Colfax. This home is move-in ready!",stainless
43,"$849,999","2521 Cherry Way, Parker, CO 80138",3,https://www.zillow.com/homedetails/2521-Cherry-Way-Parker-CO-80138/82026361_zpid/, House,2,"3,784",Lindsay Mann,720-900-3212,Real Broker LLC,"Your Very Own Home on the Range! Nestled amongst Parker's serene rolling hills and plains, you will fall in love with this home the moment you see it sitting high on the lot with dramatic curb appeal. A truly special wrap around 360 degree deck allows you to take in the quiet surroundings, mountain views, and glorious West facing sunsets from every angle. The exterior stone detailing creates grandeur and the 3-car attached garage provides plenty of toy storage. Inside you are greeting by a lovely foyer with tall ceilings and hardwood floors. An abundance of picture windows throughout the home make the space feel light, bright, and welcoming. The warm and inviting family room features a vaulted ceiling and a feature gas fireplace. The gourmet country kitchen offers all the modern conveniences, with a full stainless steel appliance package including French door fridge, hardwood floors, and a full pantry. The sunny eat-in kitchen nook is the perfect place to gather for an informal meal or any holiday or special event. The master suite is tucked privately on the side of the home with a stunning tray ceiling, en-suite luxury 5-piece bathroom, and large walk-in closet. The two secondary bedrooms are quite spacious. This is a ranch style home, with everything conveniently on the main floor including a large laundry/mud room. The walk-out basement is finished with an oversized recreation room great for a home theater, office, playroom, billiards or game room... There's plenty of space to expand to additional bedrooms or bathrooms should it suit your needs. This is a rare opportunity to own just under 4 fully fenced acres that can accommodate horses or any animal of your choosing. With no HOA, you are free to use your land as YOU see fit. This location cannot be beat, it offers a true country setting just minutes from Downtown Parker and with great access to all major traffic thoroughfares and everything the Metro Area has to offer. Come visit and fall in love today!",stainless
44,"$825,000","6742 S Lamar St, Littleton, CO 80128",4,https://www.zillow.com/homedetails/6742-S-Lamar-St-Littleton-CO-80128/13823506_zpid/, House,3,"2,730",Bret Weinstein,303-981-1237,"BSW Real Estate, LLC","Be sure to see this one-of-a-kind, fully remodeled home in Columbine Knolls (read down to the garage!!!) You are greeted with beautiful new hardwood flooring throughout, tons of natural sunlight & an open concept floorpan that makes entertaining a dream. The kitchen has been fully redone. New stainless steel appliances, gorgeous tile flooring, slab granite countertops & built-in breakfast nook for additional seating. The living room features 1 of 2 fireplaces & has a built-in salon area that can stay as it is, or you can transform into a wet bar or an entertainer's paradise. Your upstairs master suite has a 2nd fireplace to keep you cozy, an ensuite master bath & a MASSIVE walk-in closet. Your stunning master bathroom has been completely redone & features heated floors, dual sinks & shower heads, LED mirrors, & motion sensors to light up when nature calls in the night. There is an additional 2 beds & 1 full baths with dual sinks upstairs. Plus, the upstairs laundry room makes doing laundry a breeze! Downstairs, you'll find your finished basement has a great room that makes it perfect for movie night, game night and/or any other activities you can think of. Other wonderful updates include new lighting, paint & tons built-in shelving throughout. Walk through either set of French doors on the main level to your huge, fenced-in backyard & those who have a green thumb will appreciate the designated garden beds! You can sit, relax or drink your favorite beverage either on your huge, partially covered patio with skylights or on your separate deck. An incredibly unique feature of this home is its newly built, 4-car garage that is both heated & cooled, in addition to your attached 2-car garage. The additional garage is insulted so you can use that space to tinker or for storage year round! The location is great: nearby shopping, trails, parks, Chatfield State Park, C470 & so on!",stainless
45,"$995,000","630 Cree Cir, Boulder, CO 80303",4,https://www.zillow.com/homedetails/630-Cree-Cir-Boulder-CO-80303/13189506_zpid/, House,3,"2,826",Patrick Dolan,303-441-5642,"RE/MAX of Boulder, Inc","SHOWINGS START 1PM ON THURSDAY, JANUARY 20TH! Move right into this impeccably maintained & UPDATED home in Keewaydin Meadows. The tri-level floor plan is perfectly appointed on a terrific cul-de-sac with direct  mountain views out your front door & living room & a short walk to the East Boulder Rec Center. Spacious living/dining areas w/ vaulted ceilings, exposed beams & skylights. Kitchen boasts stainless appliances & slab granite. Wood flooring thru-out on all floors. 3 bedrooms on the upper level and lower level offers a 4th bedroom, bath & family room w/ wood burning fireplace. And if this isn't enough, there is also a finished basement with rec room & office. The large fenced backyard has a nice stamped concrete patio & storage shed to store all your toys!",stainless
46,"$549,000","4761 Vallejo St, Denver, CO 80211",4,https://www.zillow.com/homedetails/4761-Vallejo-St-Denver-CO-80211/13298784_zpid/, House,2,"1,384",Ryan Lunsford,720-626-1994,Brokers Guild Real Estate,"This 4 bedroom 2 bath Sunnyside home has lots of updates and 1384 sqft of main-level living that you desire!  The remodeled kitchen features granite countertops, stainless appliances, new flooring, and an eat-in bar-top.  Two living areas provide plenty of space for 'spreading out' in the home, and the four spacious bedrooms allow for so many options - home offices, guest bedrooms, or home gyms!  Both full bathrooms have been updated in the recent past.  The detached one-car garage and carport provide plenty of parking options, and the backyard is perfect for your pets.  Easy access to highways and only two blocks from public transportation.  A great value in Sunnyside - Welcome Home!",stainless
47,"$859,900","1325 Stover St, Fort Collins, CO 80524",4,https://www.zillow.com/homedetails/1325-Stover-St-Fort-Collins-CO-80524/13905320_zpid/, House,4,"2,520",Colton Padilla,970-690-4123,URealty Inc,"Fully remodeled Mid Century Home. This beautiful, modern ranch style home boats a large backyard with a covered patio, grilling area and a gas fire pit. This property also includes a basement bar, A/C, oversized 2 car garage, RV/boat concrete pad, NO HOA, sprinkler system, shed with electricity, alley access, and NEW stainless steel appliances. This property offers an open floor plan with a modern/contemporary feel throughout the home.",stainless
48,"$325,000","6930 E Girard Ave APT 107, Denver, CO 80224",2,https://www.zillow.com/homedetails/6930-E-Girard-Ave-APT-107-Denver-CO-80224/13417141_zpid/, Condo,2,"1,200",Vivi Gloriod,303-847-1868,HomeSmart,"Beautiful two bed, two bath condominium in Southmoor Park! This condo lives large with 1,200 sq ft of finished living space and a modern open floor plan. The kitchen has recently been upgraded with new granite countertops, decorative backsplash, and new stainless steel appliances. The living room is bright and inviting due to the sliding glass doors, which lead out to the large private balcony. The primary bedroom is spacious with a large walk in closet and updated bathroom. The second bedroom has lovely dual sliding barn doors and could function as a home office or flex space. The unit includes a covered parking spot and storage in the shared garage. HOA includes heat, water, sewer, trash, and amenities. Easy access to I-25 and 285, come find your new home today!",stainless
49,"$580,000","1120 Woodford Ave, Fort Collins, CO 80521",3,https://www.zillow.com/homedetails/1120-Woodford-Ave-Fort-Collins-CO-80521/13903305_zpid/, House,1,"1,163",Cory Younie,970-391-8236,Group Centerra,"You will fall in love with this 3-bedroom 1-bath turnkey, Old Town Charmer established in a quiet neighborhood! Perfectly located between Old Town, City Park and CSU. Striking modern amenities show off the thoughtful updates which include wood plank flooring, stainless steel appliance, cabinets, and quartz countertops. All these great features give this home an extremely livable feel!  Great natural light, custom front porch, fully fenced yard, and a 1 car garage. New roof, new tankless water heater, all new electrical wiring.",stainless
50,"$600,000","789 S Presidio Dr, Pueblo West, CO 81007",5,https://www.zillow.com/homedetails/789-S-Presidio-Dr-Pueblo-West-CO-81007/82294583_zpid/, House,3,"4,116",Treasure Davis,719-888-2793,"eXp Realty, LLC","As you enter this stunning home you are greeted with vaulted ceilings and an open floor plan. The kitchen features beautiful cabinetry, stainless steel appliances, and a tankless water heater. There is plenty of space for everyone in the 5 bedrooms including 3 on the main level! You'll love the easy access to your large fenced back yard with workshop, dog pen, and plenty of room for all your outdoor activities!",stainless
51,"$820,000","6815 Spanish Bay Dr, Windsor, CO 80550",2,https://www.zillow.com/homedetails/6815-Spanish-Bay-Dr-Windsor-CO-80550/72558847_zpid/, House,3,"3,026",Jason Humpal,970-481-9429,Century 21 Humpal Inc,"Gorgeous patio home in Highland Meadows Golf Course. Breathtaking ranch backing to hole three. 3 car garage, hardwood floors, vaulted ceilings & open layout! Wonderful kitchen with granite countertops, stainless appliances. Living room fireplace, main floor study, primary suite with luxury bath & walk-in closet. Large finished daylight basement offers a large rec room, 3/4 bath and room to expand! Enjoy covered deck with privacy shades, perfect for entertaining! HOA includes snow removal, lawn care and trash!",stainless
52,"$500,000","3376 S Dunkirk Way, Aurora, CO 80013",4,https://www.zillow.com/homedetails/3376-S-Dunkirk-Way-Aurora-CO-80013/13089416_zpid/, House,4,"2,419",The Awaka Group,720-955-1953,Keller Williams Realty LLC,"You will not want to miss this move-in ready 4-bedroom, 4-bathroom home located in the heart of Seven Lakes nestled on a cul-de-sac on a large 1/3 of an acre lot! Featuring an updated kitchen including new cabinets and dishwasher and new flooring throughout. This home is the definition of open concept perfect for entertaining plus the living room has a wood burning fireplace perfect for cozying up to on those cold Colorado nights. You’ll love the kitchen with custom built-ins for extra storage, marble countertops, a feature island with stainless steel appliances and access to the fenced in backyard. The primary bedroom is perfectly located on the main floor plus has an attached full bath with plenty of counter space and a large walk-in closet. The basement provides an additional living area for hosting with a convenient wet bar and non-conforming bedroom plus bathroom great for guests or to make a perfect work from home space. Enjoy nights hanging out in the spacious backyard around the fire pit and enjoy the fruits of your labor with raised garden beds and fenced garden. This subdivision is surrounded by several parks in the neighborhood such as Seven Hills, Blue Grama Grass Park and Flanders Park and the views of Blue Grama Grass Park from the home are a treat to the eyes. Enjoy incredible dining, shopping and entertainment just minutes away including Valley Plaza shopping center with Target, King Soopers and Movie Tavern Aurora. Not only is this in the Cherry Creek School District it’s also surrounded by multiple schools all within a 15 minute drive. Call today to set up your private showing!",stainless
53,"$549,000","3014 Welton St, Denver, CO 80205",2,https://www.zillow.com/homedetails/3014-Welton-St-Denver-CO-80205/13306203_zpid/, House,1,"1,000",Cesar Reyes,303-523-0789,Megastar Realty,"Great Location! Wonderful home in Five points. This home features 2 beds and 1 bath. hardwood floors, stainless steel appliances. backyard with off-street parking. Walking distance to the light rail. minutes away from downtown Denver. Walking distance to many restaurants, bars, shops Up and coming neighborhood with modern buildings being built all around. Buyer(s) and Buyers Agent to verify all MLS data. This property is tenant occupied. Tenant is on a month to month lease. Tenant is willing to stay or go. Possible development opportunity. Buy both 3010 and 3014 Welton. Buyer and buyers agent to verify all information.",stainless
54,"$995,000","3284 Wright Ave, Boulder, CO 80301",4,https://www.zillow.com/homedetails/3284-Wright-Ave-Boulder-CO-80301/13244334_zpid/, House,4,"2,060",Michael Taylor,303-669-2744,Taylor Realty Group,"Updated 4bd home w/fin bsmnt in sought after Noble Park. Soaring vaulted clngs & lots of natural light. Cooks kitchen w/white cabinets, granite cntrs & new stainless apps. Spacious nook opens into lower family room w/ gas fp. Smart flrpln w/3 bds up & master suite boasts 5pc bath w/soaker tub & large walk in. Fin bsmt adds 3/4 bath, large 4th bdrm(could be rec room/flex space too) + addt'l bonus room (make great ofc or non conform. bdrm). Great outdoor living space w/newly stained deck & enjoy large corner lot w/mature trees! Other great features inc: Newer windows & roof*New light fixtures, Carpet, & Paint *HVAC (2020) *Radon & security system. Ideal NE Boulder location easy access to Longmont,Hwy 36 to Denver & just minutes to Pearl St, shopping/dining.",stainless
55,"$650,000","620 SE Spruce Way, Cedaredge, CO 81413",3,https://www.zillow.com/homedetails/620-SE-Spruce-Way-Cedaredge-CO-81413/103873208_zpid/, House,4,"2,903",John Freeman,970-856-3300,RE/MAX Mountain West/Cedaredge,"Take a second to enjoy the amazing Tuscan architecture of this new listing.  This gorgeous house has so much to offer that I will set the tone by starting indoors.  Walk into the entry and behold the high ceilings, wood floors, and custom inlet tile work, that all within the first two steps.  You can turn either way and the unique and beautiful finishes are going to follow you.  An open kitchen full of large knotty alder cabinets, upgraded stainless appliances and granite countertops lit with under counter lighting are what you might see.  Or you may notice the sizable separate, but not closed in, dining area.  This home boasts a wonderful split bedroom design with privacy for each bedroom area.  The laundry area continues the theme of large and open.  The master suite downstairs has a wonderful patio area to sit and enjoy views of the breathtaking landscaping.  Upstairs is what sets this home apart from any other “cookie cutter” homes.  This could be a spectacular master suite, it could be a great company suite, or you could simply make it another portion of the house that you could use for living.  There is a huge closet, its own full bathroom and a large enough area that you can let your imagination run wild.  The wood working and craftmanship doesn’t end at the front or back door though.  Step outside and enjoy professional and well-maintained landscaping, stamped and colored concrete, pergolas over two private patio’s, open wood eves and a perfect mixture of wood, glazed stucco, and stone make this home at the golf course truly one of a kind.  All of this with the convenience of having an oversized two car garage and a separate, yet attached, single car garage makes this home complete. This is not a spec home that is up for resale.  This home glows with pride of ownership.  The sellers have even completed a pre-listing inspection which is available at all showing as well as the complete set of plans for the house.  You are going to want to set some time aside to view this home, it’s not a walk through type of home, you will find a surprise around every corner.  Enjoy it.",stainless
56,"$304,900","3240 Iris Ave UNIT 208, Boulder, CO 80301",1,https://www.zillow.com/homedetails/3240-Iris-Ave-UNIT-208-Boulder-CO-80301/13223286_zpid/, Condo,1,624,Robert Jones,720-438-7560,"OfferPad Brokerage, LLC","Do not miss out on this newly renovated unit in Remington Post! This fantastic unit has all new flooring and paint throughout. The newly updated kitchen includes Granite countertops, and stainless steel appliances. A generous sized bedroom and brand new full bath. Complex has onsite gym, pool, and tennis/basketball courts. Private parking in a great location! Schedule a showing today!",stainless
57,"$304,900","3240 Iris Ave #G208, Boulder, CO 80301",1,https://www.zillow.com/homedetails/3240-Iris-Ave-G208-Boulder-CO-80301/2066825591_zpid/, Condo,1,624,Robert Jones,720-438-7560,OfferPad Brokerage,"Do not miss out on this newly renovated unit in Remington Post! This fantastic unit has all new flooring and paint throughout. The newly updated kitchen includes Granite countertops, and stainless steel appliances. A generous sized bedroom and brand new full bath. Complex has onsite gym, pool, and tennis/basketball courts. Private parking in a great location! Schedule a showing today!",stainless
58,"$79,900","2500 E Harmony Rd LOT 70, Fort Collins, CO 80528",3,https://www.zillow.com/homedetails/2500-E-Harmony-Rd-LOT-70-Fort-Collins-CO-80528/63755449_zpid/, Home,2,"1,140",Sasha Bannister,970-286-1387,eXp Realty LLC,"Located at Harmony Village Premium Lot #70 is AVAILABLE & Move-In Ready! Close to shops and right off Harmony Road & includes access to Community Swimming Pool, Park, Clubhouse & offers storage yard for your RV or Boat. The newly updated Manufactured home has Hard surface Floors throughout, Stainless Steel Appliances, forced air system for heating & air conditioning, updated fire & Carbon Dioxide alarms, new light fixtures all new flooring, new roof, new skirting & fresh paint.  Located within walking distance of schools and grocery stores making it very family friendly.",stainless
59,"$900,000","6044 S Lima St, Englewood, CO 80111",5,https://www.zillow.com/homedetails/6044-S-Lima-St-Englewood-CO-80111/13131617_zpid/, House,4,"2,988",Jie Liu,303-589-9123,"AnJoy Realty, LLC","You won't want to miss this beautiful 5 Bedrooms and 3.5Bathrooms home in the highly desirable Cherry Creek Vista South neighborhood! This community features a park w/ pool, tennis courts, and a 5-min walk to the award-winning Cottonwood Creek Elementary School. It has a walk-out basement containing a living room and bedroom, along with a full bath and a fireplace. Hardwood floors throughout the majority of the main level. The spacious kitchen has been completely renovated with wood cabinets, granite countertops, a stylish hood, and modern stainless steel appliances w/ a breakfast bar & nook. This luxurious kitchen leads to the cozy family room featuring a fireplace, vaulted ceilings, and skylights for natural light. The master bedroom features modern touches, along with 3 additional bedrooms upstairs. The roof has been replaced in December 2018. The nicely landscaped backyard features a newer deck, perfect for entertaining. Just minutes away from Cherry Creek State Park and DTC.",stainless
60,"$600,000","2465 Harlan St, Edgewater, CO 80214",3,https://www.zillow.com/homedetails/2465-Harlan-St-Edgewater-CO-80214/13749384_zpid/, House,2,984,Sheri Brown,303-499-9880,RE/MAX Alliance-Boulder,"Come see the charm of this updated 3 bedroom, 1 1/2 bath bungalow in the Heart of Edgewater! This adorable gem features a beautiful kitchen that includes newer cabinetry, granite countertops & stainless steel appliances. Hardwood floors grace the entire home with lots of windows that really let in the light. Master bedroom has en-suite full bath and walk-in closet. Outdoors you will enjoy sitting on your large covered front porch. The beautiful backyard with wood pergola is perfect for outdoor entertaining and 3 raised garden beds are all set for making the perfect salad! Large 2 car detached garage with work bench and built in shelves has plenty of room for storage. Unbeatable location within walking distance to public transportation, Old Towne Edgewater, the newer shopping areas along Sheridan and all that Sloans Lake has to offer.",stainless
61,"$425,000","1651 Carrol Ct, Thornton, CO 80229",3,https://www.zillow.com/homedetails/1651-Carrol-Ct-Thornton-CO-80229/12983279_zpid/, House,2,"1,176",Jacquelynn Sanchez,720-876-8778,Keller Williams Real Estate LLC,"This Adorable Ranch Home is located in the heart of Thornton. The minute you walk through the front door you will notice all new paint and upgrades throughout the home. Kitchen is updated with granite countertops, stainless steel appliances, and custom lighting with wood flooring throughout the home. New double pane windows from company called Power home and remodeling with lifetime warranty for new owners. New HVAC PUT IN 12-18-2020, New Rain Soft Water Filter System put in kitchen for drinking and cooking, the backyard is set up for entertaining, outdoor lighting along new backyard privacy fence and under carport. New custom outdoor heater with remote located under carport. Adorable fenced garden and adorable shed located behind garden with electricity for all your projects. Attached on side of shed is a cute little clubhouse for the kids. Owners also put in a basketball hoop located in backyard. There are 4 raspberry bushes located on side of shed and grapevine located in garden. No need to do anything but move in and enjoy. Showings will start 1/21/2022. Be sure to checkout the 3D Matterport Tour!",stainless
