,prices,address,beds,links,type,baths,sq_feet,Listing Agent Name,Listing Agent Contact,Listing Agent Company,Description,Key Word
0,"$415,000","2316 Elite Ter, Colorado Springs, CO 80920",3,https://www.zillow.com/homedetails/2316-Elite-Ter-Colorado-Springs-CO-80920/13567986_zpid/, Townhouse,4,"2,335",Brent Allen,720-988-4162,HomeSmart,"Absolute Perfection with stunning full views of Pikes peak. This wonderful townhome has 3 separate master suites or two up and a mother in law design in fully finished basement with walkout /private entry. Open floor plan /great room/ cathedral ceilings with gas fireplace and retractable awning on walkout deck for entertaining. wonderful wood floors, office cubby/ 2nd dining area and guest powder all on the main floor . The kitchen has upgraded cabinetry with slide out shelving and large pantry with slide out shelves and a wine storage, gas stove, custom back splash, granite, newer stainless appliances , finish off this well designed eat-in kitchen. Lots of wonderful natural lighting and faux wood blinds mean you simply move in.. Everything is NEW!! The upstairs suites include walk in closet and jetted tub.... Want for nothing in this extremely well designed neighborhood with lawns that you dont mow,,,, close to dining and shopping on Academy and quick access to I25 all while staying peaceful and quiet for wonderful walking..",stainless
1,"$759,900","6079 Trevino Ct, Fort Collins, CO 80528",4,https://www.zillow.com/homedetails/6079-Trevino-Ct-Fort-Collins-CO-80528/13863718_zpid/, House,4,"3,109",Carmen Stavely,970-443-1144,RE/MAX Alliance-FTC Dwtn,"Beautifully updated 2 story with lots of upgrades and very livable design flow in Golf Course Community . Kitchen includes stainless Kitchen Aid appliances, granite countertops and island.   Main floor primary suite offers ample space and luxury 5 piece bath. Upstairs you will love the large loft offering many options (office, play room, teen hang out), a 2nd suite,  plus 2 additional bedrooms with Jack and Jill bath. New high efficiency furnace and  AC, and new paver/patio out back. Full unfinished basement with bath rough-in offers plenty of room to expand, oversized 3 car garage.  All this on a large,fully fenced, corner lot with mature landscaping.  No Metro District",stainless
2,"$775,000","733 Maroon Peak Cir, Superior, CO 80027",4,https://www.zillow.com/homedetails/733-Maroon-Peak-Cir-Superior-CO-80027/13255713_zpid/, House,4,"2,800",Sue Masterson,720-352-4802,"RE/MAX of Boulder, Inc","Fantastic mountain views from this updated home backing to open space. Remodeled eat-in kitchen w/quartz countertops, tile backsplash, new lighting & fixtures & stainless Kitchen Aid appliances. Sliding glass door to delightful patio to relax & take in the lovely foothills & mountain views. Sunny, vaulted living, separate dining room & cozy family room w/gas fireplace. 4 BR up. Large primary suite has 5-piece BA, walk-in closet & great views. Fully finished basement with rec room plus office that could be converted to 5th BR. Main level laundry. Well-kept and updated over time incl lighting, water heater & furnace. Please see improvements list for more updates. Excellent, quiet open space & view location just a short distance to Eldorado K-8 and community pool. Immaculate & move in ready.",stainless
3,"$925,000","20 Snowfall Dr #9, Mount Crested Butte, CO 81225",2,https://www.zillow.com/homedetails/20-Snowfall-Dr-9-Mount-Crested-Butte-CO-81225/2067495894_zpid/, Condo,3,"1,234",Caleb Brewer,970-209-1911,Peak Property Management & Sales,"This 3 story unit lives like a true townhome as no one above or below you. You enter on the garage level which also includes a nice tiled entry, a 3/4 bath, storage and a sauna. The stairs and main living level are all hardwood floors, the master bedroom has carpet. The main living level consists of a guest bedroom and bathroom, a kitchen with stainless steel appliances, living room, real wood burning fireplace and a balcony with views of Mt. Crested Butte, Whetstone, Axtel and Emmons/Red Lady. These unobstructed views have the fully developed Pitchfork below. This unit is a quick 8 minute walk to the base area or a 2 minute walk down to the Pitchfork bus stop. The 3rd level includes the over-sized master bedroom (once two bedrooms and could easily be converted back), a full bath and bonus room which makes for a great office space or storage. Snowfall Point condos are the only set of condos on Snowfall Drive, which includes 2 buildings and only 14 units total. The pasture next door makes for great cow and wildlife watching in the summer months! The HOA has very low dues and a very healthy reserve. This condo is a must see!",stainless
4,"$594,900","21745 Whirlaway Ave, Parker, CO 80138",4,https://www.zillow.com/homedetails/21745-Whirlaway-Ave-Parker-CO-80138/13473880_zpid/, Coming soon,3,"3,365",Spencer Wilson,720-347-9595,RE/MAX Professionals,"Canterberry Crossing 2 Story BACKING TO OPEN SPACE! Kitchen Features Stainless Steel Appliances, Granite Slab Countertops and Updated Hardware. Hardwood Floors Throughout the Entire Main Floor, Vaulted Ceilings, New TANKLESS Water Heater (2019). Main Floor Bedroom/Office. New Garage Door Opener (2017). Spacious Bedrooms Upstairs (2 w/ Walk-In Closets). 5 Piece Master Bathroom Suite. Deck in the Backyard Great for Entertaining. Very Quiet Location! Full Basement is a Blank Canvass. Less Than 1 Mile From Black Bear Golf Club. Minutes Away From Downtown Parker on Mainstreet.",stainless
5,"$278,000","12594 E Pacific Cir, Aurora, CO 80014",1,https://www.zillow.com/homedetails/12594-E-Pacific-Cir-Aurora-CO-80014/2066667884_zpid/, Coming soon,1,877,Anna Bliska,720-484-9360,Coldwell Banker Realty 02,"Fully remodeled ground level condo in the highly sought-after Heather Ridge community and Cherry Creek school district! The kitchen boasts custom soft close cabinets, high-end granite countertops, pendant lights, an extra deep sink with high tech faucet, stainless steel appliances, and canned lighting. The flooring is laminate and thick carpet with tempurpedic padding. Two ceiling fans add year around comfort, and they are reversible for winter. The cozy wood burning fireplace is perfect for the cold months. New double pained windows and sliding glass door leading out to covered patio. Spacious bedroom with a large redesigned closet. New bathroom with custom soft close cabinets, spacious shower with massage shower-head, custom tile and added nook for soaps and shampoo. Added bonus: All popcorn removed from ceilings! Garage includes 8’ by 4’ overhead storage rack and Rocksolid Metallic Orange Floor Coating. The community offers a newly renovated club house that includes pool and tennis courts. Located close to almost everything including shopping, restaurants, schools, parks. Prime location with easy access to I-225, DTC, Denver Airport and downtown Denver. Just minutes to Denver RTD rail system that operates 365 days a year! Showings start Friday.",stainless
6,"$255,000","1145 Van Buren St, Pueblo, CO 81004",4,https://www.zillow.com/homedetails/1145-Van-Buren-St-Pueblo-CO-81004/14032688_zpid/, House,2,"2,058",Eric Estrada,719-722-0009,Keller Williams Partners Realty,"Take a tour of this lovely 4 bedroom, 2 bathroom home! The second you see the home from the exterior you will notice its well maintained lawn and brick siding which gives it a warm and welcoming feeling. Plenty of space in this home which features laminate and vinyl flooring throughout. Several upgrades over the years have brought new life into this home and it shows. The bedrooms are spacious, the kitchen has tile flooring with all stainless steel appliances, including the refrigerator, included. The basement has plenty of additional space with two non-conforming bedrooms, a laundry room and family room! Wait until you see the backyard! Not only is there plenty of space but you will be able to enjoy summer BBQ's and entertaining under the covered patio. The original garage has been converted to a storage shed which is great for additional storage. Don't miss your opportunity to tour this home.",stainless
7,"$895,000","216 Sawyer Cir, Winter Park, CO 80482",3,https://www.zillow.com/homedetails/216-Sawyer-Cir-Winter-Park-CO-80482/84415285_zpid/, Multifamily home,4,"1,480",Elle S Ennis,970-531-3637,Real Estate of Winter Park,"This bright and sunny end unit sits in the heart of Downtown Winter Park. Close to dining, shopping, the grocery store, sledding, and music in the park. Jump on the free shuttle for a 5 minute ride to Winter Park Resort. Unit was never used as a rental, new interior paint, new stainless steel kitchen appliances, new BBQ, new boiler, new hot water heater, and a new roof. Fully furnished (Room & Board furnishings) that are all nearly new.  Laundry is on the upper level between 2 of the bedrooms, living, kitchen and half bath on 2nd level and garage and 3rd bedroom are on the lower level. 1 Car Garage is heated and there is room for a hot tub on the back deck.",stainless
8,"$1,050,000","701 Graphite Way, Superior, CO 80027",5,https://www.zillow.com/homedetails/701-Graphite-Way-Superior-CO-80027/13255707_zpid/, House,4,"3,464",Caryn Geiger,303-441-2422,Coldwell Banker Realty-Boulder,"Great Rock Creek Home backing to Open Space with Mountain Views! Situated on a cul de sac for maximum quiet, this updated Horizon model features updated Kitchen, Stainless Appliances, Wood Flooring throughout the main level. The open floor plan makes entertaining a breeze! Main floor office with Adjoining bath, can also be a bedroom. Three bedrooms up - Finished walkout basement offers one additional bedroom, + play or office space, living area, 3/4 bath, kitchenette and additional washer/dryer.Showings Start Tuesday January 25th.",stainless
9,"$330,000","125 Davie Dr, Colorado Springs, CO 80911",3,https://www.zillow.com/homedetails/125-Davie-Dr-Colorado-Springs-CO-80911/13640083_zpid/, House,1,"1,068",Yuhuan Wick GRI,719-660-5933,Pikes Peak Dream Homes Realty,"Well maintained Ranch style home in Very quiet established area. Even though was  Remolded 3 years ago.  You still feel it is newly remolded. The owner takes care the property well.  All stainless appliances, Title counter, and backsplash.  Your kitchen walks out to the fully fenced backyard and your covered deck for your enjoyment.  In the summer you will enjoy all the beautiful landscaping.  The property easily access to military base, and shopping , Park and school.  It is hard to find the price under 350k with this kind of single family home NO HOA.",stainless
10,"$235,000","963 Tampico Ct, Colorado Springs, CO 80910",2,https://www.zillow.com/homedetails/963-Tampico-Ct-Colorado-Springs-CO-80910/13620945_zpid/, Condo,2,977,John Varga,719-510-8813,Hillside Realty,"Be prepared to fall in love with this beautifully updated two-story condo! Upon entry you are greeted with gorgeous new flooring, new paint and new baseboards throughout. The open floor plan is perfect for entertaining. New kitchen cabinets and counter tops, stainless-steel appliances, dining/living room combo with walk-out to the enclosed patio. Cozy-up to the gorgeous wood burning fireplace. Upper-level boast new carpets, 2 spacious bedrooms and a superbly remodeled bathroom. Front bedroom has breathtaking mountain views. Stack washer/dryer in unit. One car garage plus room to park a second car in driveway. Close to shopping centers, restaurants, parks and convenient access to the main highways.",stainless
11,"$500,000","856 Vernon Dr, Central City, CO 80427",4,https://www.zillow.com/homedetails/856-Vernon-Dr-Central-City-CO-80427/109708371_zpid/, Multifamily home,4,"1,954",Tony Thorpe,720-552-2127,"Crocker Realty, LLC","Stunning End Unit In The Luxury Mountain Community Of Prospector's Run. Immaculate Condition. 4 Bedrooms, 4 Bathrooms With Large Deck, Back Patio and Hot Tub. Enjoy Mountain Views and Aspen Forest From The Back Deck. Two Car Side By Side Garage and Two Compact Parking Spaces In Front. This Was A Second Home and Has Barely Been Lived In. Granite Countertops, Stainless Steel Appliances, Pantry, Bonus Office Space/Breakfast Nook. Gas Fireplace With Stone Surround. Upper Level Master Suite With Mountain and Aspen Forest Views. Lower Level Bedroom With Private Full Bathroom, Private Entry and Hot Tub Access. Easy Access To I-70 and Denver Or To World Class Skiing Via Central City Parkway. Close To Central City and Black Hawk Casinos, Opera, Museum and Fine Dining. ATV Trails, Fishing, Mountain Biking, Rafting and Rock Climbing Nearby. Ideal For a Full Time Residence Or Second Home. Must See. Home Warranty.",stainless
12,"$559,000","5156 Elm Ct, Denver, CO 80221",3,https://www.zillow.com/homedetails/5156-Elm-Ct-Denver-CO-80221/13292561_zpid/, Coming soon,2,"1,132",Amanda Watkins,303-447-3800,MODUS Real Estate,"COMING SOON!!  Updated 3 Bedroom, 2 bathroom home in the heart of Chaffee Park with easy access to parks, I-70 and Regis University.  Stainless steel appliances, tiled backsplash and concrete counters make up the contemporary kitchen.  Backyard perfect for entertaining.  1 car garage and additional parking in the back as well as off street parking in front.  Bonus shed that has been converted into a fun separate work space.  New windows, roof and siding on the home in 2018.  Showings start Thursday, January 27th.",stainless
13,"$685,000","2210 Harmony Park Dr, Westminster, CO 80234",4,https://www.zillow.com/homedetails/2210-Harmony-Park-Dr-Westminster-CO-80234/61506564_zpid/, Coming soon,3,"3,898",Leisa Sollenberger,303-304-9383,LIV Sotheby's International Realty,"Welcome home to this picture perfect residence in the coveted Village at Harmony Park neighborhood. Spacious and bright layout features 4 bedrooms, 3 full bathrooms and a large living room and dining room combo. Many, many recent upgrades and updates including a beautiful renovated kitchen with Quartz counters, stainless steel appliances, large island, and a custom built pantry/bar area. The sunny living room and dining room are adjacent to the kitchen and perfect for entertaining. Gleaming hardwood floors in the main living areas! The first floor features a large primary suite with walk-in closet and updated five-piece bathroom. French doors lead to the front covered porch to enjoy peaceful mornings!  Second bedroom and full bathroom also located on main floor- perfect for guest room or home office. The upstairs features two additional bedrooms and another full, updated bathroom. The basement is massive and ready to be fully finished... endless possibilities of adding additional bedrooms and bathrooms. Great corner lot location! Backyard was just reimagined with large turf grass area and large patio with pergola. Other notable updates include complete interior paint, complete exterior paint, new carpet on the main floor and basement stairs, updated bathrooms, new cabinet hardware, lighting more! Owned Solar Panels! Two car attached garage, mature landscaping in front yard and access to community pool! **SHOWINGS BEGIN FRIDAY JANUARY 28TH**",stainless
14,"$249,000","1812 6th Street Rd, Greeley, CO 80631",1,https://www.zillow.com/homedetails/1812-6th-Street-Rd-Greeley-CO-80631/14071829_zpid/, House,1,498,Claudia Velasco Attard,970-213-2024,"Welcome to Realty, LLC","Remodeled home with new roof, windows, paint inside/outside, wood flooring, windows, kitchen with quartz countertop, stainless steel appliances, and bath!",stainless
15,"$749,000","3175 Vance St, Wheat Ridge, CO 80033",5,https://www.zillow.com/homedetails/3175-Vance-St-Wheat-Ridge-CO-80033/13739692_zpid/, House,3,"3,195",Ashia Barela,303-898-7703,LISTINGS.COM,"Opportunity awaits! This open ranch floorplan in the heart of Wheat Ridge has 2 car garage, mature landscaping and solar.  The updated kitchen addition boasts stainless steel appliances including double ovens, gas stove top, dishwasher and refrigerator.  The oversized master bedroom is spacious with attached 5-piece private bathroom.  There are two additional bedrooms on the main floor along with bathroom.   Come see this private backyard oasis with over 9,000 square feet, wrap around decking, and gardening area. The basement is finished making the square footage of this home 3195 with a large bonus room, two additional bedrooms and a bathroom.  Let your imagination run wild with all that can be created. You are minutes from Highlands, Sloan’s Lake, Downtown, Edgewater and Belmar, truly an ideal Wheat Ridge location.",stainless
16,"$170,000","1871 S Pitkin Cir UNIT A, Aurora, CO 80017",1,https://www.zillow.com/homedetails/1871-S-Pitkin-Cir-UNIT-A-Aurora-CO-80017/13073852_zpid/, Condo,1,738,Jennifer Sells,303-877-2908,"eXp Realty, LLC","Aggressively priced condo in the heart of Brittany Highlands.  Interior end unit with one bedroom, one bath with wood burning fireplace and patio. Ground level location. This kitchen comes with white cabinets, stainless appliances, an eat-in area, and all appliances stay. Laundry in unit Washer/ Dryer Included. New furnace to be installed before closing. Dedicated parking space. Great community with pool, clubhouse, lots of amenities, and water is included. Quick possession possible.  Ready for your personal touch.",stainless
17,"$1,450,000","1400 Kenosha Dr, Larkspur, CO 80118",6,https://www.zillow.com/homedetails/1400-Kenosha-Dr-Larkspur-CO-80118/82022764_zpid/, House,9,"9,570",Robert Tait,303-888-0194,Engel & Volkers Denver,"Elegant custom estate perched high upon your own mountain top, with views of mountains and surrounded by massive pine trees providing privacy and a magnificent sense of serenity. Just a few turns up your winding driveway leads you to a massive deck and front door, setting the scene for a striking entry into a impressive foyer filled with tile mosaics. To the left is a oversized dining room with custom built-ins, to the right is your home office complete with shelves to display your treasures. Through the foyer lays an incredible floating staircase showcasing the wood beamed living room just beyond. Floor to ceiling windows pour light onto the living room kept cozy by a massive fireplace. The lavish chef’s kitchen overlooks the living room delivering a uniquely intimate feel filled with stainless steel appliances and miles of granite. A wall of windows leads to the breakfast nook just beyond the kitchen. The exceptional main level Master Retreat is just steps from the living room but feels miles away. Filled with warmth from its own fireplace, the Retreat allows for ample room to relax with the Master Bath and its extravagant soaking tub to help to melt away any remaining stress. Three walk-in closets place the retreat over the top with room for even the largest wardrobes. Another bedroom, 3 baths and the laundry finish off the main floor with access to the 3 car garage. Take the elevator to the top of the world for a bonus retreat featuring a balcony and two bedrooms each with their own bath. Or take the elevator to the ground floor filled with entertainment: a theater room and bar with space for a game room, pool room or whatever your heart desires. Two more bedrooms and 3 additional baths round out this floor with a massive storage room. Outside you will find an outdoor kitchen filled with a grill and chilling cabinet covered by a stunning pergola. The entertainment hub outside is anchored by a massive fireplace flanked by gorgeous waterfalls-a gardeners dream.",stainless
18,"$424,900","17 Alder Dr, Paonia, CO 81428",3,https://www.zillow.com/homedetails/17-Alder-Dr-Paonia-CO-81428/103871794_zpid/, House,3,"1,528",Tammy Geisler,970-201-5691,RE/MAX Mountain West/Paonia,"Just like new!  You've got to come see this renovated home in Paonia.  Once inside the front door, head up to the open living room/kitchen space complete with fireplace, new carpet, and fresh paint. Sliding glass doors let in tons of light from the back yard patio.  And how about that BRAND NEW KITCHEN with new stainless-steel appliances, new flooring, new countertops? Wow! Head up a 1/2 flight of stairs and off the central hallway you'll find three bedrooms with generous closets and renovated bathrooms.  At the lower level, there's a tidy 2-car garage and combined powder/laundry room.  The landscaped yard has mature trees, and the back yard is fenced for your playful pets.  Come see what the seller has done to improve this property, you won't be disappointed!",stainless
19,"$524,950","5323 S Malta Way, Centennial, CO 80015",4,https://www.zillow.com/homedetails/5323-S-Malta-Way-Centennial-CO-80015/13112321_zpid/, House,4,"1,707",Scott Dock,303-779-5996,MB S Dock Realty Co,"Don't miss out on a fantastic opportunity. This home is in a wonderful neighborhood with lots to offer, walk up to the great front covered patio and enter the home of your dreams. Ready for someone to move into and make it their own home. The house sits on a larger lot with two wonderful decks, one off the master bedroom with gorgeous mountain views, the other deck is overlooking the large back yard which has a garden area. The roof and exterior painting were done a year ago. The open kitchen has stainless steel appliances and overlooks a cozy family room with a gas fireplace. The master bedroom has a wonderful deck off of it, two closets, 4-piece bath with double sinks and a tub. The other two bedrooms share a full bath between the two rooms. The garden level basement is finished with another bedroom and 3/4 bath. This home is everything anyone want start with. Must see to believe and a real keeper. You will fall in love with the views, neighborhood and home!!!",stainless
20,"$380,000","429 E Hahns Peak Ave, Pueblo West, CO 81007",3,https://www.zillow.com/homedetails/429-E-Hahns-Peak-Ave-Pueblo-West-CO-81007/14021668_zpid/, House,3,"2,732",William Donahue,719-240-3327,Makes It Happen RE LLC.,"Mr. and Mrs., clean live here, super nice layout ready for new owners. Newer hardwood floors and newer kitchen including granite counter tops. Newer stainless-steel appliances in the bright gally kitchen. A custom huge pantry for all the extra kitchen tools and a fold out ironing board in the laundry room. All appliances stay along with the washer and dryer. A gas log to enjoy on those cool winter nights in the living room. Great views of Pikes Peak from the breakfast nook and the two back decks. One deck is wrap around and the other is for the master suite along with a private bath and a nice size walk in closet.   A large man cave or office downstairs perfect for those Sunday football games along with a guest bedroom and large bath. The garden level lets in lots of light so the unfinished part can be used for work or hobbies. The two-car garage is also heated for a warm car on cold winter mornings or just for tinker in the garage comfort. big shed out back for tools or toys to maintain the 1.13 ac corner lot. Close to schools, walking path and shopping on Percel or McCulloch. No work to do here, just move in and enjoy. Call now, won't last long.",stainless
21,"$389,900","1374 Hillcrest Ave, Colorado Springs, CO 80909",3,https://www.zillow.com/homedetails/1374-Hillcrest-Ave-Colorado-Springs-CO-80909/13607188_zpid/, House,2,"2,210",Kevin R Conolty,719-640-3232,The Cutting Edge,"THIS BEAUTIFUL AND CHARMING HOME IS A MUST SEE! THIS CENTRALLY LOCATED HOME HAS MANY FEATURES AND UPGRADES INCLUDING: BEAUTIFUL HARDWOOD FLOORS THROUGHOUT THE MAIN LEVEL, NEWLY REMODELED KITHCHEN WITH CERAMIC FLOORS, CUSTOM CONCRETE COUNTERS, STAINLESS STEEL APPLIANCES INCLUDING THE OVERHEAD VENT HOOD ABOVE THE OVEN/RANGE. THE LIVING AND DINING ROOMS HAVE HUGE PICTURE WINDOWS MAKING FOR AN OPEN AND BRIGHT LIVING AREA. THE BASEMENT BOASTS A HUGE FAMILY AREA WITH BRAND NEW CARPET AND A WOOD BURNING STOVE PERFECT FOR A THEATER ROOM, WORKOUT AREA, KIDS' PLAYROOM AND MORE! ALSO THE BASEMENT HAS A LARGE BEDROOM, BATH, HUGE LAUNDRY AND STORAGE ROOM AND HAS ITS OWN SEPERATE ENTRANCE FROM THE OUTSIDE, PERFECT FOR GUESTS OR TO RENT! THE LARGE 1/5 ACRE LOT IS TREED AND IS VERY LUSH AND BEAUTIFUL IN THE SUMMER. OTHER FEATURES INCLUDE: OUTDOOR COVERED SIDE PORCH WITH EXTERIOR FIREPLACE, AND NEW WATER HEATER IN 2021, CENTRAL AIR CONDITIONING. CONVENIENTLY LOCATED WITH QUICK ACCESS TO THE ACADEMY AND POWERS CORRIDORS, I-25, DOWNTOWN AND ETC. COME TOUR YOUR DREAM HOME TODAY!",stainless
22,"$365,000","4308 Levi Ln, Colorado Springs, CO 80925",3,https://www.zillow.com/homedetails/4308-Levi-Ln-Colorado-Springs-CO-80925/13545604_zpid/, House,2,"1,320",Michele Gwin,303-947-7743,RE/MAX Professionals,"Great opportunity to own a 3 bedroom, 3 bathroom home! The main level features vaulted ceilings along with newer paint and carpet, Relax and enjoy the open family room.  Updated kitchen features white cabinetry and stainless steel appliances.  The primary bedroom suite as a large walk-in closet and private bathroom.  The lower level provides two additional bedrooms, a full bath, and laundry.  This wonderful home is ready for you to move right into!",stainless
